id,bid,正文,头条文章url,原始图片url,视频url,位置,日期,工具,点赞数,评论数,转发数,话题,@用户,完整日期,是否原创,源用户id,源用户昵称,源微博id,源微博bid,源微博正文,源微博头条文章url,源微博原始图片url,源微博视频url,源微博位置,源微博日期,源微博工具,源微博点赞数,源微博评论数,源微博转发数,源微博话题,源微博@用户,源微博完整日期
5104403264047214	,P1Qy2gYRE,"#寿星公修复##脂肪填充过量##FOS##FFOS##馒化脸修复# 
外院额部填充过量，曾尝试注射溶脂效果不佳。检查发现额部静态膨隆鼓胀，失去自然的额结节和眉弓骨性表现点，动态下表情不自然，凹凸不平。采用超声脂肪乳化+全层次额颞部吸脂手术，术中取出17毫升脂肪组织，术后即刻基本还原额颞部原有形态，外观平整，未见凹凸不平。",,"https://wx4.sinaimg.cn/large/b8f3eb63gy1hvxtip5x6dj20u014v0zp.jpg,https://wx4.sinaimg.cn/large/b8f3eb63gy1hvxtioqx0hj20u014vn3p.jpg,https://wx4.sinaimg.cn/large/b8f3eb63gy1hvxtipvdxrj20r20qlag3.jpg,https://wx3.sinaimg.cn/large/b8f3eb63gy1hvxtioc8ubj20u014v104.jpg,https://wx2.sinaimg.cn/large/b8f3eb63gy1hvxtiphyo2j20u014vtfq.jpg",,,2024-11-25T01:07:16,,1,0,0,"寿星公修复,脂肪填充过量,FOS,FFOS,馒化脸修复",,2024-11-25 01:07:16,True
5103572438221260	,P1uVZyuIY,提高胶原蛋白的表达，改变间隙致密性，让浅层组织向深层贴合，是面部提升和注射收紧的应有思路。此案例使用#艾塑菲#，使用内外轮廓#韧带注射提升打法#达成了紧致提升外轮廓的效果。具体治疗方案D4-D6配比：后颞区、侧面颊，鼻唇沟、木偶纹皮下D6钝针平铺注射+颧皮韧带，上、下颌韧带D4浓度锐针骨膜上注射。安全性上，PDLLA完全可被代谢为水和二氧化碳，生物相容性优越，不留残余物质。,,"https://wx1.sinaimg.cn/large/b8f3eb63gy1hvv62y07yvj21090o4tje.jpg,https://wx3.sinaimg.cn/large/b8f3eb63gy1hvv62yfbvtj21090o4gvw.jpg,https://wx3.sinaimg.cn/large/b8f3eb63gy1hvv62xizocj21090o4dqa.jpg",,,2024-11-22T18:05:52,,0,2,0,"艾塑菲,韧带注射提升打法",,2024-11-22 18:05:52,True
5103237036249513	,P1md1qdMB,,,,,,2024-11-21T19:53:06,会员特权专用,0,0,0,,,2024-11-21 19:53:06,True
5102880267175593	,P1cVAu6Hn,今天受邀参加金达威可变聚焦超声刀华东区发布会，分享了其在全层次（2.0-2.5-3.0-3.5-4.0-4.5mm）皮肤抗衰的临床应用，突破性技术在于可变聚焦技术实现了真正的全层次紧致，超短脉宽技术和滑动操作不仅更方便快捷，而且也提高了舒适度。切身感受到当前国内的医美的技术革新已经到了快车道，逐渐走到了国际领先。,,"https://wx3.sinaimg.cn/large/b8f3eb63gy1hvsyr89rkjj20ts1jygsr.jpg,https://wx2.sinaimg.cn/large/b8f3eb63gy1hvsyr90ey8j20u015jgpt.jpg,https://wx3.sinaimg.cn/large/b8f3eb63gy1hvsyr8mssej20tq1ccdlf.jpg,https://wx4.sinaimg.cn/large/b8f3eb63gy1hvsyr9d7pqj20r20um40h.jpg,https://wx2.sinaimg.cn/large/b8f3eb63gy1hvsyr9w5nmj20r20uw0v0.jpg,https://wx2.sinaimg.cn/large/b8f3eb63gy1hvsysn2nvij20u00x2dib.jpg",,,2024-11-20T20:15:25,,1,0,0,,,2024-11-20 20:15:25,True
