id,bid,正文,头条文章url,原始图片url,视频url,位置,日期,工具,点赞数,评论数,转发数,话题,@用户,完整日期,是否原创,源用户id,源用户昵称,源微博id,源微博bid,源微博正文,源微博头条文章url,源微博原始图片url,源微博视频url,源微博位置,源微博日期,源微博工具,源微博点赞数,源微博评论数,源微博转发数,源微博话题,源微博@用户,源微博完整日期
5105256948302078	,P2cKWyPKu,"玫瑰痤疮要注意的两件事
1少吃热烫食物
2少熬夜
第一条我尤其重视。我已经很多年没有复发了，但是只要吃热烫的米线，基本上吃完之后整个脸特别是脸颊+眉心三角+眼圈，就是紫红色。是真的发紫的那种。这个没办法，纯粹后遗症。这时候如果直接洗澡会更紫红，脸皮也会烫。
少熬夜就更不用说了，熬夜本身就容易导致皮下血管扩张，我熬夜第二天起来全脸煞白+脸蛋通粉，像特效，反正肉眼可见得不好看。 
这个情况急救的办法也很简单。就是冰敷。除此之外没有其他用。口服💊我不太愿意吃，毕竟也没到不舒服的程度。有时候我配合润刻退红凝胶一起冷敷，效果会更好些。
有时候在网上看其他玫瑰皮分享自己自愈之后可以吃很多热烫的东西都好羡慕",,,,,2024-11-27T09:39:29,三星S20+ 5G,42,8,4,,,2024-11-27 09:39:29,True
5105255425246774	,P2cIum0Vo,帮忙转发维权。图14 15 16肉眼清晰可见出现面部凹陷、不对称。目前无法修复。,,,,,2024-11-27T09:33:27,三星S20+ 5G,1,1,1,,,2024-11-27 09:33:27,False,7914773866,ljq轮廓避雷_举报sqj,5105066781967859	,P27Oe8fVF,"举报西安交通大学第二附属医院、前唐都医院，李金清轮廓事由，术后致残。@1818黄金眼 @澎湃新闻 @新浪新闻 @郭军颌面外科 @蓝莓医生 @整形医生修志夫 @健康中国 @西安交通大学第二附属医院 @上海九院韦敏教授 
ljq轮廓术后反馈 李金清面部轮廓整形 ",,"https://wx1.sinaimg.cn/large/008DDAf0gy1hvzxoaydqqj30u01t2n2r.jpg,https://wx3.sinaimg.cn/large/008DDAf0gy1hvzxkyk3z9j30u01t2qca.jpg,https://wx1.sinaimg.cn/large/008DDAf0gy1hvzxkwdxjxj30u01t2k17.jpg,https://wx2.sinaimg.cn/large/008DDAf0gy1hvzxkz9li7j30u01t2k1m.jpg,https://wx2.sinaimg.cn/large/008DDAf0gy1hvzxl033wwj30u01t2tjm.jpg,https://wx1.sinaimg.cn/large/008DDAf0gy1hvzxl0t7ynj30u01t2491.jpg,https://wx1.sinaimg.cn/large/008DDAf0gy1hvzxl1myfbj30u01t2gw1.jpg,https://wx4.sinaimg.cn/large/008DDAf0gy1hvzxl25bsej30u01t2wgp.jpg,https://wx1.sinaimg.cn/large/008DDAf0gy1hvzxnmjpr0j30u01t2gvm.jpg",,,2024-11-26T21:03:51,iPhone 15,62,9,48,,"1818黄金眼,澎湃新闻,新浪新闻,郭军颌面外科,蓝莓医生,整形医生修志夫,健康中国,西安交通大学第二附属医院,上海九院韦敏教授",2024-11-26 21:03:51
5105042564580329	,P27bajdyh,想你 ,,https://wx3.sinaimg.cn/large/007BmRHZgy1hvzv5gjjwoj30j9140afv.jpg,,,2024-11-26T19:27:37,三星S20+ 5G,12,1,0,,,2024-11-26 19:27:37,True
5104701424539291	,P1YiWj2Sn,今夕是何年，已经可以蓝v吵架了吗,,,,,2024-11-25T20:52:03,三星S20+ 5G,3,0,1,,,2024-11-25 20:52:03,False,1721030997,网易云音乐,5104575268520937	,P1V1szKGt,致QQ音乐：少一点跟随式“更新”，多一点真正的创新 ,,https://wx2.sinaimg.cn/large/001StgMtly1hvyhyae4g6j60u06bgb2a02.jpg,,,2024-11-25T12:30:45,,273644,15106,16963,,,2024-11-25 12:30:45
5103826990269941	,P1Byz18dT,"上颌窦或者牙槽骨要补骨的话看一下cerabone
这个材料要比biooss好很多 ",,,,,2024-11-23T10:57:22,三星S20+ 5G,3,1,0,,,2024-11-23 10:57:22,True
5103223677648992	,P1lRtw5QQ,"杭州萧山的女性关怀诊所！
一直都在国内找这种纯粹关注女性生理心理健康的诊所。因为我有多年的激素问题，还有很严重的经期综合症，情绪起伏过大，甚至会有很严重的痛经和排卵期出血。所以一直在治疗。
相比三甲流水线，mia的私密性更强，也更细致。除了正常的激素治疗之外，也会有心理疏导师帮忙排遣压力。很耐心，而且很温柔。每次来都感觉被一团棉花糖兜住，非常放松。
并且我在这边做了hpv/tct检查，和之前在三甲做的不一样，这边做的检查工具虽然也要放进身体里，但是完全不会痛，是很温柔一点点帮忙检查。
加上定期来疏导激素问题，我现在的情绪状态都有很好的改善，特别是一些经期躁郁情绪都有很好的缓解。唇色面色也都比以前好太多了。
整体装修风格是非常女性主义的玫红色，氛围很安静，医生专业度很高，感觉像是经济舱的价格，头等舱的服务。
我在他家会定期做盆底肌和卵巢抗衰，我姐姐在这边做腹直肌产后聚拢，都是非常有效果的改善。
我和我姐姐都一直以为盆底修复只有产后需要做，但来过才知道其实产前也是要做的，特别是我姐姐现在二胎，腹直肌训练可以很大程度提升顺产率。
并且腹直肌修复不是只有产后一段时间可以做，如果曾经产后没有调理，现在做也是可以的，腹直肌修复十年不晚，什么时间开始都可以。腹直肌修复对女性育儿生涯中保护腰椎健康极其有帮助。
如果关注女性健康我会很推荐来到这边。医护人员素质非常高，对婚育女性和工作女性来说，这种精神压力舒缓真的很有必要。",,"https://wx4.sinaimg.cn/large/007BmRHZly1hvtunby1ruj320v327kjl.jpg,https://wx4.sinaimg.cn/large/007BmRHZly1hvtunhx6fgj33o65kae86.jpg,https://wx2.sinaimg.cn/large/007BmRHZly1hvtunvqe6xj33sg5og1l2.jpg,https://wx3.sinaimg.cn/large/007BmRHZly1hvtuo5f8b4j35og3sgnpm.jpg,https://wx2.sinaimg.cn/large/007BmRHZly1hvtuoag1ibj332g2awnpe.jpg,https://wx1.sinaimg.cn/large/007BmRHZly1hvtuogyrqrj33pe5jvnpi.jpg,https://wx1.sinaimg.cn/large/007BmRHZgy1hvy993iearj30u018war8.jpg,https://wx2.sinaimg.cn/large/007BmRHZgy1hvy99450zjj30u0117amf.jpg,https://wx4.sinaimg.cn/large/007BmRHZgy1hvy994x9bzj318w0u0wtx.jpg",,,2024-11-21T19:00:00,三星S20+ 5G,14,3,3,,,2024-11-21 19:00:00,True
5103158579692956	,P1katEFA0,回复@blog立方米:不是的。攀比恰好是因为麦强烈的个人需求（价值实现诉求）没有被满足。麦和李两个人都无法在亲密关系中衡量个人价值。她自我认知失调，只能不断依靠外界比较来确定自己的位置。这是很危险的状态。她和李两个人都在受困于这一状态。所以需要专业治疗。我讲的内容很清楚啊，有啥不容易理解的吗？,,,,,2024-11-21T14:41:20,三星S20+ 5G,6,0,0,,blog立方米,2024-11-21 14:41:20,False,6965103931,Aphrodisiacal_curve,5102456354636376	,P11TRjs8g,"我真的没有办法责怪麦琳，因为她的状态真的很像我妈妈。在充分社会化之前就选择了回归家庭，在那之后遇到了自我锚定的重要问题，几乎家里面的所有成员都是希望他们可以成为一个贤妻良母的角色去平衡家里的内务，但是他们实际上是会有强烈的个人追求。
我妈妈很多的痛苦就是来自于他的人生规划和理想与他所处现状的强烈不平衡导致他没有办法自我调试，毕竟世界上很难从身边获得理解和支持，最终导致了强烈的抑郁症。
我曾经有十年都长期跟我妈妈相处在一起，我也对她有很多的不理解，并且我的不理解在很多时候因为要照顾到她的治疗，都只能压抑在我自己心里。所以我非常理解麦琳有时候表现出来的狂躁和对他人的极度索求。这是心理疾病的一种具象化表现。
我会觉得麦和李是完全不适合在一起，无关对错，而是他们根本无法让对方变得更完整，他们无法彼此帮助。
而大众对麦的责备也充分展现出了在我们这片土壤上为什么会滋生如此多的【树先生】。",,,,,2024-11-19T16:10:56,三星S20+ 5G,158,22,9,,,2024-11-19 16:10:56
5102770900697411	,P1a5c2Vqz,嘿嘿嘿嘿嘿2NE1我来了 ,,https://wx2.sinaimg.cn/large/007BmRHZly1hvsm8zqgiuj30qw0zuaiu.jpg,,,2024-11-20T13:00:49,三星android智能手机,18,4,0,,,2024-11-20 13:00:49,True
5102729062516714	,P18ZIayIa,回复@哦你喜:其实我完全理解为什么很多人和麦琳在一起会难受，因为我和我妈妈在一起相处也经常难受。只是我陪她治疗了十年我知道很多时候是她的身体已经出现了问题所以没办法正常调节了。这个情况需要的是专业医疗，我们普通人做不到任何有效的帮助，唯一该做的就是不要去刺激。尽可能保持距离是对彼此的有效帮助。,,,,,2024-11-20T10:14:35,三星S20+ 5G,1,2,0,,哦你喜,2024-11-20 10:14:35,False,6965103931,Aphrodisiacal_curve,5102456354636376	,P11TRjs8g,"我真的没有办法责怪麦琳，因为她的状态真的很像我妈妈。在充分社会化之前就选择了回归家庭，在那之后遇到了自我锚定的重要问题，几乎家里面的所有成员都是希望他们可以成为一个贤妻良母的角色去平衡家里的内务，但是他们实际上是会有强烈的个人追求。
我妈妈很多的痛苦就是来自于他的人生规划和理想与他所处现状的强烈不平衡导致他没有办法自我调试，毕竟世界上很难从身边获得理解和支持，最终导致了强烈的抑郁症。
我曾经有十年都长期跟我妈妈相处在一起，我也对她有很多的不理解，并且我的不理解在很多时候因为要照顾到她的治疗，都只能压抑在我自己心里。所以我非常理解麦琳有时候表现出来的狂躁和对他人的极度索求。这是心理疾病的一种具象化表现。
我会觉得麦和李是完全不适合在一起，无关对错，而是他们根本无法让对方变得更完整，他们无法彼此帮助。
而大众对麦的责备也充分展现出了在我们这片土壤上为什么会滋生如此多的【树先生】。",,,,,2024-11-19T16:10:56,三星S20+ 5G,158,22,9,,,2024-11-19 16:10:56
5102727998735459	,P18XZAEuv,转发澄清:已经配合市场规定做出调整。,,,,,2024-11-20T10:10:21,三星S20+ 5G,2,0,0,,,2024-11-20 10:10:21,False,2037441407,百雀羚,5102721893402030	,P18O9eh1s,百雀羚针对近日舆论关注的添加禁用原料的情况说明  ,,https://wx1.sinaimg.cn/large/7970e37fgy1hvsgm3zj6jj22ju3lyh5y.jpg,,,2024-11-20T09:46:06,微博网页版,151367,10793,24232,,,2024-11-20 09:46:06
5102456354636376	,P11TRjs8g,"我真的没有办法责怪麦琳，因为她的状态真的很像我妈妈。在充分社会化之前就选择了回归家庭，在那之后遇到了自我锚定的重要问题，几乎家里面的所有成员都是希望他们可以成为一个贤妻良母的角色去平衡家里的内务，但是他们实际上是会有强烈的个人追求。
我妈妈很多的痛苦就是来自于他的人生规划和理想与他所处现状的强烈不平衡导致他没有办法自我调试，毕竟世界上很难从身边获得理解和支持，最终导致了强烈的抑郁症。
我曾经有十年都长期跟我妈妈相处在一起，我也对她有很多的不理解，并且我的不理解在很多时候因为要照顾到她的治疗，都只能压抑在我自己心里。所以我非常理解麦琳有时候表现出来的狂躁和对他人的极度索求。这是心理疾病的一种具象化表现。
我会觉得麦和李是完全不适合在一起，无关对错，而是他们根本无法让对方变得更完整，他们无法彼此帮助。
而大众对麦的责备也充分展现出了在我们这片土壤上为什么会滋生如此多的【树先生】。",,,,,2024-11-19T16:10:56,三星S20+ 5G,158,22,9,,,2024-11-19 16:10:56,True
5102428116224475	,P11ajq7gL,我前面说过的铃铛线，案例。可以看一下。另外还有个🇰🇷医生做的也不错。姓洪。《Thread Lifting Techniques for Facial Rejuvenation and Recontouring》的作者。,,,,,2024-11-19T14:18:44,三星S20+ 5G,3,2,1,,,2024-11-19 14:18:44,False,2161625057,皮肤科医生李晓宁,5090495023550219	,OBYbIeTzB,#2024amwc# 铃铛线相对来说弹性比较好，即刻效果不如大v线效果直接有效，但是这位日本医生的案例都是年纪偏大的患者，本身是很难出很明显的即刻效果的，把上年纪的客户做出效果才是真本事。 ,,"https://wx4.sinaimg.cn/large/80d7c7e1gy1hupgalekfrj21400u0tco.jpg,https://wx2.sinaimg.cn/large/80d7c7e1gy1hupgaltx47j20u0140q6u.jpg,https://wx2.sinaimg.cn/large/80d7c7e1gy1hupgam98ijj20u0140wj4.jpg,https://wx4.sinaimg.cn/large/80d7c7e1gy1hupgamrfq7j21400u0jum.jpg,https://wx3.sinaimg.cn/large/80d7c7e1gy1hupgan6rjyj21400u0ad6.jpg,https://wx1.sinaimg.cn/large/80d7c7e1gy1hupgankw2aj20u0140ju7.jpg,https://wx1.sinaimg.cn/large/80d7c7e1gy1hupgao1q6aj21400u0435.jpg",,,2024-10-17T16:00:53,华为 Mate X5 典藏版,12,1,2,2024amwc,,2024-10-17 16:00:53
5102427286537926	,P118YrqOq,玻尿酸或者肉毒瘦脸打多了，可以用射频加速代谢。少女枪，热玛吉，都行。 ,,,,,2024-11-19T14:15:26,三星S20+ 5G,5,7,1,,,2024-11-19 14:15:26,True
5102184356644274	,P0UP9rStI,再讲一遍，pcl不适合做线。尤其是跃升。我自己看下来觉得比较好的是铃铛。,,,,,2024-11-18T22:10:07,三星S20+ 5G,5,0,1,,,2024-11-18 22:10:07,False,6965103931,Aphrodisiacal_curve,5044596406488165	,OiI9GrdRP,"线雕功课之：不要做悦升线。
悦升线目前基本上好的大夫都不用了。但凡有点良心就不会推荐这个。pcl材质虽然硬、吸收慢，但问题是，它吸收的时候，是从中间断裂开的。
所以很多人后期揉脸揉到一半，线会穿出来。
不是只有一个大夫在说这个情况，我面的其中一位已经算是整形美容三甲的专家了，也这么说。
修不了。因为这个是材料吸收特性决定的。",,,,,2024-06-13T00:16:10,三星S20+ 5G,19,15,8,,,2024-06-13 00:16:10
