id,bid,正文,头条文章url,原始图片url,视频url,位置,日期,工具,点赞数,评论数,转发数,话题,@用户,完整日期,是否原创,源用户id,源用户昵称,源微博id,源微博bid,源微博正文,源微博头条文章url,源微博原始图片url,源微博视频url,源微博位置,源微博日期,源微博工具,源微博点赞数,源微博评论数,源微博转发数,源微博话题,源微博@用户,源微博完整日期
5102525391307647	,P13Hd5ub5,中国有个成语，鸠占鹊巢，说的就是外来的鸟做强做大后，把本地的鸟赶走，这里面有非常有意思的一个命题，就是到底是巢选择了最强的鸟，还是最强的鸟占了巢，我看新闻，加拿大引进了印度人，结果印度人呼啦啦一阵狂生，逐渐起势了，现在宣城白人滚回欧洲，加拿大那个苦寒之地是他们印度阿三的，这是一个贼有意思的话题，为什么西洋统治者愿意引进印度阿三，并且明知道会出现鸠占鹊巢的情况还在加大力度引进，很简单，西洋统治者认为自己是统治阶级，只要契约在手，谁给他干活都一样，所以现在北美的白人、黑人，华人面临一个超级现实的问题，即当地统治阶级要置换人口，认为这三类人太贵了，道理就这么简单，只要生产力水平不怎么进步，考虑问题的核心要点一定就不是什么以人为本，而是以本为本，除非你是占统治地位的阶级，你会被统一的retire,,,,,2024-11-19T20:45:16,微博网页版,717,60,39,,,2024-11-19 20:45:16,True
5102512752821286	,P13mPbPWC,今年环境方面出现海水倒灌这个字眼，值得关注，气候升温这是无法避免的，沿海城市有的地方资产价值会重估的 ,,,,,2024-11-19T19:55:03,iPhone 15 Plus,430,56,13,,,2024-11-19 19:55:03,True
5102509502760981	,P13hAbAfX,"6g又要来了
需要总结下，我们被5g改变了什么🤔 ",,,,,2024-11-19T19:42:08,iPhone 15 Plus,735,128,16,,,2024-11-19 19:42:08,True
5102504893221788	,P13a9dw8k,美国如果大规模遣返移民，肯定是用海运的，一船塞几千人，两船就是一万，如果不想走，就去劳改 ,,,,,2024-11-19T19:23:49,iPhone 15 Plus,285,58,12,,,2024-11-19 19:23:49,True
5102491828225006	,P12P4yvHo,欧盟要求中国企业在欧洲设厂并分享技术不就是当年我国改开初期吸引外资要求技术转让吗，此一时彼一时的，如果我们技术研发一直领先，可以转让稍微落后的技术的……另外我国的很多工业技术和人绑得很厉害，欧盟在接受这些技术引进的时候需要考虑降低人权阈值 ,,,,,2024-11-19T18:31:54,iPhone 15 Plus,433,37,13,,,2024-11-19 18:31:54,True
5102482123130146	,P12zqd8ie,"长期资金就是套牢的不在乎本金的资金
说话文邹邹的 ",,,,,2024-11-19T17:53:20,iPhone 15 Plus,369,55,18,,,2024-11-19 17:53:20,True
5102389055194998	,P109jlNsi,经济不好，有些人精神会不稳定，大家多与人和善，注意没事儿不要扎堆，另外家庭内部最好模拟下遇到紧急情况的应对，类似美国那种听到响声要有条件反射，平时外出眼神多看开阔点，繁荣可以掩盖一切矛盾，现在时代不同了 ,,https://wx3.sinaimg.cn/large/63912bc0gy1hvredz72ypg20a70a7hdv.gif,,,2024-11-19T11:43:31,iPhone 15 Plus,1416,143,51,,,2024-11-19 11:43:31,True
5102335266654377	,P0YKyrV6F,"温度暴跌，还刮冬风，出门计算了一下需要吃两个士力架才不至于失温
一个大概1039KJ ",,,,,2024-11-19T08:09:47,iPhone 15 Plus,175,42,8,,,2024-11-19 08:09:47,True
