id,bid,正文,头条文章url,原始图片url,视频url,位置,日期,工具,点赞数,评论数,转发数,话题,@用户,完整日期,是否原创,源用户id,源用户昵称,源微博id,源微博bid,源微博正文,源微博头条文章url,源微博原始图片url,源微博视频url,源微博位置,源微博日期,源微博工具,源微博点赞数,源微博评论数,源微博转发数,源微博话题,源微博@用户,源微博完整日期
5104403790954867	,P1QyT40p5,"有一些粗通财务的爱好者，完全不理解账面货币资金其实水分是很大的，是一门艺术，高账面货币资金至少已知的有5种情况都可以做出来
1、第一种是存贷双高，特点就是公司的财务费用也一样高，特别是在现在利率下行的时代，财务费用还这么高的，那绝对是借钱装大款，会计师出完报告这钱必须要还回去，现代会计信息披露是靠年报，但是对方不会给你原始的会计凭证，如果你真看到这些原始会计凭证你会很容易发现这类公司的钱都是年尾紧急借款，他的资金池的水位的波动不是平滑的，科学可合理的上市公司你看他的原始会计凭证对应的现金流，按日按周按月都是比较稳定的，但是这些关键底账要素是不披露的，会计师审计这个行业为什么要靠信用，因为这些底账只有他们和实际控制人看的到，如果审计事务所也被搞定了，那会计信息披露是不可信的
2、第二种是大量的应收账款，收不回来挂账在那，典型的比如干工程的，大项目一大堆，没什么卵用，自由现金一直在减少，看上去好多钱呀，其实公司都要垮杆了，实在逼的没办法了给你用一定的财务费用确认一下，末了还要把钱还回去，辅助的操作就是票据融资，用承兑去换现金，看上去挺有钱，全是汇票，有的还是已经烂账了但是就是不肯计提的企业承兑，典型的比如很恒大做生意的，手上一大把类现金票据，账面货币资金也挺多，老板请客只能吃街边串串
3、第三种就是倒腾贸易融资的，也是看上去巨有钱的主儿其实是商品来回倒腾，尤其要注意那些搞金属的，金融可以抵押融资加杠杆，各个都是实力雄厚，身家都是几十亿，请客吃饭还是吃串串，遇到最缺德的是用假金条骗贷款的，一天到晚隔三差五就要去次澳门，这种要小心
4、第四种就是金融机构，也是账面货币资金高的很但是股价一直跌，为什么跌，银行的资产负债表与大众是反的好吧，银行的存款项多了，说明他的钱卖不出去，那不是找死啊，这些钱都是他欠储户的，完了很多人还觉得银行账面货币资金多下来分红就多，神经病，银行真要有这么多钱还发动融资化债干啥
5、第五种是一个变种，是净资产多，净资产是啥，公允啊，典型的家里有大玉石的，几吨玉石，随便给十几亿的估值，你去玩，玩不死你，历史上我们股市有这个公司的，最后公司一毛钱都没有，就只有这个大玉石，资产负债表还老好看，这公司现在都退市了，退市的时候财务报表也依然好看",,,,,2024-11-25T01:09:21,微博网页版,519,41,150,,,2024-11-25 01:09:21,True
5104399827599628	,P1QsuvT0E,看账面货币资金比每股股价然后断定股价被低估了绝对是蠢货中的极品，这些账面货币资金都是权益，不是真金白银的，说白了就是一大堆无法变现的东西，现代会计制度是一门艺术，真正的好公司要看自由现金流，而不是看什么账面货币资金，账面货币资金多的很但是一毛钱都拿不出来直接搞垮的公司多的很，否则他破什么净，难道市场是傻的吗，轮到你发现低估,,,,,2024-11-25T00:53:37,微博网页版,298,19,48,,,2024-11-25 00:53:37,True
5104391177372792	,P1QexuW00,美国股市为啥具备价值投资的根本是因为美元是底层货币，从大的结构看，资本家就减持了，钱能去哪儿，没有比美元更好的底层容器了，等于说从宏观上看美国股市其实是一个没有退路的市场，他的减持对美国的资本家来说是毫无意义的，因此只能往上整，不能跑路，我国股市整不好有一个最核心的问题就是做盘的始终认定自己还有退路，把钱整出来就移民，换成USD，那个造车的不就这么干的吗，甚至连C轮都等不及了，跑到美国还很高调的看网球比赛，一个没有退路的资本市场才具有价值投资的价值，否则里面的玩家一门心思就琢磨怎么把钱偷出来，跑另外的场子混，只有蠢货才在国内搞价值投资，你非要搞，你必须找到一个绝对靠谱的理由说服自己，实际控制人绝对不能减持，减持也没有去处，并且绝对没办法另起炉灶，他就只能乖乖的再唯一的上市公司里面好好整,,,,,2024-11-25T00:19:14,微博网页版,913,82,136,,,2024-11-25 00:19:14,True
5104388658169550	,P1QatyhgW,有人不理解为什么美国的企业亏十几年估值一样高，中国的亏一点点就会崩，这踏马还用说吗，美国的那些亏十年的高科技，人家创始人可没有把股票卖了跑路，国内这帮上市公司的，10个里面9个都想把钱搞走，再也不回来，傻子才信你10年以后的春秋大梦，有的公司甚至等不到去上市，直接C轮就跑了，美国的股市是有很严格的坚持规则的，只有我们是满一定年份就可以减持，并且最近几年还搞出来一个转融通，神经病一样的政策，虽然转融通被暂停了，但是对市场的伤害太大，完了就这个样子还有人不理解为什么在我们这不能搞价值投资，智障,,,,,2024-11-25T00:09:14,微博网页版,1206,68,121,,,2024-11-25 00:09:14,True
5104372252413057	,P1PK1a7Kh,如果，充电技术进一步发展，比如什么固态电池技术成熟了，那么未来走私的商品里面有可能最重要的就是电力走私，说白了就是走私能量块 ,,,,,2024-11-24T23:04:02,微博网页版,451,53,23,,,2024-11-24 23:04:02,True
5104371578970892	,P1PIVBDJO,回复@十七环游记:你猜拜登莫名其妙跑到亚马逊雨林去干什么//@十七环游记:巴西总统这次也好开心的样子,,,,,2024-11-24T23:01:22,微博网页版,93,2,2,,"十七环游记,十七环游记",2024-11-24 23:01:22,False,1670458304,神嘛事儿,5104341486667839	,P1OWorYBN,我国在海外有很多港口，不知为什么新建成的钱凯港的名字我总是很容易想起来，思来想去为啥，结论是谐音，钱凯就是有钱的凯子，哈哈哈哈哈，我日现在外交难道不是用银子砸做酒肉朋友最靠谱吗，我看了秘鲁总统的采访视频，她激动得都流泪了，说是南美洲那些孩子有未来了，怎么怎么，我觉得应该是真心的，其实对外交往最实在的就是给钱，美国为什么这么强大，就是因为他一心一意做有钱的凯子哥，要啥都给，酒肉朋友才是真心朋友，玩儿心的很假的,,,,,2024-11-24T21:01:47,微博网页版,492,47,23,,,2024-11-24 21:01:47
5104360113049241	,P1PqrcNfj,回复@金融街交易员Kim:这不矛盾啊，人民币对USD贬值对其他货币升值很早以前我就谈过的，所以国内这帮人莫名其妙，不知道怕什么//@金融街交易员Kim:汇率是央妈在弄，跟国内搞金融的有啥关系。另外，您应该不是专业看汇率的。人民币兑美元是贬值的，对其他大部分货币在升值...,,,,,2024-11-24T22:15:48,微博网页版,151,11,7,,"金融街交易员Kim,金融街交易员Kim",2024-11-24 22:15:48,False,1670458304,神嘛事儿,5104359229099105	,P1Pp0Cb5L,国内这帮炒股票搞金融的，看到川普要上台，吓尿了，直接汇率跳水，股票跳水，川普那个关税 没什么影响的，这个世界机灵鬼很多的，要相信贸易路径的开拓，是需求决定了贸易，而不是关税，搞金融的你们小看了这帮走羊肠小道的玩家的水平 ,,,,,2024-11-24T22:12:17,微博网页版,785,60,45,,,2024-11-24 22:12:17
5104359229099105	,P1Pp0Cb5L,国内这帮炒股票搞金融的，看到川普要上台，吓尿了，直接汇率跳水，股票跳水，川普那个关税 没什么影响的，这个世界机灵鬼很多的，要相信贸易路径的开拓，是需求决定了贸易，而不是关税，搞金融的你们小看了这帮走羊肠小道的玩家的水平 ,,,,,2024-11-24T22:12:17,微博网页版,785,60,45,,,2024-11-24 22:12:17,True
5104357987848211	,P1Pn0wVG3,很多人对贸易路径这个东西很难理解，其实很简单，风险与收益的无数平衡会导致贸易路径自然的做出最佳选择，当阿拉伯人垄断了来自中国的商品贸易路线的时候，欧洲开启了大航海，因为阿拉伯人控制了耶路撒冷，同时又控制了君士坦丁堡，上帝的子民自己弱鸡没守住，能怪谁呢，第一跳出来的是西班牙人，然后是葡萄牙，西班牙人发现了南美洲，无数的金子让西班牙人感觉超级良好，葡萄牙人搞定了非洲，最后才轮到英国人，整个欧洲都是被逼出来的，否则谁会去干这种十次里面8次死的活儿，贸易只要有利润，风险玩家会评价再评价，只要你的价差足够大，任何东西都搞得来的，金将军最喜欢奔驰，迈巴赫SUV哪里来的，咋没听说过金将军搞一辆问界，被制裁的车臣卡德罗夫的特斯拉皮卡哪里来的，这都是贸易路径自己拐了弯儿运过去的，贸易路径的开辟很多都是违反先行规则的，正是因为是违规的，所以有暴力，比如白糖，很多不知道我国白糖进口是限定了总的额度的，每年是194.5万吨的进口额度，我国白糖每年要消耗1500万吨，自己的产能是996万吨，那市场上这么多白糖差额哪里来的，有很多贸易路径去解决这个差额的问题，在比如大家都很喜欢的鸡爪爪，做泡椒的，还有什么M5M9的牛肉，包括前段时间成都居然出现了日本的蜜薯，哪里来的，都是贸易路径的开拓者研究出来的，一旦有新的贸易路径，探索者都会发财，很快政府就会评估，你这个，是不是应该正规化，那么下一个贸易路径又有人去研究，学外语是干啥的，很多学外语的老弟没想过这个问题，旅行家是干啥的，难道就是旅游？？包括你学法律是干啥的，一通百通,,,,,2024-11-24T22:07:21,微博网页版,513,43,53,,,2024-11-24 22:07:21,True
5104352402606565	,P1Pe0aW5n,回复@亦橙今安:比特币不就是美国版本的外汇券儿吗，价格走双轨制。。。。。。//@亦橙今安:外汇券会出现吗,,,,,2024-11-24T21:45:10,微博网页版,123,8,9,,"亦橙今安,亦橙今安",2024-11-24 21:45:10,False,1670458304,神嘛事儿,5104246511111948	,P1Mtd4FgE,如果美国对中国增加60%的关税，那么美国一定会出现一个非常特别的经济组织，就是特供商品机构，跟当时苏联垮台前一样，有门道的人总能拐来拐去搞到特许免税的东西，别管这个东西咋来的，反正就是比市场上的便宜，从中牟利，不信我们走着瞧，这个世界没什么新鲜事儿，美国会出现倒爷，并且大概率都是川普家族的这帮忠诚佬,,,,,2024-11-24T14:44:23,微博网页版,1030,154,64,,,2024-11-24 14:44:23
5104351200418041	,P1Pc41KKB,美国这个国家其实很适合走私，他拥有一个U字形的国土，东部西部都是海，南边与南美洲接壤，一条线儿牵下去，北边是几乎不设防的加拿大，走私的玩家完全可以穿越美加边境线直接就把商品搬过去，东西海岸也有悠久的走私传统，波士顿就是典型代表，代表人物是Samuel Adams，美国革命之父，自由之子的主理人，熟悉美国历史的朋友们可以重点研究下Samuel Adams和他的自由之子，这个组织号称要跟英国佬苛刻的关税斗争，其实是后台巨富们支持下的走私组织，这哥们各种反对，反对食糖条例、反对印花税条例 、反对《 唐森德税法 》，反对英国政府对美洲大陆殖民地的统治行为，于是摇身一变，变成美国的革命家，美国的独立史其实是一部走私史，自由，是最好的诠释，你川普不是要加60%吗，自由的走私之子就会出现。一个有趣的事情（百度的），美国的国父很多，所有在独立宣言上签字的人都是国父。因此美国人谈到国父时用的是复数。而美国革命之父只有三个，其中之一就是Samuel Adam塞缪尔·亚当斯，革命之父，牛批吧，但是现在国内很少有人知道这个Samuel Adam，一说美国开国元勋，必谈华盛顿，稍微懂点的，还能说托马斯·杰斐逊，更牛批的可以谈谈罗伯特·R·利文斯顿，但是Samuel Adams的名字很少有人提及，因为他的事业的核心就是走私，是革命，这没法大张旗鼓的描述，但Samuel Adams确实是干脏活的，另外独立宣言第一轮五人签字名单上也没有他的签字（他是后面接下来几个州签字的签字人之一，56个人那一批代表马萨诸塞州），美国国父是5个，革命之父是3个，他是革命之父，Samuel Adams的名言就是，“无代表，不纳税”，这明显是逆经叛道的，要知道富兰克林说的啥，人生中只有两件事不可避免，那就是死亡和纳税，所以Samuel Adams明显非主流，不能大张旗鼓宣传，革命之父三个人都有自己的名言，塞缪尔.亚当斯(无代表，不纳税)、帕特里克.亨利(不自由毋宁死)和托马斯.潘恩(常识)，以上是高中生就应该知道的东西，不过塞缪尔.亚当斯这哥们放任何一个国家朝代都是二象性的，造反的喜欢他，革命成功的就不喜欢,,,,,2024-11-24T21:40:23,微博网页版,378,36,50,,,2024-11-24 21:40:23,True
5104344844207300	,P1P1OhEvG,以前我们国家对外交往喜欢玩儿心，最著名的一个政策就是不干涉别国内政，不管谁上台，都支持现任政府，这样也对也不对，对的意思是不管谁上来中国都支持你，不对的是压力就给了现任政府，他得想办法不下台才能得到中国的好处，所以表现上就有这么一个情况，突然上台的政府对中国说狠话，没过几天关系就很好了，各种合作，完了再过一点时间就被搞下课，搞他的那个新政府说就政府卖国，签了这么多协议，要废止，但是没过几天又开始跟我国合作，最典型的就是东南亚这些，每次都是新上台的马上宣布废止上一届的合约，过几天又恢复并且用力更大，莫名其妙的要死，典型代表就是马来和印尼，只要不是他当总统他一定疯狂批评现任政府，只要是他上台他卖得比以前的更夸张，其实玩儿心这种模式更加加重当地政府的负担，特别是下台的，会失去一切，因为替换他的那个政府我们会很快表态支持你，因为你是合法的，下台的什么都没了,,,,,2024-11-24T21:15:07,微博网页版,647,39,23,,,2024-11-24 21:15:07,True
5104341486667839	,P1OWorYBN,我国在海外有很多港口，不知为什么新建成的钱凯港的名字我总是很容易想起来，思来想去为啥，结论是谐音，钱凯就是有钱的凯子，哈哈哈哈哈，我日现在外交难道不是用银子砸做酒肉朋友最靠谱吗，我看了秘鲁总统的采访视频，她激动得都流泪了，说是南美洲那些孩子有未来了，怎么怎么，我觉得应该是真心的，其实对外交往最实在的就是给钱，美国为什么这么强大，就是因为他一心一意做有钱的凯子哥，要啥都给，酒肉朋友才是真心朋友，玩儿心的很假的,,,,,2024-11-24T21:01:47,微博网页版,492,47,23,,,2024-11-24 21:01:47,True
5104331014282204	,P1OFvhXZO,美国对外贸易制裁本身就是非市场化的，一定会引发非正常的贸易行为，因为市场化机制下定价都是双方自愿的，价格没什么争议，没有套利的空子，川普政府说要加关税60%，并且这个税还是国内的企业交，那国内的企业就会想办法掩盖这个交易的痕迹，比如抛弃USD用川普设下的数字货币局，他去加这么多关税都是基于USD计价，所以数字货币会成为有意或者无意中被市场选择的定价货币品种，这对我国外贸出口企业来说就非常危险，因为以前收到的一大堆USD还没说清楚呢，现在你又摸出一堆字符串说这个东西就是支付方式，不但绕开了美国IRS，而且这对字符串我国中央银行是不认的，也绕开了我国银行的监管，并且也绕开了我国金融机构对冲的保护伞，你外贸企业拿着这么多莫名其妙的字符串，这个币那个币，不是扯犊子是什么呢，数字货币波动率巨大，没人知道这东西怎么对冲，几个来回就把你搞外贸的搞破产，因为很多被迫收到数字货币的外贸企业他一定会想办法尽快兑换成公认的价格衡器，比如传统意义上的USD，或者其他什么货币，间接又抬高了USD的价值，所以现在的情况就是数字货币和USD价格齐升，这是一个非常缺德的做法，当然你不得不说这个做法很精妙，人家很懂什么叫贸易结算以及印钞权，因为60%的关税确实太高，贸易双方为了绕开只能选择另外的结算方式，当然如果外贸企业就是不肯就范，那就要承担这笔关税导致的价格风险，被课税的对象是其国内企业，他们自己要想办法消化这个税率，两个办法，一个就是把加税的压力传导给美国大众，导致通胀60%，另一个办法就是走私，历朝历代，任何一个历史下只要是人为干预自由贸易形成价格落差的，100%一定出现走私，并且最大的走私方一定是武装走私，所以上一贴我说美国必须宣布军队不能经商，否则肯定会出乱子，武装走私是走私的最高手段，当年美国禁酒期间最高走私手段就是武装走私，阿尔卡彭就是靠武装走私和纳卡赛车发财的，因为中间的价差实在惊人，完全值得一试,,,,,2024-11-24T20:20:10,微博网页版,308,38,30,,,2024-11-24 20:20:10,True
5104247416817103	,P1MuFsBrh,川普上台加关税，他必须宣布一个很重要的东西，否则一定会出问题，就是美军不得经商，否则核潜艇走私中国商品会成风，不信走着瞧 ,,,,,2024-11-24T14:47:59,微博网页版,657,77,29,,,2024-11-24 14:47:59,True
5104246511111948	,P1Mtd4FgE,如果美国对中国增加60%的关税，那么美国一定会出现一个非常特别的经济组织，就是特供商品机构，跟当时苏联垮台前一样，有门道的人总能拐来拐去搞到特许免税的东西，别管这个东西咋来的，反正就是比市场上的便宜，从中牟利，不信我们走着瞧，这个世界没什么新鲜事儿，美国会出现倒爷，并且大概率都是川普家族的这帮忠诚佬,,,,,2024-11-24T14:44:23,微博网页版,1030,154,64,,,2024-11-24 14:44:23,True
5104244898400130	,P1MqBzffY,研究美食节目发现印度其实物产不差，从地理海拔的角度看基本与我国差不多，高中低海拔都有，物产也基本都有 ，但是却没有诞生出和中国一样的丰富的餐饮，比如调味品层面主要以干制粉料为主，酱油醋是没有的，要用干制粉料临时合着新鲜的香辛作物调调味品，印度发酵类食物几乎没有，但是有非常容易临期的酸奶，做好就必须马上吃，印度不怎么生产奶酪，主食方面吃长颗粒的不容易胶合的高短链淀粉的大米，低蛋白高淀粉适合手抓，印度人没有粥这种食物，大米不适合煮粥，印度也没有中国这种八大菜系，没有刀工的说法，没有精致烹饪的说法，主要是油炸和糊糊，还有烧烤，印度也没有中国这种丰富的素菜材料，主要就是大蒜、洋葱、土豆，印度也没有瓷器，吃饭用芭蕉叶配合手抓，高等级的贵族有金属盘子，印度人没有筷子的说法，直接手抓，手抓吃饭被认为更加温和、清洁，并且 不会烫到嘴，印度人其实肉类主要是鱼类和鸡肉，很少看到印度美食节目出现猪肉、牛肉，可以看到羊肉，印度也没有火锅这种模式，火锅浪费燃料且需要金属，印度人也没有面条和米线，没有饺子，但是各种饼类很多，主要是可以当成豌，连配菜一起吃，感觉自爱印度洗碗工这个工种应该赚不到钱，印度也没有蒸笼，没有蒸这个餐饮技法，印度是一个很神奇的国家,,,,,2024-11-24T14:37:59,微博网页版,291,76,14,,,2024-11-24 14:37:59,True
5104235039162547	,P1MaHCrB1,最近入冬后国内又开始很多人咳咳咳咳，好像是腺病毒，很多小朋友都中招了 ,,,,,2024-11-24T13:58:47,微博网页版,367,83,35,,,2024-11-24 13:58:47,True
5104233571159424	,P1M8l4RCo,不发展的一些发展中国家经常对外控诉欧洲殖民主义在自己国家干的好事，其中一个最大的控诉就种植园经济，导致一个国家的经济结构及其单一，大规模的种植园又导致单一作物的产能炸裂，卖不起钱，现在出现一个意外的情况就是，由于中国人非常喜欢吃吃吃，导致一些国家发现了巨大的商机，主动大规模种植单一经济作物，比如越南人铲掉水稻大规模种榴莲，智利人揭起大规模种车厘子，阿富汗老乡使劲种松籽，法国葡萄园主使劲生产白兰地，同样都是当种植园，这些国家是自愿的，利令智昏，大英帝国的老皇上们肯定会不服气,,,,,2024-11-24T13:52:58,微博网页版,684,55,22,,,2024-11-24 13:52:58,True
5104231484754393	,P1M4YjWPL,"川普的政策很多都是自相矛盾的，纯粹是为了讨好不可调和的各方出来的东西，随便举几个例子
1、川普一直说要修复美国制造业，制造业人工成本很关键，但是他又大规模驱逐非法移民，没有非法移民他美国制造什么，实际上正是因为大量的非法移民美国在个别州已经开始有能力生产帽子和衣服了
2、川普说要力压通胀，但同时又要加60%的关税，选民还以为要找中国人收60%，没想到是找国内自己的企业收，现在已经有人发现不对劲了，疯狂囤货，导致我国4季度外贸数据吓人
3、川普说美元优先，但是又跑去整数字货币，甚至差点任命一个炒币佬当财政部长，华尔街肯定是不满意的，被迫提名一个同性恋当财政部长，这又与其直男形象背道而驰
4、川普对外宣称他有秘籍马上结束俄乌战争，结果俄罗斯和乌克兰两家都不想结束，马上互相整更大的导弹，战争结束了你让这两家的头子们怎么跟国内交代，一个没有拿回来失地一旦和平就会被迫举行大选面临生命危险，一个要面临GDP暴跌，请问如何结束
5、川普任期内搞出来新冠肺炎，按道理他应该知道公共卫生的重要性，却任命一个疯狂DISS公共卫生的肯尼迪旁支后羿，并且这哥们还是一个素食主义者，强迫别人跟他一起吃汉堡
6、川普任命了一个司法部长，上一个拟任命的浑身都是BUG，新任命邦迪的玩的更嗨，因为反对LGBT于是亲自到处出轨，不得不离婚，来自不出闲人的佛罗里达，这个妹子司法部长甚至成功从川普那敲到钱，现在打算让她来主持正义
7、最扯淡的就是古巴难民家庭出身的拟任命国务卿的卢比奥，与邦迪同样来自不出闲人的佛罗里达，被中国制裁无法访问我国，同时还干外交事业，完全令人莫名其妙的任命，那么卢比奥就只能去俄罗斯了，或者去欧洲倒腾点业务
8、被拟任命的住建部部长，斯科特·特纳是当时川普第一次当总统的那位本森管的城市发展部的董事，打橄榄球的，川普当总统四年，本森部长恁是没建出个什么东西，本森来自以基础设施大规模生锈的底特律，而这位特纳是打橄榄球的，未必川普要从大规模基建缩水成大搞灯光球场？",,,,,2024-11-24T13:44:41,微博网页版,388,46,35,,,2024-11-24 13:44:41,True
5104220175337117	,P1LMJmoqx,川普这人组的团队，说白了就是很像我们国内的一群人，就是迷信莫名其妙的偏方的唯心主义中医粉，偏方治国，中医当然是很好的，但是正宗的中医要有老师傅带要学习很复杂的理论体系的，并且代价昂贵，偏方爱好者不这么认为，道听途说一味药就往死里吃，恨不得包治百病，有的方子还猛的很，比如让自己浑身溃烂死认这就是排毒去治糖尿病的，加关税就是这种方子，还有邪门的银针流，银针是你随便可以扎的吗，瞎几把整整一根大银针扎自己，扎抽了还不知道咋回事，马斯克就这种，扎银针能治艾滋病吗？还有一些奇幻方剂的，比如搞数字货币想洗劫全世界的，结果炒到三万多亿市值发现完全是自嗨，纯自嗨方子，搞偏方迷信，不成体系，乱下药，芒硝教，吃得自己上吐下泻都要肾衰竭了还觉得排毒效果好，配伍混乱，阴阳相克，热证冷治，把人治死了症状就消失了，唯心主义中医流,,,,,2024-11-24T12:59:44,iPhone 15 Plus,417,60,38,,,2024-11-24 12:59:44,True
