id,bid,正文,头条文章url,原始图片url,视频url,位置,日期,工具,点赞数,评论数,转发数,话题,@用户,完整日期,是否原创,源用户id,源用户昵称,源微博id,源微博bid,源微博正文,源微博头条文章url,源微博原始图片url,源微博视频url,源微博位置,源微博日期,源微博工具,源微博点赞数,源微博评论数,源微博转发数,源微博话题,源微博@用户,源微博完整日期
5104215657808828	,P1LFrwLqQ,"川普这次组阁，选的人都是过去被边缘化的，不疯狂出格表衷心根本没有任何机会，说白了都是高级losser，看上去是精英其实并不是，这帮人对大国竞争有的只是一些片面的感觉，很多人只想要得到一个翻盘的结果，但是提不出完整的理论体系，这些带着短视结果预期组局的狂妄之徒，很快就会遭到国际社会毒打，实际上已经有一个还没上任都倒下了
另外我就非常好奇，那个准财政部长咋就认为关税可以武器化啊……他难道不知道地球是圆的吗，川普在他任期内有可能一个承诺都实现不了，最后美国人民会发现无论选谁都是路路断绝，实际上他国内穆斯林已经开始有这个感觉了",,,,,2024-11-24T12:41:47,iPhone 15 Plus,578,65,36,,,2024-11-24 12:41:47,True
5104210938693087	,P1LxPAtt5,川普明知道马斯克严重恐同，偏偏选了一个基佬当财政部长，另外他力推的那个比特币小子去做商务部长，明白了要加稅60%，国务卿也不能过来，那个商务部长的职位含金量就很差了，马斯克知趣的话应该知难而退 ,,,,,2024-11-24T12:23:02,iPhone 15 Plus,366,31,11,,,2024-11-24 12:23:02,True
5104203439539313	,P1LlJE1BT,美国那个候选财政部长讲话是不是吃错药，谁给他的信心那么讲话的，川普周围都是一群义愤填膺人士，很多都是边缘份子，连自己国内都竞争不过，还指望跑出来竞争？ ,,,,,2024-11-24T11:53:14,iPhone 15 Plus,274,37,10,,,2024-11-24 11:53:14,True
5104042005236140	,P1H9mlY9S,"看美食纪录片，产生灵感，如何将国家的粮食产能提高10%
第一个办法，就是提高生产力，增加10%
第二个办法，学习穆斯林的做法，搞一个具有中国特色的斋月，一个月内禁止吃东西，喝水就行
第二个办法还有个好处，全民减肥，顺带减少大量富贵病医疗开支
发育中的小朋友不过这个节日 ",,,,,2024-11-24T01:11:45,微博网页版,385,75,18,,,2024-11-24 01:11:45,True
5103998415933530	,P1G13oTA6,历史上我国从来都是重农轻商，是因为有历史教训的，吕不韦开了一个头，后来历朝历代的皇帝都很避讳商人跟政治直接扯一起，宋朝资本主义萌芽被弄死在婴儿床上就是这个原因，由于北方游牧民族老是来要钱，不得不发展商业，商业发达以后商人肯定有想法，只能扼杀掉，后来到了明清时期朝廷发现特许经营这个模式不错，逐渐发展了一些所谓的红顶商人，清朝尤甚，但也是非常提防，红楼梦的故事就讲的政商合作梦一场的剧情，在四川也有，自贡的盐商太有钱了，吃的东西也是非常奢侈，但也仅限于定位做朝廷的钱袋子，一旦用完了也是下场不太好，在欧洲也有典型，美第奇家族，干到最后自己去做教皇，最后美第奇家族直接断子绝孙了，然后就是传说中牛批的很的犹太实力，代表就是罗斯柴尔德，但明面上也是必须低调，不然下场会失控，马斯克估计要好好看看这个历史,,,,,2024-11-23T22:18:33,iPhone 15 Plus,825,83,80,,,2024-11-23 22:18:33,True
5103994702137585	,P1FV48Y5b,如果马斯克发现造总统比造车造火箭更来钱，他会咋想 ,,,,,2024-11-23T22:03:47,iPhone 15 Plus,503,61,15,,,2024-11-23 22:03:47,True
5103866964086234	,P1CB2h910,刚才打车，司机大哥下聊天，提出一个问题，为什么人年纪大了，头发开始掉，但是胡子却越张越多，我觉得这个问题有点意思🤔 ,,https://wx1.sinaimg.cn/large/63912bc0gy1hvw44wru7lg206o06o7lv.gif,,,2024-11-23T13:36:12,iPhone 15 Plus,403,72,8,,,2024-11-23 13:36:12,True
5103820959122057	,P1BoPCh3X,其实在川普这种人眼里，发射火箭和搞lgbt没什么区别，都是不干正经事，马斯克押宝他已经获得厚报，见好就收就算了，发射火箭救不了美国的，现在美国最要命的事情是就业和通胀 ,,,,,2024-11-23T10:33:24,iPhone 15 Plus,434,40,10,,,2024-11-23 10:33:24,True
5103815551091604	,P1Bg74zYw,马斯克支持的霍华德·卢特尼克没有被推荐为新财政部长，对冲基金高管斯科特·贝森特被推荐，usd传统势力超级强大，炒数字货币的要做美国融资化债对象 ,,,,,2024-11-23T10:11:54,iPhone 15 Plus,349,25,15,,,2024-11-23 10:11:54,True
5103639886825938	,P1wGMsDJM,大权重经常在3%象限暴涨暴跌，这么整让大家很难弄啊 ,,,,,2024-11-22T22:33:53,iPhone 15 Plus,376,43,14,,,2024-11-22 22:33:53,True
5103623983599302	,P1wh8f6lg,马斯克力推的那个数字货币玩家可能当不了财政部长，炒数字货币的要小心 ,,,,,2024-11-22T21:30:41,iPhone 15 Plus,233,16,4,,,2024-11-22 21:30:41,True
5103583714607912	,P1vebjkJa,"溜了
 ",,https://wx3.sinaimg.cn/large/63912bc0gy1hvv7lkgi41j23b04eo7wj.jpg,,,2024-11-22T18:50:40,iPhone 15 Plus,97,16,0,,,2024-11-22 18:50:40,True
5103432157889731	,P1rhJx6tJ,"央企要靠第二增长曲线活命，可以理解，问题是这些曲线赛道上的原来的玩家咋办
不是说好了央企只玩关系国计民生的核心业务的吗
现在又要玩第二增长曲线了，希望这根线最好在境外画，在国内画谁整得过央企，比如央企说开洗脚城好，那洗脚城以前的玩儿家都得出局 ",,,,,2024-11-22T08:48:26,iPhone 15 Plus,930,148,46,,,2024-11-22 08:48:26,True
5103413598358370	,P1qNNz4oq,穿越周期,,,,,2024-11-22T07:34:41,iPhone 15 Plus,189,17,10,,,2024-11-22 07:34:41,False,1670458304,神嘛事儿,5096373641024556	,OEr7m4ix6,"我刚才在一个经常聊天的群看人聊天，有个老哥说中国超常规发展，用30年改革开放累计财富才是现在这个样子，30年的周期过快了，我寻思了一下这老哥不对，我就发言了，从第二次世界大战结束（1945）到1980年代，美国的中产阶级最红光的年份，其实也就是30-40年，这三十到四十年里面是美国中产阶级财富最高的年份，日子很舒服，美苏大战又要赢了，60-70年代的美国电影歌舞片很华丽，真的是物质极大丰富，其实美国人民过上舒心安逸世界NUMBER ONE的好日子也就是这三十到四十年，然后从1982年开始，美国迎来了供给侧改革，在接下来的这30-40年，也就是到现在，基本就是这个阶段，日子最好过的红脖子经历了产能转移这种人间最大的悲剧，日子过得很不好，整个周期就是60来年，所以美国经历了一个完整的经济周期，也就是传说中的康波周期，这一点从美国的电影都看的出来，美国电影的意识形态从90年代末开始就有点不对劲了，我个人认为就是从越战电影开始的，代表作就是兰博系列，然后美国的电影的色调越来越失去暖色调，变得黑暗和暗绿色，代表作就是黑客帝国，非常的阴郁。
我在群里说，我说我们自己觉得可能过去三十年超常规发展了，怎么怎么，其实对比美国的过去，基本就是美国水平，并且考虑到现实美国老百姓的日常，举例来说，90年代是美国电影中中产阶级家庭生活最富裕的时代期，家里的都是马桶的，厨房非常的大，家里普遍有2个以上的孩子，燃气灶是4个眼儿的，常年开空调，家家都有汽车，并且是大排量，有时候电影里面看到的布景真的很有趣，里面有些物质生活即便是放到现在，我国很多中产阶级还是用不起的，比如洗碗机，还有独栋小院，当然国情差异是有的，我只是做一个对比，就是当年美国中产阶级最幸福日子的那些用度，我们还差什么，可以比较，消费的潜力还是很大的
所以我们自认是超常规发展，其实就是美国的水平并且99度差1-2度的样子，比如有的美国家庭有自己的飞机，或者郊区别墅，所以我们不要认为自己好像怎么怎么，时代脉搏罢了，对标世界一流水平，打个平手罢了，我们现在感觉很厉害，你时光倒流30-40年去美国看看，更豪横，同志们还需要努力
群里不少人觉得我说的还是很有道理的，世界一流水平对个标，看看还差点什么，马上双十一了，大家都买上",,,,,2024-11-02T21:20:25,微博网页版,1526,163,116,,,2024-11-02 21:20:25
5103410772707219	,P1qJfbmgP,要推动中央企业穿越经济周期，支持企业开启增长的“第二曲线” ,,https://wx1.sinaimg.cn/large/63912bc0gy1hvunqscofag20bu06o7wp.gif,,,2024-11-22T07:23:28,iPhone 15 Plus,398,53,11,,,2024-11-22 07:23:28,True
5103379590152572	,P1pUX0DGQ,"都睡了吗
 ",,,,,2024-11-22T05:19:33,iPhone 15 Plus,158,74,0,,,2024-11-22 05:19:33,True
5103317027653811	,P1oi2w76z,今天是120元的鳗鱼头,,,,,2024-11-22T01:10:57,微博网页版,78,6,0,,,2024-11-22 01:10:57,False,1670458304,神嘛事儿,5102867818481818	,P1cBvzAvw,阿胖山做饭最近一集选了最便宜的材料，这次是200元的石斑鱼鱼肚，我用EXCEL做过统计，肉眼可见的材料花销下降曲线 ,,,,,2024-11-20T19:25:57,微博网页版,189,14,4,,,2024-11-20 19:25:57
5103262967008187	,P1mSQtp9h,还有一个有趣的事情，今天下午我班长跟我说，很兴奋，说我告诉你一个事情，你不要说出去，我说什么屁事，你二婚了？？？班长说你扯犊子，绝对你觉得会很欢乐的事情，给我三次机会，让我猜，我猜了三个事情，第一个事情，他买到牛股了，想给过推荐让我接盘，第二件事，XXX生了第四个娃娃，我们班著名繁殖狂，第三件事，YYY应该是被提拔到ZZZ了，结果班长说我都猜错了，公布答案，在美国那个同学全家投了哈里斯，押错宝，现在问他成都房价多少，我问你跟他说多少，班长说大概2-3万吧，我说你咋这么实在，你应该告诉他9K到1万，骗回来再说，到时候他回来了就只能去温江住，班长说你咋这么烦他，我说要不你告诉他均价4-5万好了，看看他什么反应，他要是说呀才这么点，该轮到你烦他了，班长说对啊，我说人家在美国赚的可是美金，是美金，一张顶你七张，他不可能回来的，他真要回来一定会问你另一个问题，班长说他会问啥，我说他会假巴意思问，内地最近政商环境好吗，他想回家乡做点贡献，投资点事业，班长说你说的对，这人虚伪,,,,,2024-11-21T21:36:08,微博网页版,867,85,5,,,2024-11-21 21:36:08,True
5103258937591480	,P1mMlvQTe,刚才在经常装逼的军事群跟人讨论俄罗斯飞弹的问题，一大哥焦虑说俄罗斯开了很不好的先例，从本土发射洲际导弹到别的国家，然后叨叨叨半天说完了完了，我讥讽之，难道你不看地球仪吗，那个导弹是往西边飞的，大哥应激，说你懂什么，今天他往西明天就可以往东，我一看这人来劲儿啦，我说您咋不忧心下还能往北呢，大哥不说话了，没多久群主私信我说大哥玩不起私信他出一百元让群主踢了我，群主问我要不要道歉，我说道歉个毛，回头这人在另一个群说相反的话题，说俄罗斯终于雄起了，还乌拉乌拉的叫，群主说这个二姨子，吗的，问我他在那个群他要去骂，我说你别去，人家是那个群的群主,,,,,2024-11-21T21:20:07,iPhone 15 Plus,614,81,11,,,2024-11-21 21:20:07,True
5103244657295951	,P1mpjuC0D,"湖南发现了地下深度在两千米以上的金矿，据说储量很大，我想起南非来了，南非那个金矿也是地下很深的地方，起步也是两千多最深四千，挖了一百多年的成果
我在想这么深的地方，我国去挖估计要用新方法，比如盾构机和机器人，否则岂不是累死 ",,,,,2024-11-21T20:23:22,iPhone 15 Plus,635,49,14,,,2024-11-21 20:23:22,True
5103241601484486	,P1mko6ebk,"两个非常过瘾的咸菜
水豆豉不知道四川以外的其他省份有没有
 ",,https://wx1.sinaimg.cn/large/63912bc0gy1hvu4alja10j23b04eo7wj.jpg,,,2024-11-21T20:11:14,iPhone 15 Plus,159,110,4,,,2024-11-21 20:11:14,True
5103211222139654	,P1lxo8YCy,"有没有可能俄罗斯的氢弹已经炸不响了
能不能证明下
 ",,,,,2024-11-21T18:10:31,iPhone 15 Plus,370,52,5,,,2024-11-21 18:10:31,True
5103188296598868	,P1kWprGFm,中国人有一个天生的特质就是很难被忽悠，就算一时半会儿被忽悠也很快会纠偏，很早以前我就讲过为什么，五千年杀头的历史杀出来的，不聪明的人现在都是黄土，最蠢的中国人都有机灵基因，看看殉葬坑里面那些码放得整整齐齐的尸骸就知道了，我们脑子里基因层面就有一百万个亡国的秘籍，洋鬼子那套东西一开始会有点吸引力很快就会穿帮的，历史是个好东西，一个妹子，千里迢迢跑到我们这露大奶让你嗨，图什么，古人云无事献殷勤非奸即盗，这是基本常识,,,,,2024-11-21T16:39:25,iPhone 15 Plus,1219,89,57,,,2024-11-21 16:39:25,True
5103185675682682	,P1kSbnQka,"那个从德国跑到我国整cosplay出名吸了一堆粉丝的海玟娜终于开始介入我国意识形态领域的话题了
对于前期一嘴儿说中国好哦好上天，自己母国各种不好的海外博主，我们一定要等他啥时候忍不住开始表演真心话大冒险，背叛母国意识形态的人永远不可信，切记
 ",,,,,2024-11-21T16:29:00,iPhone 15 Plus,2360,93,77,,,2024-11-21 16:29:00,True
5103172894853508	,P1kxzkmCo,俄罗斯一看要停战，着急了，我没记错的话，当初战争开始初期，泽连斯基在自己的屋子里很着急的说，为什么还没开打，他很着急，他知道会打仗，他是挨打的一方他还着急为什么还不打，说明这个战争其实桌下是谈好的 ,,,,,2024-11-21T15:38:13,微博网页版,1007,54,19,,,2024-11-21 15:38:13,True
5103155648663587	,P1k5KAlNh,954号码段是哪个傻逼批准的，清一水的你好你有一个刷卡机到期了要续费，神他们的刷卡机到期，问过去一般都是拉卡拉 ,,,,,2024-11-21T14:29:41,iPhone 15 Plus,212,23,0,,,2024-11-21 14:29:41,True
5103146765126531	,P1jRqlvDZ,瑞幸咖啡和星巴克的竞争，说白了就是类似一个故事，一个糙汉子跑到巷子里面找小姐，问，多少价钱，JI说：”草地一次十块钱，椅子一次二十块，床上一次五十块。糙汉子抛出五十元，JI笑道：先生好有腔调哟！农民说：”腔调个P，五十块，草地上五次 ”，喝杯咖啡，哪来的那么多屁事，9块9，整10杯，在中国，耍腔调的，最终药丸,,,,,2024-11-21T13:54:23,微博网页版,720,94,30,,,2024-11-21 13:54:23,True
5103144851473352	,P1jOl6bhK,星巴克整不过瑞幸，要撤了，瑞幸直接把星巴克的文化气息打成了一杯9块9的纯零售，并且味道还不错，星巴克诞生在美国，原本是为美国创业一族提供一个一边喝咖啡一边讨论商业计划书的场景，逐渐形成一个氛围，瑞幸完全不管这些，就是9块9，另外在我国也不存在什么创业小剧场的场景，就是纯消息，纯关系，既然这样不如9块9，拿了就走，喝一杯咖啡哪儿来这么多屁事儿,,,,,2024-11-21T13:46:47,微博网页版,2027,150,72,,,2024-11-21 13:46:47,True
5102896955528599	,P1dmvnceX,我倒想看看比特币啥时候炒到1百万一枚，笑死 ,,,,,2024-11-20T21:21:44,微博网页版,474,75,11,,,2024-11-20 21:21:44,True
5102873141317401	,P1cK65wIp,现在好像是吃洋姜的时候，这是外来植物，在国外被视为有害植物，因为疯长，国内引进后发现很好吃，尤其是拿去做泡菜，于是前天我在淘宝买了用传统泡菜水泡的洋姜，确实很好吃，我们中国人对研究什么东西可以吃这个事情确实很厉害 ,,,,,2024-11-20T19:47:06,微博网页版,457,83,13,,,2024-11-20 19:47:06,True
5102867818481818	,P1cBvzAvw,阿胖山做饭最近一集选了最便宜的材料，这次是200元的石斑鱼鱼肚，我用EXCEL做过统计，肉眼可见的材料花销下降曲线 ,,,,,2024-11-20T19:25:57,微博网页版,189,14,4,,,2024-11-20 19:25:57,True
5102856183484825	,P1ciKeCyR,"学医救不了中国😏，射火箭救不了美国😏
                 ——-周树人 ",,,,,2024-11-20T18:39:43,iPhone 15 Plus,490,40,10,,,2024-11-20 18:39:43,True
5102855193887970	,P1ch9gjrc,"星际飞船”的第 6 次试飞发射，唯一的载荷是一根香蕉
想暗示什么😏 ",,,,,2024-11-20T18:35:47,iPhone 15 Plus,226,24,1,,,2024-11-20 18:35:47,True
5102760682588762	,P19OIaRse,我去，配带喷雾的浴室吗,,,,,2024-11-20T12:20:14,iPhone 15 Plus,179,45,10,,,2024-11-20 12:20:14,False,2868676035,财联社APP,5102758585436271	,P19LkmOdN,【美国得州将提供567公顷土地 支持特朗普建移民驱逐设施】财联社11月20日电，美国得克萨斯州土地总局当地时间11月19日表示，作为大规模驱逐移民计划的一部分，得克萨斯州将向特朗普政府提供567公顷靠近美墨边境的土地，用于建设移民驱逐行动的相关设施。得克萨斯州土地总局专员在给特朗普的一封信中说，该州于10月从一名牧场主手中购买了约567公顷靠近得克萨斯州与墨西哥边境的土地。该机构已做好充分准备签署相关协议，以允许建造一处设施，用于非法移民驱逐行动相关的处理、拘留和协调工作。,,https://wx3.sinaimg.cn/large/aafc85c3gy1hvskua0j5pj20u01ekjxu.jpg,,,2024-11-20T12:11:54,,237,38,51,,,2024-11-20 12:11:54
5102742480098166	,P19lm0pxk,最近有个假冒我id的人通过留言的方式拉人进什么群炒股，不是我，自己长脑子，我已经投诉了，站方是否处理我管不到，不要私信我，我对这些事情没什么兴趣，自己长脑子 ,,,,,2024-11-20T11:07:54,iPhone 15 Plus,388,33,1,,,2024-11-20 11:07:54,True
5102736570322308	,P19bP1lQw,亮点经济挽救不了美国的，美国有接近四亿人每天眼睛一睁就要吃饭，川普必须先解决这个问题，越是高科技越多普通老百姓的直接利益无关，高科技是门槛经济，越高价值分配越狭窄，美国现在需要的是怎么在四年时间内让老百姓存款增加，让吃喝拉撒价格降下去的东西，说得不好听点马斯克那玩意儿就是批着现代高科技外衣的安托瓦内特牌火箭……你就算去了火星，跟普罗大众有个锤子利益相关？,,,,,2024-11-20T10:44:25,iPhone 15 Plus,569,87,23,,,2024-11-20 10:44:25,True
5102686901109673	,P17TI4EFX,"初步对比了一下
千禾最好的有机酱油氨基酸含量1.2g/100毫升，500毫升一瓶，定价37.31元，京东会员plus价格
泸州老窖搞的护国酱油，3年发酵最好的，495毫升，氨基酸含量1.05g/100毫升，京东会员plus价格55.62元
我觉得泸州老窖的这个酱油还需要努点力，再发酵发酵 ",,,,,2024-11-20T07:27:03,iPhone 15 Plus,451,123,42,,,2024-11-20 07:27:03,True
5102681456640311	,P17KVrRrN,"泸州老窖开始卖酱油了
 ",,https://wx3.sinaimg.cn/large/63912bc0gy1hvsbz6v707j23b04eox6s.jpg,,,2024-11-20T07:05:25,iPhone 15 Plus,138,29,4,,,2024-11-20 07:05:25,True
5102674441929203	,P17zC85Sb,比特币在那傻嗨干嘛啊，搞得好像这东西就能从我国买到东西一样 ,,,,,2024-11-20T06:37:33,iPhone 15 Plus,840,73,19,,,2024-11-20 06:37:33,True
5102598884164381	,P15BKhtlr,驱逐非法移民这个事儿是一个耗资巨大的业务，两万亿联邦预算，很难不让人心动，有可能会出现一个奇葩的事情就是为了驱逐而驱逐，这个事情当年我国也有，七八十年代为了保证有限的粮食不遭受损失和防疫，搞除四害运动，我记得特别清楚就是杀老鼠，一只尾巴多少钱然后去街道办结算，结果就出现了专门养老鼠然后割尾巴去结账的事情，美国是一个非常善于把任何事情搞成一个大生意的国家，这帮机灵鬼我打赌一定会这么干，到时候国内非法移民会成为抢手货，不得不去进口非法移民来专门过一道水，结果就是越驱逐非法移民越多，和美国的医药产业一样，就是不给你整好，长期服药，反正可以联邦预算报账，这可是两万亿美元的生意，那么如何防止这种不好的事情发生呢，学英国就行，当年鼓励新大陆移民猎杀印第安人，如何报账呢，割头皮，抓住非法移民通通割下头皮，用头皮去联邦政府报账,,,,,2024-11-20T01:37:18,iPhone 15 Plus,430,51,25,,,2024-11-20 01:37:18,True
5102591671271952	,P15q75kTm,川普驱逐非法移民我算了一笔帐，按照2000万计算，一个人一万美元的驱逐成本就是2000亿usd，分四年执行，每年5000亿，这可是大生意，但是考虑到类似商业人士竞标垃圾处理业务，其实并不是老老实实处理而是直接倒进隔壁村的小河，大概率会出现一个奇葩，就是出现各州支持这个驱逐令的，仅仅驱逐出本州，丢过州界就可以，然后找川普报账要联邦预算，最后这两千万非法移民全部丢给了加州，加州被强塞两千万非法移民，包括跳的很厉害的波士顿，直接给他塞五百万，马上老实,,,,,2024-11-20T01:08:38,iPhone 15 Plus,260,29,17,,,2024-11-20 01:08:38,True
5102588609432085	,P15laDzIp,哈哈哈哈😂 ,,https://wx3.sinaimg.cn/large/63912bc0gy1hvs1bap0q2j20um0r17f1.jpg,,,2024-11-20T00:56:28,iPhone 15 Plus,226,21,20,,,2024-11-20 00:56:28,True
5102582119532698	,P15aHDZTc,"今天国足能赢吗
 ",,,,,2024-11-20T00:30:41,iPhone 15 Plus,94,15,0,,,2024-11-20 00:30:41,True
5102560895829151	,P14Ctosqz,学瑞士,,,,,2024-11-19T23:06:20,微博网页版,65,8,1,,,2024-11-19 23:06:20,False,1638782947,新浪财经,5102438019501124	,P11qhDRFW,"【#多家银行宣布启动新一轮沉睡账户清理#】据经济日报，近日，多家股份制银行、城商行及农商行等金融机构相继发布公告，宣布启动新一轮沉睡账户清理工作。此举旨在通过对个人长期未使用的银行账户进行集中清理，优化银行资源配置，提升金融服务质效。据不完全统计，今年已有12家A股上市银行发布相关公告，并多集中在城商行。同时，此次沉睡账户清理范围涵盖各类个人银行账户，但各家银行对账户未交易期限的设定略有不同。（每日经济新闻综合）小调查：#你有长期不用的银行卡吗#？ 
 
网页链接",,,,,2024-11-19T14:58:05,微博网页版,810,9,7,"多家银行宣布启动新一轮沉睡账户清理,你有长期不用的银行卡吗",,2024-11-19 14:58:05
5102560148456180	,P14BgztQ0,回复@超级果味茄:这个地方生产肥美的大西洋鲑鱼。。。。。//@超级果味茄:Holy shit,,,,,2024-11-19T23:03:22,微博网页版,51,8,3,,"超级果味茄,超级果味茄",2024-11-19 23:03:22,False,1670458304,神嘛事儿,5102559492571511	,P14AdaMXZ,研究地球仪，五大湖是世界最大的淡水湖群，与密西西比河水系共同构成了美国本土最主要的水系，其中苏必利尔湖、休伦湖、伊拉湖、安大略湖是加美共治，密歇根湖是美国自己管，最后从圣劳伦斯河进入大西洋，太可怕了，五大湖到时候一堆印度阿三拉屎，直接污染北大西洋，密歇根湖是最深的，也就是说密歇根湖会沉淀最终之大粪，以下是地图,,"https://wx2.sinaimg.cn/large/63912bc0ly1hvrxw8o8akj20m80euwfp.jpg,https://wx2.sinaimg.cn/large/63912bc0ly1hvrxwwvcbkj22cc0zkni2.jpg",,,2024-11-19T23:00:46,微博网页版,240,34,14,,,2024-11-19 23:00:46
5102559492571511	,P14AdaMXZ,研究地球仪，五大湖是世界最大的淡水湖群，与密西西比河水系共同构成了美国本土最主要的水系，其中苏必利尔湖、休伦湖、伊拉湖、安大略湖是加美共治，密歇根湖是美国自己管，最后从圣劳伦斯河进入大西洋，太可怕了，五大湖到时候一堆印度阿三拉屎，直接污染北大西洋，密歇根湖是最深的，也就是说密歇根湖会沉淀最终之大粪，以下是地图,,"https://wx2.sinaimg.cn/large/63912bc0ly1hvrxw8o8akj20m80euwfp.jpg,https://wx2.sinaimg.cn/large/63912bc0ly1hvrxwwvcbkj22cc0zkni2.jpg",,,2024-11-19T23:00:46,微博网页版,240,34,14,,,2024-11-19 23:00:46,True
5102556852787488	,P14vXbH9u,韩国人咋喜欢吃生牛肝儿？？这东西好吃吗？ ,,,,,2024-11-19T22:50:17,微博网页版,257,36,3,,,2024-11-19 22:50:17,True
5102536537411689	,P13Zbv67n,如果印度阿三占领加拿大，也不是没有反制的办法，直接往空气里面排放氟利昂就行，让太空宇宙射线射死印度阿三 ,,,,,2024-11-19T21:29:34,微博网页版,191,13,0,,,2024-11-19 21:29:34,True
5102527433148638	,P13Kvdd6u,我那个方案最好，就是送到乌克兰战场//@养花新手管家婆:听说美国要求遣返润人但我们不同意，然后我们要求遣返可以但是必须捎带俩红通人员一起送回来，都是江湖传言不知道真假,,,,,2024-11-19T20:53:23,iPhone 15 Plus,190,27,2,,养花新手管家婆,2024-11-19 20:53:23,False,1670458304,神嘛事儿,5102504893221788	,P13a9dw8k,美国如果大规模遣返移民，肯定是用海运的，一船塞几千人，两船就是一万，如果不想走，就去劳改 ,,,,,2024-11-19T19:23:49,iPhone 15 Plus,285,58,12,,,2024-11-19 19:23:49
