id,bid,正文,头条文章url,原始图片url,视频url,位置,日期,工具,点赞数,评论数,转发数,话题,@用户,完整日期,是否原创,源用户id,源用户昵称,源微博id,源微博bid,源微博正文,源微博头条文章url,源微博原始图片url,源微博视频url,源微博位置,源微博日期,源微博工具,源微博点赞数,源微博评论数,源微博转发数,源微博话题,源微博@用户,源微博完整日期
5105943068805410	,P2uBAAWGK,转发微博,,,,,2024-11-29T07:05:54,iPhone客户端,0,0,0,,,2024-11-29 07:05:54,False,5721604933,微微辣vera,5097732740219693	,OF0ts0V9r,"在情绪方面
家长能对孩子做的最糟糕的引导
叫做「给孩子的感受打对错」。
小孩下楼去玩，跟别的小朋友一言不合不开心就回家，说不玩了——这种情况不是很正常吗？不正常的地方在，家长马上去批评孩子：你怎么又跟别人吵架了？你情商太低了，以后的社会是需要高情商的，低情商吃亏的不是你自己吗？
孩子听到的：你这个感受和情绪不对，要改，你这个做法不对要换。
最后孩子说：妈妈，我感觉我做什么都不对。
实际上，所有的感受和情绪，一旦产生了，就没有什么对错之分。
如果要用道德、情商之名来修正情绪，孩子还是不要做人了。
做机器人吧。
孩子的情绪也就只有那几种正面的情绪了。
嫉妒、愤恨、生气、厌恶、嫌恶、脆弱、伤心、痛苦……这些情绪太难听，通通消灭吧。#情绪管理##育儿聊一聊#",,"https://wx2.sinaimg.cn/large/006fdgOxgy1hvcjbqowlvj30i60diabp.jpg,https://wx1.sinaimg.cn/large/006fdgOxgy1hvcjbyltj5j30l60b2tf4.jpg,https://wx3.sinaimg.cn/large/006fdgOxgy1hvcjd31kunj30hg04ijrz.jpg,https://wx4.sinaimg.cn/large/006fdgOxgy1hvcjdp8d3sj30lw0pc14t.jpg,https://wx2.sinaimg.cn/large/006fdgOxgy1hvcjcvyl3nj30lg0ie10k.jpg",,,2024-11-06T15:20:59,微博网页版,64,5,29,"情绪管理,育儿聊一聊",,2024-11-06 15:20:59
5105814034980080	,P2rftkTxS,转发微博,,,,,2024-11-28T22:33:10,iPhone客户端,0,0,0,,,2024-11-28 22:33:10,False,5582425344,更历史,5098884885650214	,OFurKnHSu,"一定要教孩子学会吵架，吵架的能力就是解决冲突的能力，家长看一看！ 
更历史的微博视频
 ",,,"https://f.video.weibocdn.com/o0/NaAJ0984lx08js9gnlfG01041200oKDw0E010.mp4?label=mp4_720p&template=1276x720.25.0&ori=0&ps=1CwnkDw1GXwCQx&Expires=1732878544&ssig=I2UFpfpPRP&KID=unistore,video",,2024-11-09T19:39:12,微博视频号,2635,46,3004,,,2024-11-09 19:39:12
5104619588157730	,P1WaWyeci,转发微博,,,,,2024-11-25T15:26:51,iPhone客户端,0,0,0,,,2024-11-25 15:26:51,False,5721604933,微微辣vera,5095240652034578	,ODXDX8xhM,"我目前发现的唯一一个可能可以让男孩往一条理想方向成长的路，就是，柔软地抚养，更多的指引他看到自己的情绪感受，他人的情绪和感受，然后去谈论。
不要灌输，要谈论。
复盘的时候不是去压制，是去了解他，理解他，接纳他。
你不要去忽略他的情绪，而当他忽略你的情绪时，不断告诉他，这是不ok的我不喜欢这样，就像你自己也不会喜欢这样一样——来去让他习惯想象别人的感受。允许他释放情绪，在无害的情况下，然后我们去复盘。
始终跟孩子站在一起，去信任他，没有人不喜欢被信任的感觉。帮助他而不是与他为敌，也不是完全忽略忽视他。
男孩们有时候看上去对什么都无所谓，其实不少孩子的内心极为细腻，只是被社会刻板印象所约束，被粗暴的教育所压制，他们认为男孩不能柔软不能脆弱，不能哭泣不能示弱，不能拥抱只能坚强——我们应往相反的方向去释放男孩的感受感情和它们背后代表的人性。
然后你会慢慢感觉到，你俩都在往正确的路上在走，他在更柔软，更坚强，更有韧劲。
他会距离那种有毒的阳刚气很远很远。#育儿聊一聊##墩妈的育儿理念#",,,,,2024-10-30T18:18:19,iPhone 14,1138,95,577,"育儿聊一聊,墩妈的育儿理念",,2024-10-30 18:18:19
5104602666241570	,P1VJEqbIu,//@多加香菜多点辣:明明未婚的时候，她也是笑容甜美，眼里有光的元气少女。是什么让她变成了“阁楼上的疯女人”，被公开讨伐，被无限放大缺点，成为疯女人的代名词。我只觉得心疼，为像她一样的万千女性。希望她能成功离掉，找回自己，至于赚钱的能力，她早已经证明了。趁着热度去赚钱，过属于自己的人生。//,,,,,2024-11-25T14:19:37,iPhone客户端,0,0,0,,多加香菜多点辣,2024-11-25 14:19:37,False,1690696460,孟大明白_,5103853597623031	,P1CftvZ67,李行亮的“眼里没别人”的病有多严重呢？他爸病危，他只出门来十分钟都不肯回家看看，让麦琳给他爸喂颗药就行。他爸因此错过黄金抢救时间，临终时只有麦琳在身边，没有看到全家奋力托举的儿子。所以观察室还觉得他是委屈的好男人吗？是不是可以理解麦琳那句“你太残忍了”。 ,,"https://wx4.sinaimg.cn/large/64c5fb0cly1hvw2lmrqc1j20u01sx43s.jpg,https://wx1.sinaimg.cn/large/64c5fb0cly1hvw2ln871vj20go0h8abn.jpg",,,2024-11-23T12:43:05,微博轻享版,12984,244,313,,,2024-11-23 12:43:05
5104332678108620	,P1OIby1qc,转发微博,,,,,2024-11-24T20:26:47,iPhone客户端,0,0,0,,,2024-11-24 20:26:47,False,2705169595,正能量彔,5100286068130191	,P07roy727,"父母存在的意义，看得我泪流满面
最近看了法国插画师Marion Fayolle的小生命Les Petits，全书96个动人的画面，无声胜有声，看得我痛哭流涕，百般滋味在心头。
·
🌟希望你的孩子在把东西弄坏了之后，反应不是“完了，我爸爸一定会打我”，而是“看来我需要给我爸打个电话”。
🌟希望你的孩子在考砸了之后，反应不是“完了，回家又得挨骂了”，而是“好想和妈妈一起散散心啊”。
🌟希望你的孩子在失恋之后，反应不是“唉，肯定又得被说'活该'，而是“嘿嘿，以后电影票都归我老爸买”。
🌟开明的亲子关系，
就是父母可以提要求，但允许子女不听，子女不会因为父母提了要求就嫌他们烦，父母也不会因为子女不听话就指责他不孝；
就是子女的各种感受、想法、意见，可以在父母那里安全且自由地流动；
就是父母给出意见时，没有居高临下的“必须怎样”，没有未经商量的“只能这样”，没有试图掌控的“你还想怎样”。
-
⚠️为什么要对女儿好一点？
因为女孩的一生会有很多苦痛：
怀孕、生娃、带娃、家务、工作、婆 媳
长大后，如果所托非良人
还要面对婚姻的苦辣
父母的爱，是她面对婚姻的底气
-
⚠️为什么要对儿子好一点？
男孩的一生要背负很多：
他是家庭的顶梁柱，是事业的永动机
前半生，父母为他遮风挡雨
后半生，都是需要他去遮风挡雨的人
在单纯的年纪，让他简单快乐一点吧
-
父母对孩子童年的好
是他成年后温暖的避风港：
孩子做错事情时，我愿意倾听他
孩子灰心丧气时，我愿意接纳他
孩子令人失望时，我愿意抱持他
-
养育孩子是互相陪伴着走过人生的一段路
互相分享美好，温暖彼此
而不是相互牺牲
互敬互爱的亲子关系，才能培养出爱父母的孩子
我们的孩子其实比我们想象的更爱我们
良好的家庭关系是相互理解、相互爱护
而不是相互蚕食（yeye妈咪）",,https://wx3.sinaimg.cn/large/a13d9cbbgy1hvj6kbzpt4j20tj13e46o.jpg,,,2024-11-13T16:27:00,,3595,96,2604,,,2024-11-13 16:27:00
5104330910732107	,P1OFl34sb,转发微博,,,,,2024-11-24T20:19:45,iPhone客户端,0,0,0,,,2024-11-24 20:19:45,False,7817803313,抑郁研究中心,5103572102418376	,P1uVsa984,"突然发现自己很早就开始躯体化了……
你是不是总以为
手抖、心慌、幻听、记性差以为是没休息好导致的；
腰疼站不直以为是腰肌劳损导致的；
后背、肩膀疼以为是坐姿站姿不对导致的；
胃疼胃酸反流以为是吃太多导致的；
浑身酸痛以为是躺太久、不爱运动导致的；
突然流泪以为是泪点太低导致的；
心跳加速、耳鸣以为是熬夜玩手机导致的；
四肢发麻、肌肉抽动以为是肌肉僵硬导致的；
看文字大脑一片空白以为是集中不了注意力导致的；
暴饮暴食和失去食欲吃什么都吐以为是有胃病导致的；
睡太久醒不来以为是做太多梦太累导致的；
失眠、睁着眼睛等天亮以为是想太多导致的；
发冷汗、经常眼前一黑以为是低血糖导致的；
心浮气躁以为是火气大导致的；
对什么都提不起兴趣以为是自闭导致的……
然而，其实这些都是抑郁导致的躯体化，如果你身体上的不适已经影响日常生活了的话一定要尽快到医院检查治疗，该吃药吃药，该做咨询就做咨询，千万不要拖，拖到严重了才治真的很恼火。
如果你现阶段不方便去医院，也可以先自测一下，在心理学上，SCL-90状态自评量表是测试抑郁焦虑信效度最高，也是使用最为广泛的精神障碍和心理疾病门诊检查量表，自测简便，5分钟可以做完，自评结果可以清晰显示十个因子上心理健康指标（注：各项指标超过2就是状态明显了，跟医院的检测单一致。）
SCL-90抑郁量表测试入口
 
你答一答，就能更清楚地知道自己的情绪稳定性怎么样，有没有消极情绪在作祟。这样，你就能更好地掌握自己的情绪，及时调整心态，避免心理问题进一步恶化。
其次，SCL-90测试还能帮你及早发现潜在的心理问题。有些时候，我们可能并没有意识到自己的情绪已经出现了问题，或者只是把它当作一时的情绪波动。但是，通过SCL-90测试，你可以更客观地了解自己的情绪状态，及时发现并处理潜在的心理问题。
SCL-90抑郁量表测试入口
 
允许躯体化反应的存在，坦然接受，现在抑郁的人已经没有什么稀奇的了，通过积极的治疗大家都能够慢慢走出来，不要轻易放弃自己。相信并愿意让自己可以好起来，才是好起来的第一步。
在这里我想告诉还在抑郁中的朋友，真正的强大在于接纳，允许并接纳一切，不抗拒，接受变化，包容挫折，调节情绪。当我们接纳一切发生，内心就会柔和下来，境随心转，困难也会变得渺小起来！
SCL-90抑郁量表测试入口
 ",,,,,2024-11-22T18:04:32,微博网页版,3933,190,420,,,2024-11-22 18:04:32
