id,bid,正文,头条文章url,原始图片url,视频url,位置,日期,工具,点赞数,评论数,转发数,话题,@用户,完整日期,是否原创,源用户id,源用户昵称,源微博id,源微博bid,源微博正文,源微博头条文章url,源微博原始图片url,源微博视频url,源微博位置,源微博日期,源微博工具,源微博点赞数,源微博评论数,源微博转发数,源微博话题,源微博@用户,源微博完整日期
5102913126925332	,P1dMAt3AU,朋友问我为什么心血来潮修眼睛 我说想要回归初心 他就问是不是因为现在对象喜欢我初脸 我？压根没考虑过对象感受哦哈哈 我现在的宗旨是 什么让我有自信我就去做什么 以前想要大眼大xiong小脸就去冲 现在想要自然就换回自然 虽然本质还是在意他人看法 实际我是听自己的内心声音：这样可以更自信哦 我：好咧收到了冲！,,,,,2024-11-20T22:25:59,iPhone 14 Pro Max,2,0,0,,,2024-11-20 22:25:59,True
5102911826692084	,P1dKus4UQ,哈哈哈很搞笑但是很简单易懂的私密功课 大yc填充少量多次 一下堆太多存活差也塞不进的 慢慢修饰 记得阴阜（yin蒂）上面的位置也要填也要饱满才好看 说一个冷知识：私密不管再怎么手术都不如脱毛和粉嫩 粉粉嫩嫩的视觉效果拉满,,,,,2024-11-20T22:20:49,iPhone 14 Pro Max,0,0,0,,,2024-11-20 22:20:49,False,5831276533,动物保护法什么时候上线,5101132336597452	,P0tslrGiw,"我这个b是商用的所以早就做过了
好多年前在渠道做的，我都不知道医生是谁。因为我是商用b，所以对b的功课多少有点了解，浅浅画个功课图吧，能看得懂就看，看不懂就算了，希望姐妹们少走弯路。切太多小唇b容易合不上，大唇外侧填多了也会合不上，只要猛猛填大唇内侧你的b就难看不到哪里去 ",,https://wx4.sinaimg.cn/large/006mDrpjgy1hvne03oh9vj31401hcam0.jpg,,,2024-11-16T00:29:46,,133,31,29,,,2024-11-16 00:29:46
5102909746318184	,P1dH8qvEc,以前写医生都写缩写就是怕被骂 现在想想 骂就骂吧 对了我轮廓医生靳琦 我挑他就是因为他切下颌角狠 现在看来 切tm的狠 切凹了感觉我都要补骨了 其他姐妹劝的时候我也不听了直接冲 就冲他切的狠去的 颧骨推的不狠所以我没垂 脸是小了一圈 也没有伤到面部肌肉神经 不算失败 不推荐不踩拉～看基础看命啦 ,,,,,2024-11-20T22:12:33,iPhone 14 Pro Max,1,1,0,,,2024-11-20 22:12:33,True
5102907144013316	,P1dCWgQ2U,刚下楼去拍了一下卜医生我的眼睛医生 之前我说打私密不痛的也是他 不想推哪个医生怕你们不做功课盲冲然后骂我哈哈 对了刘月更其实最早最早十几年前做眼睛出名的 现在你们能做到的都是他xiong的功课了 至于为什么选了卜医生没选他 偷偷的说是因为卜医生对我的诉求更认真 ,,"https://wx1.sinaimg.cn/large/006SuxNigy1hvt1revvjbj30u0140teq.jpg,https://wx4.sinaimg.cn/large/006SuxNigy1hvt1rfpu3ej31400u0n3k.jpg",https://video.weibo.com/media/play?livephoto=https%3A%2F%2Flivephoto.us.sinaimg.cn%2F0010psCJgx08jK6AHdxC0f0f01005uzh0k01.mov;https://video.weibo.com/media/play?livephoto=https%3A%2F%2Flivephoto.us.sinaimg.cn%2F003dcUyegx08jK6ALKo70f0f01004kJY0k01.mov,,2024-11-20T22:02:13,iPhone 14 Pro Max,0,0,0,,,2024-11-20 22:02:13,True
5102623050956953	,P16eJ40WJ,"今天陪姐妹抽腰腹填xiong和臀 她状态挺好 7点左右回病房  9点多醒了  我一般得睡到第二日早上 还是在医院睡觉心安理得 笑死我是真喜欢医院 
深圳·深圳军科医院-整形科
 ",,,,深圳·深圳军科医院-整形科,2024-11-20T03:13:20,iPhone 14 Pro Max,0,1,0,,,2024-11-20 03:13:20,True
5102622224679550	,P16dojDmC,"包眼角修双眼皮第三天，消肿80%了，裸花紫珠快递都还没到
拖延症要是早点买就好了，消肿药没吃上估计就都消肿了
我现在的自信也不知道哪里来，红着眼睛带个眼镜直接出门见人都昂首挺胸 笑死 
水根甜子的微博视频
 ",,,"https://f.video.weibocdn.com/u0/BCE8dyQwgx08jIQDL1Be010412002soZ0E010.mp4?label=mp4_720p&template=720x960.24.0&ori=0&ps=1CwnkDw1GXwCQx&Expires=1732888532&ssig=2Uhph%2BIrX4&KID=unistore,video",,2024-11-20T03:10:03,微博视频号,1,1,0,,,2024-11-20 03:10:03,True
5102621220143354	,P16bM0Bia,修双眼皮的第三天 包眼角的那个点卜医生说没关系 反正我是百分百相信他的 恢复成这样已经很满意噜 拆完线估计半个月就能看到未来的样子了 现在还是微肿 ,,"https://wx4.sinaimg.cn/large/006SuxNigy1hvs4zk524bj30u0140tiu.jpg,https://wx2.sinaimg.cn/large/006SuxNigy1hvs4zmekagj30u0140155.jpg",https://video.weibo.com/media/play?livephoto=https%3A%2F%2Flivephoto.us.sinaimg.cn%2F002QbbKDgx08jIQzb5qw0f0f01002wrl0k01.mov;https://video.weibo.com/media/play?livephoto=https%3A%2F%2Flivephoto.us.sinaimg.cn%2F001QxkIxgx08jIQzdIqz0f0f0100569q0k01.mov,,2024-11-20T03:06:03,iPhone 14 Pro Max,0,0,0,,,2024-11-20 03:06:03,True
