id,bid,正文,头条文章url,原始图片url,视频url,位置,日期,工具,点赞数,评论数,转发数,话题,@用户,完整日期,是否原创,源用户id,源用户昵称,源微博id,源微博bid,源微博正文,源微博头条文章url,源微博原始图片url,源微博视频url,源微博位置,源微博日期,源微博工具,源微博点赞数,源微博评论数,源微博转发数,源微博话题,源微博@用户,源微博完整日期
5104701525725023	,P1Yj6o1l5,"颈阔肌三件套：颈阔肌成型+内窥镜剪脂+下颌缘提升  
——7天效果展示（站立位 
 
这位求美者目前下颌囊袋和术前对比改善明显，不过还在恢复期仍存在一定程度的肿胀。
姑娘心情比较急切想快速消肿，建议还需要对肿胀部位加大压力，术后一个月会有轻微肿胀，一般在术后三个月左右逐渐恢复自然#夏文豪颈阔肌成形##颈阔肌成形术#面部年轻化",,"https://wx4.sinaimg.cn/large/00696568gy1hvyrzfewmsj318z0u07b2.jpg,https://wx3.sinaimg.cn/large/00696568gy1hvyrzfwycyj318z0u0473.jpg,https://wx1.sinaimg.cn/large/00696568gy1hvyrzgehtbj318z0u0gst.jpg",,,2024-11-25T20:52:27,面部年轻化超话,0,0,0,"夏文豪颈阔肌成形,颈阔肌成形术",,2024-11-25 20:52:27,True
5102786189199494	,P1atQCBcW,"颈阔肌三件套：颈阔肌成型+内窥镜剪脂+下颌缘提升  
——即刻情况展示（躺位 
 
姑娘本身的BMI值不高，主要是想持久性的改善下巴脂肪堆积的问题；她本身下巴肌肉是没有松弛的 ，通过颈阔肌向上提拉让下巴这块的皮肉更贴合是她术中的重要点#颈阔肌成形术##夏文豪颈阔肌成形#面部年轻化
 ",,"https://wx1.sinaimg.cn/large/00696568gy1hvsnzjw7n4j30u0190grw.jpg,https://wx2.sinaimg.cn/large/00696568gy1hvsnzji8snj30mi0s80xb.jpg,https://wx3.sinaimg.cn/large/00696568gy1hvsnzkb0b2j30u019045y.jpg,https://wx1.sinaimg.cn/large/00696568gy1hvsnzknnq2j30mi0s8n3u.jpg,https://wx1.sinaimg.cn/large/00696568gy1hvsnzj2l98j30mi0s8q5v.jpg",,,2024-11-20T14:01:35,面部年轻化超话,2,0,1,"颈阔肌成形术,夏文豪颈阔肌成形",,2024-11-20 14:01:35,True
