id,bid,正文,头条文章url,原始图片url,视频url,位置,日期,工具,点赞数,评论数,转发数,话题,@用户,完整日期,是否原创,源用户id,源用户昵称,源微博id,源微博bid,源微博正文,源微博头条文章url,源微博原始图片url,源微博视频url,源微博位置,源微博日期,源微博工具,源微博点赞数,源微博评论数,源微博转发数,源微博话题,源微博@用户,源微博完整日期
5105440690017423	,P2hxj04x1,"小姐姐ADM卧蚕术后八个月远期反馈～
卧蚕立体饱满，疤痕完全不可见，显得小姐姐眼睛幼态有神，效果非常满意。
这大概率是小眼眶，能做到的最大程度卧蚕啦
感谢小姐姐反馈，祝小姐姐越来越美#薛峰医生##adm卧蚕##卧蚕#眼部手术
 ",,https://wx4.sinaimg.cn/large/008yCSepgy1hw14v1cngxj33ji3ji1kz.jpg,,,2024-11-27T21:49:37,HUAWEI Mate 60,1,0,0,"薛峰医生,adm卧蚕,卧蚕",,2024-11-27 21:49:37,True
5105382873894301	,P2g23gl5j,"姑奶奶已经够大了 眼眶有限制啊，我也想像鼻子医生那样还可以把骨头处理了
恢复恢复吧，还会更好看的，大美女",,,,,2024-11-27T17:59:53,HUAWEI Mate 60,1,5,0,,,2024-11-27 17:59:53,False,7846186092,0vovovovovovovo,5105090071365579	,P28pN5Jft,"adm卧蚕倒睫二祛眼袋n开外眼角下至📝
p1p2我做adm卧蚕的原因 之前做过祛眼袋和几次外眼角下至眼下瘢痕重注射难进针 眼下兜不住针剂 面gzx的时候虽然鼻子被拒了但是他建议我做个卧蚕 我还是相信葛子审美的
p3-p5基本涵盖了所有手术问题
p6解释了我又开一次外眼角下至的原因 其实我对之前的外眼角下至是满意的 但是做adm卧蚕必须重新做下至我想那就都再开大一次吧 后面面诊的时候xf还指出我有倒睫问题需要做矫正 我术前也没怎么做功课 有认识的人做得不错长期稳定我就冲了 手术过程很复杂 xf打开我眼睛整个无语住了 他真没想到我眼下这么复杂 这次应该算超超超高难度修复 最后手术做了四个小时结束的时候xf腰疼坏了 我有点不好意思 本来没做案例但是我说等恢复好满意的话给他写一篇反馈 于是有了这篇反馈
p7-p10满月不同光线表情下的样子和疤痕状态 说实话我术前很担心疤痕问题 手术结束看到xf的缝线我就不担心了 卧蚕目前处于刚开始显形的阶段 在现实中看已经挺明显了 我没有选夸张卧蚕 因为当时xf问我想要大下至还是大卧蚕我选了大下至 人的眼眶骨只有那么大 下至大会挤压卧蚕的空间 两者不能共存除非是眼眶骨条件非常好的人
p11不戴美瞳同角度对比外眼角下至回缩程度 拍照看几乎没怎么回缩 但是我最近怎么总觉得自己眼睛变小了 是我看习惯现在的眼睛了吗？@薛峰不是神医 能不能把我的外眼角下至再开大一点捏
p12一部分小记录",,"https://wx1.sinaimg.cn/large/008yZNqAgy1hvzu6r0a6ej31bu0qwdqm.jpg,https://wx3.sinaimg.cn/large/008yZNqAgy1hvzu6rma3tj30xi0iu12q.jpg,https://wx4.sinaimg.cn/large/008yZNqAgy1hvzu6s94yoj30xi20ue26.jpg,https://wx4.sinaimg.cn/large/008yZNqAgy1hvzu6t4fmnj30xi20u1kx.jpg,https://wx2.sinaimg.cn/large/008yZNqAgy1hvzu6o4ms5j30xi20u1kx.jpg,https://wx4.sinaimg.cn/large/008yZNqAgy1hvzumm0ajpj30xc3zu4ea.jpg,https://wx2.sinaimg.cn/large/008yZNqAgy1hvzub1g4uvj31mx0x5k25.jpg,https://wx1.sinaimg.cn/large/008yZNqAgy1hvzub0v9yvj316j0nyq94.jpg,https://wx3.sinaimg.cn/large/008yZNqAgy1hvzub202o8j31bx0qyjwo.jpg,https://wx2.sinaimg.cn/large/008yZNqAgy1hvzub2o902j317u0oon38.jpg,https://wx2.sinaimg.cn/large/008yZNqAgy1hvzub6u61dj335d3j7kjl.jpg,https://wx2.sinaimg.cn/large/008yZNqAgy1hw00kqzsnyj30xi1hf4bg.jpg",https://video.weibo.com/media/play?livephoto=https%3A%2F%2Flivephoto.us.sinaimg.cn%2F003SoHaZgx08jTIhrBzF0f0f01008M6z0k01.mov;https://video.weibo.com/media/play?livephoto=https%3A%2F%2Flivephoto.us.sinaimg.cn%2F004qXBKjgx08jTIhtMAE0f0f01004e5K0k01.mov;https://video.weibo.com/media/play?livephoto=https%3A%2F%2Flivephoto.us.sinaimg.cn%2F000hHIdfgx08jTIhxjws0f0f01003gin0k01.mov;https://video.weibo.com/media/play?livephoto=https%3A%2F%2Flivephoto.us.sinaimg.cn%2F002n5ptvgx08jTIhzfRm0f0f010038a50k01.mov,,2024-11-26T22:36:23,iPhone 16 Pro,33,24,8,,薛峰不是神医,2024-11-26 22:36:23
5105013375898743	,P26q5oKx1,害羞了害羞了，还是需要恢复的，以后会更好。,,,,,2024-11-26T17:31:38,HUAWEI Mate 60,2,0,0,,,2024-11-26 17:31:38,False,5582622488,重生之我是猫大王,5105012016945933	,P26nTt8Xb,"提肌修复还得找xf医生@薛峰不是神医 ！！！
所有上睑下垂 提肌修复看过来！！！
我这只眼睛这次是第四次修复了，术前一直很焦虑，天天熬夜做功课，也面了很多整圈的医生但是感觉都不合适，我上一次是找整圈名医修的哈（p3是当时的术后即刻，医生根本不听我的想法很有自己的审美⚠️所以一定要找一个尊重自己审美的医生‼️这很重要)
后来做功课做崩溃了都不想修了，结果偶然刷到薛峰医生的案例，当时看到有小切口提肌直接被控住，但是当时其实没看到太多案例有点担心的，又因为时间很急直接就预约了面诊➕手术（当时想着面诊不理想的话就算了 不修了 哈哈哈哈哈哈 对不起薛医生🧎我错了）但是！！！当天面诊的时候我一下就放心啦！！薛医生人真的超级超级好！！！还很幽默，最重要的是他会尊重我的想法然后给我制定我的提肌方案‼️‼️‼️我当下真的什么都不想了，直接就想原地手术，贼着急 
手术过程也很顺利～我本来超级紧张➕焦虑的（修复👀好几次的人都懂吧，打麻药那一刻焦虑达到顶峰，尤其是我本来就有闭眼不全总是担心会严重，这次做了闭眼不全也没加重 吼吼），但是薛医生很幽默很温柔 我都没怎么担心痛就做完啦，术后即刻效果就是p1这样！真的 我是一个超级爱肿的体质 术后即刻这次都没怎么肿，对比一下图三很明显的吧！！！
然后恢复也很快，p2的照片是术后第二天真的没怎么肿，小切口真的太香了！！！眼睛终于可以封🔪了！！！然后到今天拆线 已经基本消肿啦！！！期待后期完全消肿的样子  从今天开始我要为薛医生发108条微博 哈哈哈哈哈🫰🏻",,"https://wx2.sinaimg.cn/large/0065O78cgy1hvzrvxbikhj30z40uutgi.jpg,https://wx1.sinaimg.cn/large/0065O78cgy1hvzqckk62uj30if0b975l.jpg,https://wx4.sinaimg.cn/large/0065O78cgy1hvzqgme3qoj30hm0cp40p.jpg,https://wx1.sinaimg.cn/large/0065O78cgy1hvzrn6qis8j30cz0bqjsk.jpg,https://wx3.sinaimg.cn/large/0065O78cgy1hvzri6xelij31sc1on1jq.jpg",,,2024-11-26T17:26:14,iPhone客户端,2,2,1,,薛峰不是神医,2024-11-26 17:26:14
5104934292294152	,P24mx9COs,"大家在卧蚕选择的时候，可以不再迷茫#adm卧蚕##卧蚕#眼部手术#薛峰医生# 
薛峰不是神医的微博视频
 ",,,"https://f.video.weibocdn.com/o0/363XJfXalx08jT1LTuMg01041200eOJY0E010.mp4?label=mp4_720p&template=720x1280.24.0&ori=0&ps=1CwnkDw1GXwCQx&Expires=1732878658&ssig=rs%2F5kpAsNd&KID=unistore,video",,2024-11-26T12:17:23,微博视频号,1,0,0,"adm卧蚕,卧蚕,薛峰医生",,2024-11-26 12:17:23,True
5103202944947879	,P1lk2kLav,"god bless u 
让我膨胀一会 ",,https://wx3.sinaimg.cn/large/008yCSepgy1hvtzv5jbj9j30so0gewf6.jpg,,,2024-11-21T17:37:38,HUAWEI Mate 60,2,0,0,,,2024-11-21 17:37:38,True
5102893176721845	,P1dgpscER,"小姐姐单侧小切口提肌术前后对比～
小姐姐术前两侧瞳孔暴露度不一，显得大小眼睛比较明显，小姐姐的诉求是两边眼睛尽量一致。面诊时我发现小姐姐有部分原因是高低眼，再加上两边提肌不一样，所以导致大小眼更明显了。我通过小切口调整提肌来改善小姐姐的瞳孔暴露度，尽量使两边眼睛大小一致。我的小切口提肌开口约5-8mm，在双眼皮褶皱处，切口隐蔽恢复期短，术后效果明显。
感谢小姐姐信任，期待恢复
眼部手术#提肌##提肌# 
上海·悦颜医疗",,https://wx4.sinaimg.cn/large/008yCSepgy1hvt0a68e0lj335s35su0y.jpg,,上海·悦颜医疗,2024-11-20T21:06:43,HUAWEI Mate 60,1,0,0,"提肌,提肌",,2024-11-20 21:06:43,True
