id,bid,正文,头条文章url,原始图片url,视频url,位置,日期,工具,点赞数,评论数,转发数,话题,@用户,完整日期,是否原创,源用户id,源用户昵称,源微博id,源微博bid,源微博正文,源微博头条文章url,源微博原始图片url,源微博视频url,源微博位置,源微博日期,源微博工具,源微博点赞数,源微博评论数,源微博转发数,源微博话题,源微博@用户,源微博完整日期
5106071234675456	,P2xWjjCiA,刘谦的健康现在说康复还有点为时过早，希望未来三四年内他能创造奇迹 ,,"https://wx4.sinaimg.cn/large/006yDd1ugy1hw359wd31sj30u01hcduo.jpg,https://wx3.sinaimg.cn/large/006yDd1ugy1hw359x130cj30u0190au1.jpg",,,2024-11-29T15:35:11,,33,7,0,,,2024-11-29 15:35:11,True
5106050519008925	,P2xoTBNDf,一个男人或女人事业能干也会赚钱，也特别花心多情，周围的人会同情他/她的伴侣，利益方面不会做切割，利益大于人性 ,,,,,2024-11-29T14:12:52,,104,7,0,,,2024-11-29 14:12:52,True
5105991033031305	,P2vQXcIA1,#黎巴嫩人得知停火回家大堵车#小心回家聚集一堆人被以色列射 ,,,,,2024-11-29T10:16:30,,77,9,0,黎巴嫩人得知停火回家大堵车,,2024-11-29 10:16:30,True
5105988211839256	,P2vMp7Itq,离婚两次自己有孩子情况下，不管男女就无必要再婚，双方都会心疼自己的孩子，双方的子女都有可能挑唆离间关系，大部分也会相互防，不如搭伙过日子减轻矛盾 ,,,,,2024-11-29T10:05:17,,268,23,3,,,2024-11-29 10:05:17,True
5105769873933677	,P2q6fgvkp,"夕阳无限好，只是近黄昏
姓名带夕的人，这个名字容易有失眠或喜欢熬夜的情况，会经历异地恋，异地恋会很甜蜜，长期住一起相互看着不顺眼，另一半性格容易多变捉摸不透，女生有艺术细胞，比较会手工活儿，这个名字提防亲朋忽悠凡事要多个心眼 ",,https://wx3.sinaimg.cn/large/006yDd1ugy1hw26okq8d8j30i20i274c.jpg,,,2024-11-28T19:37:41,,123,43,2,,,2024-11-28 19:37:41,True
5105711227080176	,P2ozEtHSo,婚姻如果用个人标准衡量另一半，十个人都会有不同的怨言，婚姻一直很顺的没几个，到了某个时间段有不同的冲突，从爱情变亲情是常态 ,,,,,2024-11-28T15:44:39,,351,36,5,,,2024-11-28 15:44:39,True
5105673102428226	,P2nAaabGW,"有心栽花花不开,无心插柳柳成荫，说的就是阴差阳错日的男女，感情上也容易被亲朋干预，嫁娶外地或许是一种小小的化解 ",,,,,2024-11-28T13:13:09,,259,54,13,,,2024-11-28 13:13:09,True
5105657345477464	,P2naKmYWc,如果命都那么好改，没钱的时候改成有钱人，有钱的时候改人生赢家，现实吗？ ,,,,,2024-11-28T12:10:32,,250,22,4,,,2024-11-28 12:10:32,True
5105596726509587	,P2lAYrjrl,"有的人嫌弃老人长寿，占用了后代寿元，如果一个人太过于优秀，他/她的后代容易有不学无术或不长寿之人，大家从来不会觉得太过于优秀也会影响后代
长寿的老人没有利益价值就会被认定负担，优秀的人后代巴不得他多活，活着就能多一份保障 ",,,,,2024-11-28T08:09:39,,651,93,7,,,2024-11-28 08:09:39,True
5105411225030042	,P2gLMl6xI,#男子为骗保把妻子推下轮船坠海身亡#女方不认识字，离婚两次有两子女，男方大龄未婚是个老板，婚姻关系同事都不知道，女方或许觉得天降馅饼，结果与世界告别，推到海里尸体都能捞起来，男方要把房车过户给女方儿子，这个儿子催公安早日火化他妈的尸体，这个女人压根不懂人性，一个有钱的老板，多数会找年轻的女人生育，就算不生育，找另一半也会看中对方的经济实力，这个女人什么都没有，也敢相信掉馅饼,,,,,2024-11-27T19:52:32,,2227,152,45,男子为骗保把妻子推下轮船坠海身亡,,2024-11-27 19:52:32,True
5105322161868554	,P2es87Q5Y,男女只要手凉、脚凉、屁股四周凉，男人的持久硬度不够，女人不热衷性趣 ,,,,,2024-11-27T13:58:38,,359,98,11,,,2024-11-27 13:58:38,True
5105311112758660	,P2eajbzEw,普通人觉得几百万几千万一辈子花不完，只要碰了黄赌毒，不出三年一夜返贫，现实生活中身边人知道某某的存款，有心想搞人，有的是办法把这个人变成穷人 ,,,,,2024-11-27T13:14:44,,781,43,33,,,2024-11-27 13:14:44,True
5105278304916537	,P2djokD0Z,只同居生子不领结婚证，命带童子煞或许会做出这样的决定，童子煞不代表短命，通常这类人会晚婚晚育 ,,,,,2024-11-27T11:04:22,,198,72,4,,,2024-11-27 11:04:22,True
5105250203862245	,P2cA4gcKh,20岁以前继承的巨额财富，基本上没有几个人笑到最后，如果钱带有因果，谁继承的多，承受的业力也会增多，比如老赖借了很多钱突然死了，他的孩子悄悄继承了财富，孩子后期也会遇到被人坑骗财富之事 ,,,,,2024-11-27T09:12:42,,222,21,6,,,2024-11-27 09:12:42,True
5105032447919775	,P26UQxeij,晓华没有任何损失她继续干理发店，能把自己的日子过好，头脑发热的摊贩必定要亏钱，凑热闹有代价，跟风的网红不会有任何损失 ,,https://wx1.sinaimg.cn/large/006yDd1ugy1hvztzkw9k0j30w01msavc.jpg,,,2024-11-26T18:47:25,,480,37,1,,,2024-11-26 18:47:25,True
5105004444648767	,P26bGjvm7,这款艾条去年差不多12月份的时候很火，一直到今年反馈效果都不错，可以适当备点 ,,"https://wx4.sinaimg.cn/large/006yDd1ugy1hvzqpxmn5ej30w00n40ye.jpg,https://wx1.sinaimg.cn/large/006yDd1ugy1hvzqpxx831j30w00mgq83.jpg,https://wx1.sinaimg.cn/large/006yDd1ugy1hvzqq1jtfrj30sg0sgk7k.jpg,https://wx3.sinaimg.cn/large/006yDd1ugy1hvzqrvo3eyj30w00c3ta9.jpg",,,2024-11-26T16:56:08,,37,6,1,,,2024-11-26 16:56:08,True
5104997832591800	,P2611aSfe,"某人有两套房，妻子怀孕期间能装修吗？我认为能，比如a房夫妻长期住，怀孕期间不要随意动工，b房夫妻一直没有居住可以择日动工，动工期间妻子少去即可，妻子体质不好的，需要卧床保胎，等孩子生下来再考虑装修之事
禁止抬杠，欢迎现身说法 ",,,,,2024-11-26T16:29:52,,156,32,5,,,2024-11-26 16:29:52,True
5104956495365530	,P24WlmvOO,生死带有阴差阳错的信息，走好运的时候，做个积德行善的事情，名誉奖励手到擒来，运势不好做了好事，或许会被人诬陷纠缠 ,,"https://wx3.sinaimg.cn/large/006yDd1ugy1hvzl7oehgvj30w00mbwhd.jpg,https://wx3.sinaimg.cn/large/006yDd1ugy1hvzl7opx6ej30wg0gwgmt.jpg",,,2024-11-26T13:45:37,,402,57,14,,,2024-11-26 13:45:37,True
5104940886788460	,P24xastZi,#广电总局要求加强对霸总微短剧管理#霸总只能出现在电视剧，专一又爱底层普女，小说里设计的普女通常都是几年后回归，是以精英的身份回归，现实生活中普女通常是暖床的下场，想要攀高自己要隐忍还要能干才能出人头地 ,,,,,2024-11-26T12:43:35,,251,17,3,广电总局要求加强对霸总微短剧管理,,2024-11-26 12:43:35,True
5104936365068622	,P24pSlgzY,有的二代拿着父母的卡消费，这种人只适合恋爱，认真恋爱结婚生子别找这种废物，父母一旦生意出问题或父母去世或与父母关系出问题，男的没有财源进来，就会各种吸血女人，有钱的时候还有点良知，没钱的时候他的恶毒也会加倍展现 ,,,,,2024-11-26T12:25:37,,221,7,11,,,2024-11-26 12:25:37,True
5104882583340066	,P2318e0U2,"以前都是父母婚配，对于恋爱几次的，就会形容成风月场所女子
现在的说法是手比较软她会经历好几段感情，时代在变千万别按照书中的说法给人测算 ",,https://wx3.sinaimg.cn/large/006yDd1ugy1hvzcpjuqa4j30mq0sgzlf.jpg,,,2024-11-26T08:51:55,,290,110,10,,,2024-11-26 08:51:55,True
5104871827832867	,P22JMwRGz,有的地方会让孩子认石头或大树为干爹干妈 ,,,,,2024-11-26T08:09:09,,242,85,10,,,2024-11-26 08:09:09,True
5104682817033635	,P1XOVtvLJ,有深意的提醒 ,,https://wx1.sinaimg.cn/large/006yDd1ugy1hvypu0fhlzj30nm0y045q.jpg,,,2024-11-25T19:38:07,,785,55,24,,,2024-11-25 19:38:07,True
5104675550663325	,P1XDd2MyN,"家境好面相不好，找到的伴侣家庭不富有或对方健康不佳或对方不良嗜好
 ",,,,,2024-11-25T19:09:14,,205,21,6,,,2024-11-25 19:09:14,True
5104616889648694	,P1W6AEu46,"小圈子月运提到过这个月会有烈士遗骸新闻 
也说了气温会极速下降，甚至有冰雹，下个月加速冷空气，各位记得防寒保暖 ",,"https://wx1.sinaimg.cn/large/006yDd1ugy1hvyi8j97e5j30zk252n8b.jpg,https://wx3.sinaimg.cn/large/006yDd1ugy1hvyid10octj30u008bjt4.jpg,https://wx4.sinaimg.cn/large/006yDd1ugy1hvyid1alb9j30u00ddgo4.jpg,https://wx3.sinaimg.cn/large/006yDd1ugy1hvyid1ksycj30w00n0tbf.jpg",,,2024-11-25T15:16:08,,153,22,1,,,2024-11-25 15:16:08,True
5104607561518373	,P1VRy6mZT,有的人不顺心去求神拜佛，会承诺愿望实现会还愿，这种许愿更容易成功，弊端是去的寺庙太多，说会还愿，等愿望实现后又觉得是自己的运势好，还不还愿无所谓，建议自己做个记录，许愿还愿内容记清楚 ,,,,,2024-11-25T14:39:04,,422,50,9,,,2024-11-25 14:39:04,True
5104591643610711	,P1VrSf9jh,出了大学后，都会有不同的就业焦虑，赚到钱的网红去嘲笑刚出社会的大学生，参与工作的群体都会看不下去 ,,"https://wx4.sinaimg.cn/large/006yDd1ugy1hvyfa2e63aj30tz0pn10q.jpg,https://wx2.sinaimg.cn/large/006yDd1ugy1hvyfa206h4j30w01nencz.jpg",,,2024-11-25T13:35:49,,293,18,0,,,2024-11-25 13:35:49,True
5104578443349542	,P1V6Ae3mS,或许是怕结婚有其他女人曝光黑料，选择不婚还可以继续安抚自己的相好，自己的名声可以保全，为了抚养费女方也会选择忍让 ,,https://wx3.sinaimg.cn/large/006yDd1ugy1hvyduke880j30w012mk1v.jpg,,,2024-11-25T12:43:22,,249,29,1,,,2024-11-25 12:43:22,True
5104533858684976	,P1TWFArmg,有的人出轨家暴，不影响他和孩子缘分深，妈妈带不走，孩子八字层次有问题，妈妈不要有太深的执念，有时候被男方看出执念，只会被拿捏，有时候男方只是对老婆不好，骨子里会心疼孩子 ,,,,,2024-11-25T09:46:12,,414,25,17,,,2024-11-25 09:46:12,True
5104332265754662	,P1OHwo938,"有被笑到，有的已经整理出12个生肖2025年全犯太岁，有的人更离谱，不解决犯太岁问题，倒霉三到十年
 ",,,,,2024-11-24T20:25:09,,595,89,3,,,2024-11-24 20:25:09,True
5104260692316858	,P1MQ59IIG,"玩擦边没有伤害任何人，只要没伤害到她人，就不能过多指责，玩擦边的时候，把奖牌都拍进去，有点过头了
这次大家都喷管晨辰，吴柳芳接到了泼天的富贵，后期最好收敛一下风格，平台才不会出手干预，另提防私生活毁名声 ",,"https://wx3.sinaimg.cn/large/006yDd1ugy1hvxd8pbr54j30u01hvtmt.jpg,https://wx1.sinaimg.cn/large/006yDd1ugy1hvxd8pvrntj30u01fn129.jpg",,,2024-11-24T15:40:44,,1802,96,5,,,2024-11-24 15:40:44,True
5104221294167720	,P1LOxhudi,做事阴狠毒辣之人 ,,https://wx1.sinaimg.cn/large/006yDd1ugy1hvx8t49k0oj30ko0dw0u7.jpg,,,2024-11-24T13:04:11,,299,34,2,,,2024-11-24 13:04:11,True
5104204278401493	,P1Ln5zfBX,八字土多的人容易有脾胃病、皮肤病、呼吸系统困扰 ,,,,,2024-11-24T11:56:34,,381,115,14,,,2024-11-24 11:56:34,True
5104181457719509	,P1KMhwocd,不要随意和国外回来的人接触太多，12月份到过年期间注意养护身体 ,,"https://wx4.sinaimg.cn/large/006yDd1ugy1hvx47gxmp9j30w00mewlh.jpg,https://wx3.sinaimg.cn/large/006yDd1ugy1hvx47habchj30w00sbdmq.jpg",,,2024-11-24T10:25:53,,381,61,16,,,2024-11-24 10:25:53,True
5104171475274850	,P1Kwbm8ee,发觉87版的红楼梦去世的几个演员都是英年早逝 ,,,,,2024-11-24T09:46:13,,512,30,4,,,2024-11-24 09:46:13,True
5104154995590683	,P1K5Bnsoj,如果我是老板，我对员工的要求是树立正面形象，我工资给到位，员工干活干到位，大家相互尊重即可 ,,,,,2024-11-24T08:40:44,,463,40,7,,,2024-11-24 08:40:44,True
5103958127542740	,P1EY4vEd6,"得肠癌、胃癌、食道癌的，可能与杀生有关，也可能与口业有关，平时说话恶毒，也可能是家族遗传病
餐饮行业弄虚作假、以次充好的也容易与这几类病结缘 ",,,,,2024-11-23T19:38:27,,470,53,31,,,2024-11-23 19:38:27,True
5103877317987286	,P1CRJxvRc,麦明诗适合找成熟包容心较好的男人，似乎她先生身上不具备有这样的特征，麦明诗是妥协包容多的一方，男方爱玩且情绪问题，会影响到婚姻的稳定 ,,"https://wx3.sinaimg.cn/large/006yDd1ugy1hvw53o9kd1j31hc2807j6.jpg,https://wx2.sinaimg.cn/large/006yDd1ugy1hvw53r5ikoj30qo0f0jwc.jpg,https://wx4.sinaimg.cn/large/006yDd1ugy1hvw53sxhl0j30xc0hin47.jpg",,,2024-11-23T14:17:21,,166,20,0,,,2024-11-23 14:17:21,True
5103855402486618	,P1CioaqSK,夫妻感情好，一方离世，另一方也会很快离世，时间不超过两年 ,,,,,2024-11-23T12:50:16,,582,95,14,,,2024-11-23 12:50:16,True
5103836742290397	,P1BOi9BPT,有的夫妻天天吵架、冷战、打架，不影响他们的二胎三胎计划 ,,,,,2024-11-23T11:36:07,,794,68,6,,,2024-11-23 11:36:07,True
5103813667063973	,P1Bd4tDF3,今年的气温很不正常，很多人在气候不正常的时候生病或去世，让住高层的备一点东西，还有人说制造恐慌，人无远虑必有近忧 ,,"https://wx2.sinaimg.cn/large/006yDd1ugy1hvvxxrij6qj30w01muh3x.jpg,https://wx1.sinaimg.cn/large/006yDd1ugy1hvvxxry9q5j30w00f4gol.jpg",,,2024-11-23T10:04:25,,295,60,7,,,2024-11-23 10:04:25,True
5103811968633111	,P1BakAdRJ,权志龙不是男的吗？为什么打扮的越来越女性化？ ,,"https://wx1.sinaimg.cn/large/006yDd1ugy1hvvxqmgy6zj30u0146gsx.jpg,https://wx1.sinaimg.cn/large/006yDd1ugy1hvvxqn7xhrj30u01bzwm1.jpg,https://wx3.sinaimg.cn/large/006yDd1ugy1hvvxqntydaj31401dwamx.jpg",,,2024-11-23T09:57:40,,612,85,3,,,2024-11-23 09:57:40,True
5103592432212377	,P1vsf9hxv,每个人都有不同的缺点，找不到别人的缺点，要么是自己的认知浅，要么是对方阴沉狠毒会伪装 ,,,,,2024-11-22T19:25:19,,276,12,19,,,2024-11-22 19:25:19,True
5103518866475092	,P1txArasY,#不要彩礼不啃老关老板什么事#现在的年轻人靠自己，老人一分都不帮助，自己能有房车的人很少，婚前老人不帮扶，婚后有了孩子，全靠男人一个人养家，家里矛盾也会增多 ,,,,,2024-11-22T14:32:59,,856,52,3,不要彩礼不啃老关老板什么事,,2024-11-22 14:32:59,True
5103470992427620	,P1sinabxa,八字夫星或妻星弱，遇到流年也可以结婚生子，流年走势不太好的时候，容易出现同床异梦、两地分居、性生活不和谐 ,,,,,2024-11-22T11:22:45,,133,21,4,,,2024-11-22 11:22:45,True
5103432880884759	,P1riU3Iaj,王宝强有两个出生年月日，从他的孩子身上验证一下，2025*2026年王宝强运势容易各种不顺，为儿子、为事业、为自身的感情各种烦忧，50出头的样子还可能和公检法打交道 ,,"https://wx3.sinaimg.cn/large/006yDd1ugy1hvuq0515wgj30u00xcaho.jpg,https://wx3.sinaimg.cn/large/006yDd1ugy1hvuq05heokj30hs0qognr.jpg,https://wx4.sinaimg.cn/large/006yDd1ugy1hvuqa6r7a9j30sg10k0xq.jpg",,,2024-11-22T08:51:19,,331,64,1,,,2024-11-22 08:51:19,True
5103423923949222	,P1r4sgzn8,"有时候很多人只看因不看果
比如某人死了伴侣，这个伴侣为人不错，立马再婚再嫁娶的人品不好，很多人觉得没有报应，相当于看电视剧看了一半，不看大结局，相反我觉得再婚嫁娶才是因果的开始，绝对会嫁娶到心性不好的人 ",,,,,2024-11-22T08:15:43,,512,71,16,,,2024-11-22 08:15:43,True
5103242975380801	,P1mmBmzN7,"图一没有被爱滋润，比如父母给的压力大，孩子是不愁吃喝，心理情绪被忽视了
图二明显被宠爱过多，自己容易任性大胆 ",,"https://wx1.sinaimg.cn/large/006yDd1ugy1hvu4fkp5pbj311n0u0n1i.jpg,https://wx1.sinaimg.cn/large/006yDd1ugy1hvu4fl3cxgj30u0190td5.jpg",,,2024-11-21T20:16:41,,625,42,11,,,2024-11-21 20:16:41,True
5103123142281404	,P1jfk9zuQ,有时候子女缘八字说了算，西医的判定只是一个参考，比如西医说男女生殖系统不好，不容易怀孕，需要借助才能怀孕，可能当事人医院跑很多家都没怀孕，当事人躺平的时候自然怀孕 ,,,,,2024-11-21T12:20:31,,302,47,4,,,2024-11-21 12:20:31,True
5103095761602232	,P1ixa6IOs,"胖东来老板于东来给员工立的规矩
 ",,"https://wx2.sinaimg.cn/large/006yDd1ugy1hvtob80nhbj30so1dbn68.jpg,https://wx4.sinaimg.cn/large/006yDd1ugy1hvtnjpn8scj30ok16wjv2.jpg,https://wx3.sinaimg.cn/large/006yDd1ugy1hvtob7lm29j30nw166myv.jpg",,,2024-11-21T10:31:43,,1032,138,6,,,2024-11-21 10:31:43,True
5103055915714699	,P1huTnYEz,唯一幸存的孩子，要么大富大贵要么孤寡命 ,,"https://wx4.sinaimg.cn/large/006yDd1ugy1hvtiz49354j30u01dm0zi.jpg,https://wx1.sinaimg.cn/large/006yDd1ugy1hvtiz4metzj30u015owmx.jpg",,,2024-11-21T07:53:23,,301,27,3,,,2024-11-21 07:53:23,True
5103044968055298	,P1hdexNya,区别一个宗教好坏很容易，比如好的宗教从来不会恐吓信众，不会把价值10块的东西，炒到100块，让信众买单，不强求你随意是常态，相反有的人利用宗教恐吓人，你不化解你自己和家人有大麻烦，化解价格是几千几万，有的人也会说几百，甚至还有人利用宗教，说化解方法是发生性关系，这种垃圾说辞还能吓到一堆人，就没人上去给他两巴掌，真是匪夷所思,,,,,2024-11-21T07:09:53,,215,29,13,,,2024-11-21 07:09:53,True
5102886818677640	,P1d69AprW,"风寒感冒身上发冷，刚开始初期热敷脖子与背部，一定要喝点温开水，三岁以下的幼儿可以用艾叶饼泡澡，三岁以上可以背部做个推拿，穿带帽子的衣服，出去帽子盖头上
成年人风寒感冒可以适当的艾灸或贴敷精油发热贴，要是发热性感冒，成年人可以找针灸扎一下，幼儿我给不了好的方法 ",,"https://wx1.sinaimg.cn/large/006yDd1ugy1hvsze6quguj30w011y7ar.jpg,https://wx3.sinaimg.cn/large/006yDd1ugy1hvsze71fhuj30w00n40ye.jpg,https://wx1.sinaimg.cn/large/006yDd1ugy1hvsze7hto5j30m80m8wna.jpg,https://wx4.sinaimg.cn/large/006yDd1ugy1hvsze7y65aj30m80m8doc.jpg,https://wx1.sinaimg.cn/large/006yDd1ugy1hvszef13huj30j40j4jsf.jpg",,,2024-11-20T20:41:27,,53,3,5,,,2024-11-20 20:41:27,True
5102839078846759	,P1bR9B7rF,"#凶手出狱在受害者家门口大摆宴席#摆什么遗像，直接找个拉粪车，对着那些宾客来一份，这叫见者有粪，看看他的运势后面顺不顺
 ",,,,,2024-11-20T17:31:44,,778,27,2,凶手出狱在受害者家门口大摆宴席,,2024-11-20 17:31:44,True
5102794400860201	,P1aH63BMd,"一个男人聊天动不动我妈说，多数是妈宝，婚后夫妻有矛盾是站妈妈一边，不会正义的为老婆主持公道
 ",,,,,2024-11-20T14:34:13,,340,25,8,,,2024-11-20 14:34:13,True
5102789411998986	,P1az38o1I,八字带天医星、华盖、天德月德之人可以去医院当陪诊、从事医疗、医护工作，也可以卖香火殡葬行业，前提自己要保证质量，不坑蒙拐骗 ,,,,,2024-11-20T14:14:24,,666,183,48,,,2024-11-20 14:14:24,True
5102771584631551	,P1a6ijqSr,耳朵有缺口，童年生过大病或家运起伏较大 ,,https://wx1.sinaimg.cn/large/006yDd1ugy1hvsmat3gnaj30oe0zk10b.jpg,,,2024-11-20T13:03:33,,386,73,11,,,2024-11-20 13:03:33,True
5102769084568461	,P1a2gjasR,有时候遇到突发疾病，医院查不出来，换医院查、用玄学手段调理 ,,https://wx3.sinaimg.cn/large/006yDd1ugy1hvsm0m3fp0j30s30rudnc.jpg,,,2024-11-20T12:53:37,,119,32,5,,,2024-11-20 12:53:37,True
5102758893979988	,P19LPgHnm,下个月医院要爆满了，孩子生病会增加很多，老年人和熬夜的年轻人容易猝死 ,,https://wx4.sinaimg.cn/large/006yDd1ugy1hvsku3nxbnj30w014515z.jpg,,,2024-11-20T12:13:08,,617,155,47,,,2024-11-20 12:13:08,True
5102709589936706	,P18uiFGZs,一家四口只交了三个人的医保，八个瑞士卷这种事，现实生活中比这两个狗血的事更多，男主人过于自私，在这种家庭女人付出得不到尊重，不离婚只有出去赚钱才能得到尊重 ,,"https://wx4.sinaimg.cn/large/006yDd1ugy1hvsf4x5sx8j30u014wqbb.jpg,https://wx1.sinaimg.cn/large/006yDd1ugy1hvsf4xktj4j30u015rn6w.jpg",,,2024-11-20T08:57:13,,961,102,8,,,2024-11-20 08:57:13,True
5102521293210604	,P13ABdtdW,#曝顶流女爱豆有孩子#国内的应该也有孩子曝光，就这个月或下个月 ,,,,,2024-11-19T20:28:59,,207,34,1,曝顶流女爱豆有孩子,,2024-11-19 20:28:59,True
5102500073706976	,P132nfylW,海水倒灌的地方请注意养护自己的健康 ,,"https://wx4.sinaimg.cn/large/006yDd1ugy1hvrr4b5ybdj30w01ihk9d.jpg,https://wx3.sinaimg.cn/large/006yDd1ugy1hvrr49lh4xj30u00blact.jpg",,,2024-11-19T19:04:40,,100,11,3,,,2024-11-19 19:04:40,True
5102453379042228	,P11P3BWio,"接到过一个投稿，某男对外每个月都把一万多的工资上交，只留下五百块自己用，也会定期给老婆买名牌，某一天到处给人说自己老婆出轨了，很多人以为他老婆真的出轨了
工资是上交了，三五天查一次账，用的钱老婆每一笔都要说出去向，所谓的名牌也是高仿，有一段时间自己的工作不顺心，时不时打老婆孩子，老婆提离婚先发制人，说女方给自己带绿帽子
幸福是当事人衡量，外人是没有发言权的",,,,,2024-11-19T15:59:07,,718,44,22,,,2024-11-19 15:59:07,True
5102436647961204	,P11o4xp4w,麦琳喜欢各种压制，私下也是各种操心操劳，这种操心未必得到李行亮和孩子的理解，李行亮对老婆冷漠且小气 ,,"https://wx2.sinaimg.cn/large/006yDd1ugy1hvrjuut2uhj30u014042o.jpg,https://wx4.sinaimg.cn/large/006yDd1ugy1hvrjuvakd8j30so14uq6j.jpg,https://wx2.sinaimg.cn/large/006yDd1ugy1hvrjuvk2t9j30ic08g759.jpg",,,2024-11-19T14:52:38,,1791,137,13,,,2024-11-19 14:52:38,True
5102409407791827	,P10G8wH0D,#九华山景区多只狗被断脚#很多人会觉得虐待动物，不至于有祸事，动物和人一样有仇恨心，喜欢虐待动物的人，自己或后代得恶疾的可能性很高，有钱就是治不好病，或各种因素错过最佳机会 ,,,,,2024-11-19T13:04:23,,1372,92,25,九华山景区多只狗被断脚,,2024-11-19 13:04:23,True
5102365016853746	,P0ZwxsKYi,技多不压身，运势一般的时候，别想着发大财，多去学点东西，运势好转的时候都用的上 ,,,,,2024-11-19T10:08:00,,938,22,42,,,2024-11-19 10:08:00,True
5102358357082825	,P0ZlNtIz7,"上条微博写的是这个月学生、出殡、户外容易有热搜负面新闻，我自己写的时候没有分开，这个月下个月孩子不仅容易被伤害有意外，还要提防病毒生病之事
图三是小圈子提醒的月运
2025年对女性不是很友好，出外请收起手机，在路上少带耳塞 ",,"https://wx1.sinaimg.cn/large/006yDd1ugy1hvrasrhep2j30w00r9wk0.jpg,https://wx3.sinaimg.cn/large/006yDd1ugy1hvrasryex9j30w01na7en.jpg,https://wx3.sinaimg.cn/large/006yDd1ugy1hvrassb0w8j30u008b3zz.jpg",,,2024-11-19T09:41:32,,565,50,14,,,2024-11-19 09:41:32,True
