id,bid,正文,头条文章url,原始图片url,视频url,位置,日期,工具,点赞数,评论数,转发数,话题,@用户,完整日期,是否原创,源用户id,源用户昵称,源微博id,源微博bid,源微博正文,源微博头条文章url,源微博原始图片url,源微博视频url,源微博位置,源微博日期,源微博工具,源微博点赞数,源微博评论数,源微博转发数,源微博话题,源微博@用户,源微博完整日期
5104605400400098	,P1VO41G5c,"太好了 接下来再做个人中和adm卧蚕 脸上就可以封刀了  之后就专心搞身材（腰腹二吸二填胯 再do个🐻）
打算一月十号的时候去北京先做个超声炮，然后再去找老朋友做切内人中➕adm卧蚕，第二天去韩国切外人中➕打薄外人中，顺便打个丽珠兰，然后回来等恢复好就美美回家过年咯 ",,,,,2024-11-25T14:30:28,iPhone客户端,0,0,0,,,2024-11-25 14:30:28,True
5103261193340861	,P1mPZe16R,"我说我山根那里怎么那么粗 原来是有积液
 ",,,,,2024-11-21T21:29:05,iPhone客户端,0,0,0,,,2024-11-21 21:29:05,True
5103200436748996	,P1lfZsjIM,"感觉自己像外星人、、不知道是肿的还是就是没做好
唉 感觉自己越来越平静了、、、心情淡淡的 ",,,,,2024-11-21T17:27:39,iPhone客户端,0,0,0,,,2024-11-21 17:27:39,True
5102834981013701	,P1bKy4fI1,"我感觉我现在不管吃得再多 还是吃得再少 体重就稳定在48 了 现在打司美都对我没用了 我也不想打了 一想到就犯恶心 
最瘦的时候也就是九月底到国庆那段时间了
 ",,,,,2024-11-20T17:15:28,iPhone客户端,1,0,0,,,2024-11-20 17:15:28,True
