id,bid,正文,头条文章url,原始图片url,视频url,位置,日期,工具,点赞数,评论数,转发数,话题,@用户,完整日期,是否原创,源用户id,源用户昵称,源微博id,源微博bid,源微博正文,源微博头条文章url,源微博原始图片url,源微博视频url,源微博位置,源微博日期,源微博工具,源微博点赞数,源微博评论数,源微博转发数,源微博话题,源微博@用户,源微博完整日期
5104473441567345	,P1Sne6zJL,"关注的一个博主，因为帮已婚已育的女性说话（其实还是只麦麦的事情）又被部分骂了。
她们形容生孩子不是免死金牌，哪有那么痛苦，我就很轻松啊。
我想到最近看的小说里那位绝望的主妇。她被是自己上司的丈夫半强迫的上床，甚至可以说是强奸，没有做安全措施，所以怀孕，男方一开始还不想承认。
“真的是我的吗？”充满了疑惑。
后面决定担起“男人的责任”认下这个小孩并且结婚。
于是在他们近20多年的婚姻里，女方无时无刻不忍受着这个强奸犯，他粗鲁，暴力，随时随地大吼小叫，洗完澡的水漂着一层油垢（日本是一家人共用，一般是由一家自主先洗，然后再按照地为轮番，有客人的时候客人先洗），妻子只能吃他剩下来的饭，照顾他已经失智还脾气暴戾的母亲，承受他的责骂（实际上母亲她一天都没有照顾过，甚至为了逃避而分房睡觉）……最可怕的是，明明那么可爱的儿子，最后也长成了丈夫的样子，基因增强的，他也成为了强奸犯，还是用奶奶的遗产摆平的。
大概是这样，还有很多我没有描述出来的，非常让人痛苦的，在这样的情况下，这个没有家庭收入的绝望主妇，选择了给自我洗脑。
“我是幸福的，我是自愿选择进入了婚姻，有了稳定的生活，我应该感恩戴德……”
什么意思呢？就是因为太痛苦太痛苦了，如果不去这样子跟自己说，她的生活，只剩下去死了。
事实上她也自杀过，准备去卧轨的当天偶遇了高中同学，那个闪耀的独立女性，并没有结婚，而是在职场发光发热，当她的同学向她伸以援手，她最初的反应是：这家伙在炫耀什么？在嘲讽我的生活吗？既然要死，我干脆带她一起去死好了。
是的，明明迫害她的是制度，是丈夫和儿子。
但她却只敢把镰刀举向唯一向她伸以援手的女性伙伴。
当然这只是开头，这个故事就是在讲这位女性的觉醒，很推荐大家看叫恶女的告白。
这就让我想到了那些说生孩子轻松的女人。
真的轻松吗？
真的得到足够多的爱吗？
真的不后悔非常快乐吗？
如果是这样，你真正被爱着，至少你会敢于正视，你会面对真正受损的身体，会共情女性在生育中的困境，而不是把镰刀高高的举起来，对准了其他的女性。
这不正证明你的丈夫更不是个人，
因为连李那样的男人都是求之不得的，生活中完全遇不到的，简直像天方夜谭一样的，所以才会如此痛恨麦。
真情实感心疼的每个男人，都只能一次一次去证明当下选择的男人有多糟糕，是最错误的决定。所以只能一次又一次的去祭献自己，去攀比道德感，忍痛的能力，作为一个好女人有多么好吃吧！ 
最后我觉得大家看综艺真的不要太真情实感
关系永远是越打越挨，节目组剪辑编导那么多工作人员干嘛用的？就是为了调动你们的情绪，然后赚流量赚钱赚广告商。不要为了这种事情去透支自己的能量，让自己的生活不快乐。",,,,,2024-11-25T05:46:08,iPhone 16 Pro Max,1278,45,100,,,2024-11-25 05:46:08,True
5104457774006388	,P1RXXgOfa,"我现在不喜欢用悲惨的视角叙事。
也不喜欢去解释自己了（更像是一种自证），刻意在避开这一环节。
博主接收的负能量还是挺多的，每天奇奇怪怪的评论，还有跟你不合就开始骂你，质疑你。
那我以前还喜欢长篇大论的反驳回去，现在越来越少了，改成吃逍遥丸。
因为我发现，我的这种叙事其实跟他们没有差别。
我在向外界，像陌生的人们勒索情绪价值。
关注我大部分都是女孩子，女孩子从小就被教着理解别人，于是不管我发什么，都会有人共情我，安慰我。
消耗的是自己的能量，我可能会满足，但是对别人是没有什么帮助的。
或者没人理我，我的负能量加重，事情和情绪都没有得到解决，更痛苦了。
这也是一种向外索求的状态，
为什么不吃一把逍遥丸呢？
它明明就是疏肝的，专门对付生气，还很便宜。
所以我现在在尽量的避免自己干同样的事，
工作上，生活上都一样，学会用更正确的方式消化情绪，可能对我们的帮助更大，也会逐渐走向成熟。
我也从另外一个视角去理解自己：
这世界不存在百分百的正确，只要有立场存在，就一定有人讨厌，但那又怎么样，也一定有人喜欢
被讨厌的另一面是被喜欢。
要去这样想：对你讨厌的程度证明也有人对你喜欢到这种程度，情感的浓烈是一样的。
心情好很多",,,,,2024-11-25T04:43:52,iPhone 16 Pro Max,100,6,11,,,2024-11-25 04:43:52,True
5104453250187357	,P1RQF0MJT,突然睡醒了，怎会如此 ,,,,,2024-11-25T04:25:54,iPhone 16 Pro Max,33,7,0,,,2024-11-25 04:25:54,True
5104384910823604	,P1Q4r3sfW,"我现在觉得珍珠最好，珍珠比钻石看着好。
因为珍珠分量够大，价格相对便宜，同样的闪耀夺目。
我这种土老帽！！！最喜欢的就是珍珠和黄金！！！这种戴出去能让人一眼看见的！！！
钻石太小了，要买大的，又很贵很贵。
还是珍珠黄金最好。
还有珠宝彩宝。
嗯嗯。 ",,,,,2024-11-24T23:54:20,iPhone 16 Pro Max,158,37,2,,,2024-11-24 23:54:20,True
5104370674308699	,P1PHti4T9,"唉，每次心情不好就会吃这个，反正对我来讲是管用的，每次气的肝疼，心中郁结的不行就吃这个。
吃完之后就会心情好很多，
看什么都很顺眼，遇到那种气我的人，我也能轻松应对。
疏肝健脾，然后也有调经血的作用。
爱生气的女孩，其实可以在医生的指导下决定要不要吃一点 ",,https://wx1.sinaimg.cn/large/bd6dda61gy1hvxpxstw9vj22c0340x6p.jpg,https://video.weibo.com/media/play?livephoto=https%3A%2F%2Flivephoto.us.sinaimg.cn%2F002qrlJigx08jQxYcDAs0f0f0100kHOM0k01.mov,,2024-11-24T22:57:46,iPhone 16 Pro Max,74,15,4,,,2024-11-24 22:57:46,True
5104366219952256	,P1PAhFL2g,"遇到不愉快的事情，我现在都是让自己强行平静下来，不要宣泄情绪，不要生气，不要起冲突，也不要产生攻击性，解决问题就行。
实在不行退一万步，
你可以放弃一个客户，甚至一份工作。
但没有必要因为一个客户，一份工作，置自己于死地。
事情不会把你逼死，但人会，而那个人是自己。
外界所有产生的一切都只能是推你一把，最后选择跳崖的，是被外界压迫的无法忍受的自己。
在那之前，可以选择当个逃兵也没关系。
还是命比较重要，对吧",,,,,2024-11-24T22:40:03,iPhone 16 Pro Max,197,15,21,,,2024-11-24 22:40:03,True
5104359975945561	,P1PqdoWI9,"感觉半永久的一些纹绣是最“省时省力”的投资
去年我就在@千姿驻颜官方微博 做了纹唇，因为我原本的就是没有血色的嘴巴，非常非常的苍白，就会显得我的脸色特别蜡黄，毫无气色。
总之给人一种病怏怏的感觉。
但我本人又是很不爱化妆的类型。
毕竟我也没有什么社交场合，需要我去化妆。
但每天照镜子看到自己气色不好，也会想“怎么这样”
纹唇之后最大的改善就是素颜，气色也很好
病态感去除了！对我来讲就是方便，也不用涂口红
（虽然有点贵，但这笔投资对我来说是划算的，我觉得适合那种上班没时间化妆本身又有需求的女孩，
（如果自己钱不是很多，就不建议搞了！！买口红性价比会高很多，爱美也要参考实际经济状况来。
本身追求素颜也是有美感，不爱化妆，对自身要求比较高，也不差预算的姐妹可以冲，这个基本上可以维持一年左右，而且他们也是中途可以补色",,"https://wx1.sinaimg.cn/large/bd6dda61gy1hw0k4nmngsj20i30erdio.jpg,https://wx4.sinaimg.cn/large/bd6dda61gy1hw0k4o528tj20b4055dfv.jpg,https://wx2.sinaimg.cn/large/bd6dda61gy1hw0k4ofwcbj20fr0cd763.jpg,https://wx3.sinaimg.cn/large/bd6dda61gy1hw0k4pdatoj20kw0kwtbm.jpg,https://wx4.sinaimg.cn/large/bd6dda61gy1hw0k4q185nj20xw0kz78s.jpg,https://wx2.sinaimg.cn/large/bd6dda61gy1hw0k4qll9ej20u0140tet.jpg,https://wx4.sinaimg.cn/large/bd6dda61gy1hw0k4qw6vkj20i70o9juk.jpg,https://wx2.sinaimg.cn/large/bd6dda61gy1hw0k4rl21nj21qf12uk8h.jpg,https://wx4.sinaimg.cn/large/bd6dda61gy1hw0k4rzguuj20u0140q7p.jpg",https://video.weibo.com/media/play?livephoto=https%3A%2F%2Flivephoto.us.sinaimg.cn%2F004rA54Ngx08jUsFRD3V0f0f01001oAw0k01.mov;https://video.weibo.com/media/play?livephoto=https%3A%2F%2Flivephoto.us.sinaimg.cn%2F001UJNOMgx08jUsFWlSo0f0f01004uqw0k01.mov;https://video.weibo.com/media/play?livephoto=https%3A%2F%2Flivephoto.us.sinaimg.cn%2F002qk6WVgx08jUsG2ABp0f0f01004mMB0k01.mov;https://video.weibo.com/media/play?livephoto=https%3A%2F%2Flivephoto.us.sinaimg.cn%2F0015mEJsgx08jUsG5pjh0f0f01002AkX0k01.mov;https://video.weibo.com/media/play?livephoto=https%3A%2F%2Flivephoto.us.sinaimg.cn%2F004fWfukgx08jUsGnHmE0f0f0100dpOL0k01.mov,,2024-11-24T22:15:15,iPhone 16 Pro Max,0,4,0,,千姿驻颜官方微博,2024-11-24 22:15:15,True
5104352440092654	,P1Pe40o6q,"现在觉得钱就是用来花的，就是用来让我获取情绪价值，让我在最年轻的时候感到最澎湃的快乐。
今天买衣服，
试了一下，大概两分钟就决定买了。
虽然有点贵，但是我买下来的那一刻，无比的快乐。
我说有点贵哦，网上买应该更便宜。
朋友说：可是网上不会让你有这么大的情绪价值，你从穿上的那一刻就非常开心，是真的非常开心。
第一次体验到，逛街的快乐。",,,,,2024-11-24T21:45:18,iPhone 16 Pro Max,249,19,10,,,2024-11-24 21:45:18,True
5104337762386685	,P1OQoa0SV,"感觉年纪大了，电量不够了。
随便逛逛就腰疼腿疼，真是穷游富游不如少年游。
年轻时候咋那么有劲儿呢？ ",,,,,2024-11-24T20:46:59,iPhone 16 Pro Max,63,9,1,,,2024-11-24 20:46:59,True
5104320222334731	,P1Oo69NmX,"和社畜朋友出来吃饭，听到很多奇葩事情……上班是对消耗人气血的，没有之一
都不是消耗气血的，感觉人气都没有了。 ",,https://wx1.sinaimg.cn/large/bd6dda61gy1hvxk6gshwhj21400u0qjx.jpg,https://video.weibo.com/media/play?livephoto=https%3A%2F%2Flivephoto.us.sinaimg.cn%2F004DEULOgx08jQkczXxu0f0f01003I4E0k01.mov,,2024-11-24T19:37:17,iPhone 16 Pro Max,358,42,6,,,2024-11-24 19:37:17,True
5104297047758233	,P1NMIwygN,"只要出门就会疯狂买衣服，受不了了。
这件真的太好看了吧，我的！！！！！穿上一秒钟决定买下。 
这个是百分百羊驼毛的，我还没买过羊驼的东西。 ",,"https://wx2.sinaimg.cn/large/bd6dda61gy1hvxhidkc96j20u01407bt.jpg,https://wx1.sinaimg.cn/large/bd6dda61gy1hvyaa3qmz5j22c0340npe.jpg,https://wx4.sinaimg.cn/large/bd6dda61gy1hvxhifdhvwj20u11az7ii.jpg",https://video.weibo.com/media/play?livephoto=https%3A%2F%2Flivephoto.us.sinaimg.cn%2F000cwtsOgx08jQdSjtzW0f0f01002J5c0k01.mov;https://video.weibo.com/media/play?livephoto=https%3A%2F%2Flivephoto.us.sinaimg.cn%2F002aUuG6gx08jRkc2mkE0f0f0100dSJb0k01.mov;https://video.weibo.com/media/play?livephoto=https%3A%2F%2Flivephoto.us.sinaimg.cn%2F000PaCGxgx08jQdSw2U70f0f01002skn0k01.mov,,2024-11-24T18:05:12,iPhone 16 Pro Max,255,67,2,,,2024-11-24 18:05:12,True
5104280514330707	,P1Nm3iaC7,救命🆘🆘🆘🆘🆘,,,,,2024-11-24T16:59:29,iPhone 16 Pro Max,244,47,24,,,2024-11-24 16:59:29,False,5690794000,蒜蒜收藏夹,5104277774928449	,P1NhDkG77,好崩溃 #李行亮梦女# ,,"https://wx4.sinaimg.cn/large/006d7Zu0gy1hvxf8n0ky2j30zu1td7lh.jpg,https://wx2.sinaimg.cn/large/006d7Zu0gy1hvxf8ksmaxj30zu1bd11l.jpg,https://wx4.sinaimg.cn/large/006d7Zu0gy1hvxfahfuudj30zu10y40g.jpg,https://wx1.sinaimg.cn/large/006d7Zu0gy1hvxfagyoaxj30zu0zqdjh.jpg,https://wx1.sinaimg.cn/large/006d7Zu0gy1hvxfbfhn19j30zu0jg0v0.jpg",,,2024-11-24T16:48:37,,8371,406,319,李行亮梦女,,2024-11-24 16:48:37
5104278019247431	,P1Ni1CNG7,"#医美反馈##超光子反馈# 
超光子+杜莎之谜小黑瓶反馈：立刻就亮了一个度，凹整个皮肤变白还是挺明显。
大家可以选择风生水起卡里面包含了超光子，也包含了水光，同时还送能量卡！！！还有额外两瓶胶原修复霜，这样子你一条龙全部做好。
目前还在有团： 
网页链接
 
其他的反馈：
超光子反馈：
网页链接
黄金超微针+超光子反馈：
网页链接
 
超光子
网页链接
网页链接
网页链接
网页链接
超光子+杜莎之谜
网页链接
刷酸+杜莎之谜+超光子
网页链接
npy直白超声炮效果反馈。
网页链接
我的超声炮效果反馈。 
 
网页链接",,"https://wx1.sinaimg.cn/large/bd6dda61gy1hvxfboim50j20oe32k7c3.jpg,https://wx3.sinaimg.cn/large/bd6dda61gy1hvxfbozldaj21ha0nojv1.jpg",,,2024-11-24T16:49:35,iPhone 16 Pro Max,7,1,0,"医美反馈,超光子反馈",,2024-11-24 16:49:35,True
5104249094802491	,P1Mxnk9lx,"网上买衣服可以自行多买一点，因为你退货率还是很高很高的。
我最近买衣服发现
你不上身是完全没办法看到效果
图片好看，甚至拿到手上好看
和在你身上好看是完全两码事！！！ ",,,,,2024-11-24T14:54:39,iPhone 16 Pro Max,190,29,2,,,2024-11-24 14:54:39,True
5104239980053319	,P1MiG0dRZ,"该说不说，
无论是微博还是小红书的评论，是我能明显感受到最近大家的神经紧绷，就是明显的火药味越来越重。
也不是在跟我对话，而是把我当成一种投射，开始说自己想要发泄的东西。
我作为旁观者看到的是，社会的压力在进一步的增大，未来大众戾气只会越来越重，可能恶性事件会越来越多，因为语言也是一种武器，当使用这种武器的人越来越多，就证明社会的负能量其实是在与日俱增。
到达一个顶点的时候就会有一些疯子出来，
我现在比较怂啦，也不想跟人吵架，在外面也一样，安全第一，没必要。
每个人都要注意安全哪，感觉以前是吵了架就算了，气鼓鼓的回家，现在你在外面跟人家随便两句口角，真的会铜丝你（跟失业率就业率经济环境极为相关，也是有社会研究的，当一个人一无所有的时候他就处于一种无敌的状态，当越多越多的人处于这种状态下，社会治安就很难保证。",,,,,2024-11-24T14:18:26,iPhone 16 Pro Max,169,15,10,,,2024-11-24 14:18:26,True
5104237589562447	,P1MeOE7D1,//@花泽美美://@快递员吴彦祖://@浪里赤条小粗林:互联网的很多人都在展示最好的那一面。仿佛遍地有钱人，遍地高学历，男的帅女的美一个个身材比例都是超模。但其实都是消费主义制造的虚假制造的焦虑罢了。更多的人都只是普通人，大家工资普通、长相普通，可普通没什么不好。踏踏实实过好自己的平凡生活就好。,,,,,2024-11-24T14:08:55,iPhone 16 Pro Max,83,1,44,,"花泽美美,快递员吴彦祖,浪里赤条小粗林",2024-11-24 14:08:55,False,3263734730,顾良逢,4542261247084736	,JhJpitJ3W,"微博上何不食肉糜的高等人太多了，用数据看看真实的世界是什么样子吧。
这个网站叫dollar street，拍摄全世界不同收入家庭的照片，以月收入为轴，列成了一条横向的街道。你可以拉动标尺，选择看不同收入家庭的生活。
月收入500-700刀（按购买力而非汇率折 2000-3000rmb 算法较复杂 可理解为每个成年人的可消费额，除收入外，自有住房、自种自吃粮食等都会被计入，具体见评论）已经是这个世界的中位数。他们生活又怎样呢？
p2&3的中国家庭，可以看到房屋谈不上装修，家庭基本生活设施齐全，但显然不富裕。唯一出现的贵重电器是一台笔记本电脑
p4&5的印度家庭有份专业性的工作，房屋稍现代化一些。但一家四口人也就挤在两居室，甚至都不能保证稳定自来水。
p6,7的美国更糟，全家住在救济的一居室，最大的心愿是买个电话。
可以看到并不是国别，而是收入导致了生活的差距。收入在中位数的家庭，不分国家，都至少有干净的床铺和厕所、水电气、基本的饮食，但也都居住空间不足、也没有什么享受型消费。
把收入拉到高于80%家庭，才终于像微博所谓的“普通生活”“勉强中产”了。p8&9是个西班牙的医生家庭，四居室有车有院子，相当体面了——但是按照某红书标准依然不合格，因为这家人也还在用不统一的床品、混杂的餐具。
当我把轴拉到这世界top1%，才符合某些人描述的生活：精致的装修、健康的饮食、香水、珠宝和衣帽间。
消费主义下的生活方式博主永远在拍这1%。大家都很焦虑，忘了99%才是常态。
有空去看看这个网站吧，还可以单独查看不同家庭的玩具、装修、床铺、牙齿甚至厕所。
干净的坐便这世界上60%的人没享受过。",,"https://wx2.sinaimg.cn/large/c288a3cagy1gi4g547djbj20u01t04qp.jpg,https://wx2.sinaimg.cn/large/c288a3cagy1gi4g54v704j20u01t0e0w.jpg,https://wx2.sinaimg.cn/large/c288a3cagy1gi4g798mj1j20qk1bsqan.jpg,https://wx3.sinaimg.cn/large/c288a3cagy1gi4g56nkiyj20u01t0h98.jpg,https://wx2.sinaimg.cn/large/c288a3cagy1gi4g57komqj20u01t07wh.jpg,https://wx2.sinaimg.cn/large/c288a3cagy1gi4g587hnij20u01t0h3c.jpg,https://wx4.sinaimg.cn/large/c288a3cagy1gi4g592m8tj20u01t01kx.jpg,https://wx4.sinaimg.cn/large/c288a3cagy1gi4g59ms6rj20u01t0wz7.jpg,https://wx1.sinaimg.cn/large/c288a3cagy1gi4g5aftnij20u01t07wh.jpg,https://wx4.sinaimg.cn/large/c288a3cagy1gi4g5bwyo9j20u01t07wh.jpg,https://wx1.sinaimg.cn/large/c288a3cagy1gi4g5cycsoj20u01t04qp.jpg",,,2020-08-26T19:55:35,荣耀20 PRO,105173,4216,42855,,,2020-08-26 19:55:35
5104217421512792	,P1LIi6lxS,"女孩子对自己好一点啊，我觉得最廉价的方式就是人人都可以做到的，早睡早起，多吃养生的东西。
我看到我朋友在煮苹果黄芪水，也是补气血的。
我是很爱吃酒酿煮蛋。
这些东西几乎不花什么钱，但是可以让我们身体变得棒棒哒。
有时候卖一些保健品可能会有宝宝觉得太贵，买起来有压力，那就在日常饮食上多关注自己。
这些真的不需要花多少钱，每天几块钱？
还有就是少生气，不内耗，可能有的人性格就是高敏感，这种肯定不是说一两句话就能改掉的，是需要长期的脱敏训练，但你只要有意识的知道自己存在这个问题，并且有意的去避开，早晚有一天可以成功。
总之爱自己不是买个包，买个口红，关注自己的情绪，身体的健康，内心的平和，几乎都不需要花钱就可以满足的！",,,,,2024-11-24T12:48:47,iPhone 16 Pro Max,783,83,86,,,2024-11-24 12:48:47,True
5104210692277049	,P1Lxr9ymB,"我做的酒酿煮蛋。
因为一包酒酿它没有很多的米酒，我就是酒酿加米酒加蛋，热乎乎的喝两口，真的都不用喝完你就喝两口，就会感觉整个人都热了。
气血翻涌的感觉！！！！好爽啊！！！！都要冒汗了。 
酒酿鸡蛋几乎是最低成本就能让女孩子变漂亮的东西，因为非常的补气血，而且它真的便宜，这一碗加起来的成本也就三四块钱吧！可以当早餐吃，但是别当零嘴吃太容易胖了。",,"https://wx1.sinaimg.cn/large/bd6dda61gy1hvx7ljja1kj22c0340u0y.jpg,https://wx2.sinaimg.cn/large/bd6dda61gy1hvx7llmnl2j22c0340000.jpg",https://video.weibo.com/media/play?livephoto=https%3A%2F%2Flivephoto.us.sinaimg.cn%2F001eWYTWgx08jPQjaKur0f0f0100dev40k01.mov;https://video.weibo.com/media/play?livephoto=https%3A%2F%2Flivephoto.us.sinaimg.cn%2F002BLnELgx08jPQjpBR50f0f0100em0F0k01.mov,,2024-11-24T12:22:03,iPhone 16 Pro Max,148,31,16,,,2024-11-24 12:22:03,True
5104206857374795	,P1LrfuWwj,葛姐被骂的最少，因为她是社会热衷于看到的好女人，几乎挑不出什么毛病，她牺牲奉献从劳动到金钱全方位被吸血祭天还高智高共情简直比护理工干的还好。麦琳是疯女人，且不说是怎么被逼疯的，从结论来看至少还能打个你死我活，这是不被社会所乐于看到的，不是好女人。,,,,,2024-11-24T12:06:49,iPhone 16 Pro Max,430,35,39,,,2024-11-24 12:06:49,False,1869129414,VivienneBWA,5104205542983807	,P1Lp8cwdV,"葛夕为什么会被吸血，被欺负。
很简单啊，她之前说：她不指望别人对她好了，她只希望别人不要对她不好。
她等于把自己送上了弱者的位置，自己不爱自己了。
其实别人对她好不好根本不重要，重要的是她自己要对自己好。
但她却一直委屈自己。
我昨天看到一个说法，就是一个妈妈说她情愿她女儿像麦琳，也不希望自己女儿像葛夕。
麦琳至少发疯到所有人迁就她，不正常，却也没吃亏。
但葛夕一直奉献，一直付出，一直内耗，嫁妆钱都给男人赔光了。
当妈的看到自己女儿这样真的会气死，真的会“恨铁不成钢”。",,,,,2024-11-24T12:01:36,iPhone 14 Pro,345,9,57,,,2024-11-24 12:01:36
5104198018662916	,P1LcZAlCs,"你们也可以买个便宜的，因为我发现我也没有用他的电动……我就直接倒进去，然后直接刮头皮。
我买了一个上药去涂米诺，比较均匀方便。
现在头发多多，每天坚持涂米诺 
网页链接
 ",,"https://wx1.sinaimg.cn/large/bd6dda61gy1hvx63zhfgjj22c03404qq.jpg,https://wx4.sinaimg.cn/large/bd6dda61gy1hvx641tim3j22c0340e82.jpg,https://wx3.sinaimg.cn/large/bd6dda61gy1hvx64826m8j210o0vzdkm.jpg,https://wx3.sinaimg.cn/large/bd6dda61gy1hvx654a9q9j22c03404qq.jpg",https://video.weibo.com/media/play?livephoto=https%3A%2F%2Flivephoto.us.sinaimg.cn%2F0036NRbPgx08jPMQ6K9q0f0f0100pSk40k01.mov;https://video.weibo.com/media/play?livephoto=https%3A%2F%2Flivephoto.us.sinaimg.cn%2F0046cye0gx08jPMQutor0f0f0100nR1c0k01.mov;https://video.weibo.com/media/play?livephoto=https%3A%2F%2Flivephoto.us.sinaimg.cn%2F004flsdJgx08jPMR0Eco0f0f0100nN3z0k01.mov,,2024-11-24T11:31:41,iPhone 16 Pro Max,26,4,3,,,2024-11-24 11:31:41,True
5104195747449066	,P1L9kvfQe,"两个人在一起，如果只有互相讲别人坏话，其他无事可做，抱团攻击，这段关系也没什么价值，至少讨论点有用的东西，可以让自己有所成长收获的。
我有个朋友也是博主，但是她发表的观点很温和，看不出什么激进的痕迹。
但如果线下跟她聊天，就会发现她是个非常有想法很深刻的人，她不愿意说的原因是不想惹麻烦，她觉得支教很痛苦，会和人交换负能量，而跟她每一次交流我都会觉得特别有收获，也一遍一遍验证了一个事儿：要多读书，至少要多学习。
要么走出去去看世界，去经历，让事实告诉你。
要么多读书去学习别人的智慧，让历史告诉你。
人要进步就不能沉迷于消耗自己的事。",,,,,2024-11-24T11:22:40,iPhone 16 Pro Max,340,7,33,,,2024-11-24 11:22:40,True
5104184915658086	,P1KRRnJVs,看小说是这个世界上最没有成本的，最廉价，最公平，几乎人人都能享受到的的精神补给 ,,,,,2024-11-24T10:39:38,iPhone 16 Pro Max,11442,189,706,,,2024-11-24 10:39:38,True
5104177849829517	,P1KGsFf6B,"中国人自己的“爆浆芝士”
青稞小米饼，属于粗粮类型的无蔗糖还挺好吃的，因为小米本身就有甜味。 ",,"https://wx2.sinaimg.cn/large/bd6dda61gy1hvx3to6pftj210o1097bf.jpg,https://wx1.sinaimg.cn/large/bd6dda61gy1hvx3tr32zgj22c0340u0x.jpg,https://wx3.sinaimg.cn/large/bd6dda61gy1hvx3tuebyaj21yd2ftqv5.jpg",https://video.weibo.com/media/play?livephoto=https%3A%2F%2Flivephoto.us.sinaimg.cn%2F001HL2TSgx08jPHlLQyI0f0f0100fNdV0k01.mov,,2024-11-24T10:11:33,iPhone 16 Pro Max,86,23,3,,,2024-11-24 10:11:33,True
5104159356880116	,P1KcDsRPC,"真正的女性市场！真正给我们看的东西//@今天也很幸福的梦:女人是
//@黄腿肠://@你别说还真是这样:真的好看的😭//@脆皮鸭颜究員:特别好！//@牛肉酱西施:我们该看的🤲🏻//@小别出心菜:好！//@费加罗夫人:好//@雪霏Sophia:
//@江南大野花:真好//@酒千千千:女性市场就是优秀",,,,,2024-11-24T08:58:03,iPhone 16 Pro Max,263,8,69,,"今天也很幸福的梦,黄腿肠,你别说还真是这样,脆皮鸭颜究員,牛肉酱西施,小别出心菜,费加罗夫人,雪霏Sophia,江南大野花,酒千千千",2024-11-24 08:58:03,False,6470207172,kaosamatt,5102583003745017	,P15c8fIfv,当我们把影视市场交给女性，你会得到这样的作品👇 ,,"https://wx1.sinaimg.cn/large/0073Skscly1hvs0muun6bj30wi0x1jy6.jpg,https://wx4.sinaimg.cn/large/0073Skscly1hvs0mv8btyj30wi0zkai2.jpg,https://wx4.sinaimg.cn/large/0073Skscly1hvs0mw9t30j30wi0xwjzf.jpg",,,2024-11-20T00:34:12,iPhone 14,34337,99,7337,,,2024-11-20 00:34:12
