id,bid,正文,头条文章url,原始图片url,视频url,位置,日期,工具,点赞数,评论数,转发数,话题,@用户,完整日期,是否原创,源用户id,源用户昵称,源微博id,源微博bid,源微博正文,源微博头条文章url,源微博原始图片url,源微博视频url,源微博位置,源微博日期,源微博工具,源微博点赞数,源微博评论数,源微博转发数,源微博话题,源微博@用户,源微博完整日期
5106040128932870	,P2x88BtQy,"#管晨辰 吴柳芳#那种很菜经验很少，但是看了太多偶像剧连续剧宫斗剧，学了一些很纸上谈兵的东西，自以为自己很懂恋爱的那种，又蠢又自以为是的女生，有点像图一这种女版胖猫，
这种你没法聊，你纠正他就等于打破他的自恋，跟这种人在一起，你只能过愚蠢的日子，你想过正常的聪明的日子，就只能跟他起冲突，你需要耗费大量的生命力去帮他提升认知，说难听点就是像打游戏那种又蠢又菜又难带的队友，但是他自以为自己没问题，他以为自己比你强，他以为菜的是你
就感觉她在恋爱这方面一定是又蠢又固执的。
本身没怎么谈过恋爱，但是又看了过多的偶像剧言情剧。从小到大这么多的爱情剧灌输下来，她的爱情观已经固化了。
就好像不按照那一套模板谈恋爱，就是你不会谈似的。
自以为自己情商很高，其实全都是傻逼，因为她们以为的情商就是那种按照宫斗剧那种勾心斗角，拐弯抹角，阴阳怪气，话中有话来讲话，就是高情商，但真实的情商其实不是这样的。（图二，管晨辰和吴柳芳的对话，两个人都像傻逼，一看就是没咋谈过恋爱，宫斗剧看多了，情商低的一塌糊涂，但是这两个傻子都会以为自己情商很高。
吴柳芳最好的应对方式就是沉默，不管谁诋毁都不要理他，安心赚钱就完事了。
每次都要跟评论区怼，这就是情商很低的方式，
只要开了口就是低情商，不是说你说话的艺术有多么好才是高情商，而是沉默，才是真正的高情商）
就好像体制内工作者没见过世面，也没赚过什么钱，没有真正经历过市场竞争，他们都是想当然的。他们根本就不懂做生意。
如果你合伙跟这种人做生意是带着他是很累的，因为他们还有点自以为是，就是又固执又蠢，这种是最难带的。
跟这种女生谈恋爱也是一样的，真的特别难带。比一张白纸都难带。因为她脑子里被宫斗剧灌了太多的屎。
如果说跟普通正常的女生谈恋爱，就像做一道红烧肉。就五花肉买过来烧一烧就可以得到一份美味了。
而这一类女生。就像做一道爆炒大肠。你买的大肠还必须得把它里面的屎清干净才能做菜。比红烧肉更麻烦的多。还不一定有红烧肉好吃。
（但更多的可能是这个女生本身脑子里屎很多，但她的魅力并没有大肠那么美味，也不是特别漂亮，如果真的漂亮的话，也不至于没谈过恋爱，她值不值得你花时间去清理她脑子里的💩还真说不准，如果很漂亮，那么脑子里有屎也值得，如果普通的话，脑子里有屎就算了）",,"https://wx3.sinaimg.cn/large/64aa9bebgy1hw31p6gcboj20u00wpqb9.jpg,https://wx3.sinaimg.cn/large/64aa9bebgy1hw31p70eh3j20wi1lsk0o.jpg",,,2024-11-29T13:31:35,,7,2,1,管晨辰 吴柳芳,,2024-11-29 13:31:35,True
5104226300596390	,P1LWC2v9c,"图一。有人看到这个就想到了上海。评论说这是上海萨普模仿不了的松弛感，可见上海萨普们表现糟糕，已经拉胯的，连普通小黄人都懵不了。
这个主唱他所有的手臂摆动，也是上篇说的角动量守恒。
他整个人是按照固定的节奏，也就是固定频率蹦的，然后手是发泄这个频率所产生的角动量还是什么力的，所以手部动作怎么做都是很随机的。主要起的是一个平衡发泄的作用。
这里的手就像在风中拿着一条丝巾一样的，怎么动都是未知的，都是随机的，都是根据风的力来的。
如果要刻意排好动作，就跟做题一样的，都事先练好，那就会失去这种灵性。（这也是为啥做题家没有灵性）
上海萨普之所以没有松弛感是因为他们所有的动作都是排过的，都不是自然的，都不符合自然规律。
所以就显得又假又丑。
（这一点跟做题家是一样的，但实际上他们除了做题，其他屁都没玩明白，所以就显得很low，Low的原因主要是太菜太低能了还非要装，并不是因为纯粹装逼）
除了节奏感，还有和生命力有关
这些欢乐的少数民族。有点像鲜活的小鱼小虾，活蹦乱跳的。
这种鲜活的食材，随便怎么烹饪都是好吃的。
而上海那个萨普就好像在公司被榨干了的甘蔗渣似的。非常的索然无味，不是裹上了同样的调味料就有同样的味道的，精华（生命力）已经流失了，无论怎么处理都不美味了。
又要搞这些花里胡哨的东西。
就好像麻辣糖醋红烧甘蔗渣一样，能好吃吗？
当然也不能完全怪大公司，以他们的基因，即使没有工作，也会像躺平日结大神一样。因为过度自我内耗或者自我焦虑啥的，而持续流失生命力，没办法，低端基因就是这样的。
给大公司压榨，虽然说也会失去灵性，失去生命力，但至少有钱拿呀，总比当三和大神好一点吧。 （而且低等基因本来就没啥灵性，并且本身会自我内耗，啥都不干，都会持续流失生命力，所以上班根本没有啥副作用。倒是高等人上这种班真的副作用很大）",,"https://wx2.sinaimg.cn/large/64aa9bebgy1hvx99xcwrij20u01uojzw.jpg,https://wx2.sinaimg.cn/large/64aa9bebgy1hvx99xv75gj20u01uotkd.jpg",,,2024-11-24T13:24:05,,10,2,2,,,2024-11-24 13:24:05,True
5103140975936568	,P1jI5oUn6,"小黄人苦大仇深，可能跟没有节奏感有关。
没有节奏感，新手期不太可能在舞蹈中获得快乐。
只能从苦熬到身体特别牛了以后才能获得快乐，但是这种快乐并不是音乐上得来的，而是身体的自由，对于舞蹈的得心应手得来的。
也就是说即使练到很高的境界了，能从跳舞中体会到快乐的，但其实是跟音乐无关的，就像练武术练到一定境界，你打一套武术表演套路，也能获得快乐。但这并不是舞蹈的快乐。本质上跟武术体操，打个太极啥的是一回事。
像这个视频就一群傻逼在瞎跳。（类似上海萨普）
没有一个人是真的快乐的，每个人都在强颜欢笑假装开心，但实际上一门心思在抓拍子又抓不住。
局促尴尬的很。
而且拍子抓不住，主要原因是这种舞蹈和这首歌根本就不匹配。
这音乐是原版的，但我感觉他们也是没有节奏瞎跳的，舞蹈跟音乐配不上的。小黄人不懂这些，乱配音乐，傻子一样，还自以为有品位一样。",,,,,2024-11-21T13:31:23,,11,2,2,,,2024-11-21 13:31:23,True
