id,bid,正文,头条文章url,原始图片url,视频url,位置,日期,工具,点赞数,评论数,转发数,话题,@用户,完整日期,是否原创,源用户id,源用户昵称,源微博id,源微博bid,源微博正文,源微博头条文章url,源微博原始图片url,源微博视频url,源微博位置,源微博日期,源微博工具,源微博点赞数,源微博评论数,源微博转发数,源微博话题,源微博@用户,源微博完整日期
5103196828339301	,P1laayZqR,我经常看见有很多人说，一些人分手以后要把钱追回去了，就这种人你都用不着上手整他，他自己都没本事把自己日子过得好，多大点儿钱啊？自己没有享受到吗？就这点儿气度，你以为他能在别的板块混多好？尤其是那些分手以后喊对方还钱闹的轰轰烈烈的，你看他那个鸟样，他混得好吗，现在不也混的不咋滴吗？但凡干这种事有一个算一个这辈子都是小人，又不是隔着网线把你诈骗了，两个人一对一认真谈恋爱分手还能追回款，又不是对不起你，真当白嫖来了，就这气度还用得着别人整他？他这辈子都没出息,,,,,2024-11-21T17:13:19,iPhone 13 Pro Max,135,5,6,,,2024-11-21 17:13:19,True
5103193556255178	,P1l4TqffY,"跟人出去吃饭，情侣也好朋友也好，尽量不要A，你是大人了，经济独立了，你又不是小孩子，你没有钱可以直接拒绝，但不要A，因为眼前这个人很有可能不知道你的经济水平是什么样的，你也不知道他的，如果你和他A，他立马就能知道你的经济情况，或者他会对你有别的误判，他默认你不想和他深交，这种情况下，对方必然不会问你。要么对方觉得，你没钱，很简单很直白，你没有钱，不会再喊你玩，你不要以为他会开口问你，这不是学生时代。
不跟人A钱是筛选对方经济情况的，更是筛选对方情商的，请客本来就是一套不成文的规矩，你来我往，礼尚往来，你A钱，谁知道你怎么想？有一个心里没有B数在当中白吃白拿朋友的都被人筛选出去了，谁要和你A啊？没有人会在明面上告诉你他的规矩，机灵点吧。",,,,,2024-11-21T17:00:19,iPhone 13 Pro Max,300,16,11,,,2024-11-21 17:00:19,True
5103190327165401	,P1kZGu42Z,人类及格线是经济独立，原始时代会打猎的人就可以自立门户，现在也一样。 ,,,,,2024-11-21T16:47:29,iPhone 13 Pro Max,88,1,5,,,2024-11-21 16:47:29,True
5103165617475115	,P1klPvmCn,喜欢开一点黑色玩笑.. ,,https://wx3.sinaimg.cn/large/6dbf0316ly1hvtvl49xx7j20th0k3tar.jpg,,,2024-11-21T15:09:18,iPhone 13 Pro Max,88,21,1,,,2024-11-21 15:09:18,True
5103163271283237	,P1ki35nPn,"哇。。我发现了一个事情，不知道是不是我的错觉，同一家店铺的咖啡你一直喝就不通便了，我昨天前天换成了早餐店黑咖啡喝（之前点的星巴克）。
畅快上厕所。。。🚽这咖啡豆太真实了 ",,,,,2024-11-21T14:59:59,iPhone 13 Pro Max,49,6,0,,,2024-11-21 14:59:59,True
5103162771902887	,P1khf7Z1J,有没有什么宽胯裤推荐啊？单条售卖那种，不是和裤子缝一起的，求推荐 ,,,,,2024-11-21T14:58:00,iPhone 13 Pro Max,9,2,0,,,2024-11-21 14:58:00,True
5103151352909062	,P1jYPccMm,原来在日本捡到东西以后，失主要给拾得者分钱诶，头回知道，国内有这个规定吗 ,,,,,2024-11-21T14:12:37,iPhone 13 Pro Max,192,15,0,,,2024-11-21 14:12:37,True
5103143106641958	,P1jLwrRSm,"我觉得成年工作者开启恋爱就是很难啊，如果对方工作繁忙，是没有时间陪你聊天的，你给对方发消息会变成一种骚扰，你发太多，对方真的会烦，我算是自由职业，我都很讨厌有不喜欢的人给我发消息闲聊，因为我觉得对方在占用我的私人时间，被我不喜欢的人喜欢对我来说是一种压力。
所以很多时候我就只是欣赏与观望，我什么都不会做，我也什么都不想做，我对他们的好感就是保持欣赏，展开追求是需要很大的激情的，可我没太多时间去追求谁，也没有那么多的激情了，更没耐心等谁回消息，成年工作者的时间，实在是太宝贵了，我自己都不够用，怎么有功夫给你用呢。",,,,,2024-11-21T13:39:50,iPhone 13 Pro Max,448,11,28,,,2024-11-21 13:39:50,True
5103139935490969	,P1jGpn2s1,"我的梦中情房 
心狠手辣小小耳的微博视频
 ",,,"https://f.video.weibocdn.com/o0/MMXQBgpflx08jL87gE3C01041200A76K0E010.mp4?label=mp4_720p&template=720x1556.24.0&ori=0&ps=1CwnkDw1GXwCQx&Expires=1732805677&ssig=MtfCZ9kM%2FS&KID=unistore,video",,2024-11-21T13:27:15,微博视频号,50,9,0,,,2024-11-21 13:27:15,True
5103134957110676	,P1jyntPOk,你发现一个人在嫉妒你，你就永远别和他玩，嫉妒算是人的恶劣品性，改不掉的。 ,,,,,2024-11-21T13:07:28,iPhone 13 Pro Max,1191,21,86,,,2024-11-21 13:07:28,True
5103119000410296	,P1j8E1IJG,"我觉得我们老中人的文化特色就是，你和他讨论一件事，你不告诉他具体的分类，他就不知道你在说什么，不是，你的悟性就有那么差吗？比如说我告诉他你去洗个碗，结果真的只洗了碗，把筷子给留下了，筷子就不洗了。
你就真的有那么不机灵吗？你的悟性真的有那么差？这个居然还不是个例，居然还有点普遍，包括同居家务分配这件事，不是，这个屋子大家不是一起住的吗？还要分配？你这么没有眼力见吗？上厕所是不是屎还要等着分配冲？我就搞不懂有什么好分配的",,,,,2024-11-21T12:04:04,iPhone 13 Pro Max,97,8,2,,,2024-11-21 12:04:04,True
5103118039647591	,P1j75EtMj,"我其实一直不理解家务，家务居然需要分配？家务不就是扫地拖地洗碗，擦擦桌子擦擦卫生间。
就这玩意你还要和他分配着做，我觉得这日子也别过了，同住一个屋檐下互相打扫那不应该吗，这点小事，还要分配。。。买一把两块钱的青菜是不是要AA ",,,,,2024-11-21T12:00:15,iPhone 13 Pro Max,142,13,0,,,2024-11-21 12:00:15,True
5103117059756149	,P1j5vEW1f,板面好吃吗？ ,,,,,2024-11-21T11:56:21,iPhone 13 Pro Max,23,23,0,,,2024-11-21 11:56:21,True
5103115081091751	,P1j2k4A0T,"女人普遍喜欢高看男人，男人习惯性矮看女人，而底层男人高看中层男人并且把他当作神一样跟随更是大有人在，他甚至判断不出来这个男人是“中”，他以为是“上”，其实不是，大众刻板印象，这个没有办法。 这里的“普遍”和“习惯性”是划分。
然后女人到达及格线就容易让男人高看，其实这个女人也没有好厉害，只是到了及格线，这个时候男人也会高看误判她。",,,,,2024-11-21T11:48:29,iPhone 13 Pro Max,51,2,3,,,2024-11-21 11:48:29,True
5103108545580502	,P1iRMnpK6,"本来就是呀，女人卫生巾做的垃圾不就是因为做的有多垃圾都会有女人买吗？因为这是必需品，每个月必须都要用都要消费的，一个月几十块钱怎么着都要花出去，所以就很多破烂制造呀，男士卫生巾说实话，在这个词条出现之前你想过男人用卫生巾吗？你甚至不知道这个品类，品类没名声甚至没人用的时候，质量好就是唯一的噱头了，毕竟男士卫生巾没有几个男士消费，但凡男士用了都是因为生理上比较需要，生了病会漏尿才用这个，是尿失禁产品。
那能一样吗？一个是随便做的垃圾都有女人消费的产品，一个是男人尿失禁生病了才买的相当于医用类的产品，与其说这是男女的关系不如说这是老中的众多不正经三流商人为了赚钱脸皮巨厚无比，什么都敢卖。
每次看见这种新闻我都在想，怪不得古代重农抑商，商人和正经生意人还有手艺人，永远都不是一个概念。",,,,,2024-11-21T11:22:31,iPhone 13 Pro Max,211,3,9,,,2024-11-21 11:22:31,True
5103105135351247	,P1iMhms6r,"这个东西品类买的人少，就做的好，因为这个时候还没有外行进去浑水摸鱼，但买的人越多，做的越烂。
嗯，很多人卖东西就仗着那堆破烂有人消费所以越做越烂，男装做得好完全就是因为男人几乎不买衣服，你看着吧，男装卖的多了，也会越做越垃圾，人多的地方，垃圾就多，人真的是行走的垃圾制造物，数量多了质量就下去咯～",,,,,2024-11-21T11:08:58,iPhone 13 Pro Max,53,5,2,,,2024-11-21 11:08:58,True
5103088551854618	,P1ilx7Mtc,"童年时期，没有双亲陪伴，或者极度缺乏双亲陪伴的小孩，不会是付出型人格（可能人生有一段时间是这个，但年纪大了不会）。
如果出门在外混得久了更不可能是一个没脑子的付出型人格，他会不断地向外索取，他们的“童年很悲惨”这个事实可以是他们的一种看似“我很脆弱”的假皮套，其实一点儿也不脆弱。
因为最脆弱的童年时期已经过去了，我们不能再拿他童年时期的心理判断现在的他，如果他后来有所成就，那么他大概率极算计，不然不可能有今天，因为他人格缺失，没有双亲的爱扶持着长大，不会太付出型，爱算计也不一定是贬义，反正不是那种可以给他人很多感情的人。
骂我你也不对，你懂个求",,,,,2024-11-21T10:03:04,iPhone 13 Pro Max,355,21,33,,,2024-11-21 10:03:04,True
5103086064631880	,P1ihwjqXK,两个人谈恋爱，其中一方，各方面在走低，甚至精神上萎靡不振，从打扮的光彩照人到看起来疯疯癫癫，那就是另外看似“没问题”那一方的问题，这个人绝对是有毛病但是心机很重的，但是它明面上不表现出来。你也知道这个人之前不是这样的，是谈恋爱以后才变成这样的。 ,,,,,2024-11-21T09:53:10,iPhone 13 Pro Max,467,16,18,,,2024-11-21 09:53:10,True
5103084992727722	,P1ifNbrBw,越脆弱的人越需要处处理解和支持 ,,,,,2024-11-21T09:48:56,iPhone 13 Pro Max,149,8,1,,,2024-11-21 09:48:56,True
5103081023342038	,P1i9oe1pQ,清晨的小美女 ,,https://wx2.sinaimg.cn/large/6dbf0316ly1hvtlvdi6ofj22c0340u0x.jpg,,,2024-11-21T09:33:09,iPhone 13 Pro Max,134,16,0,,,2024-11-21 09:33:09,True
5102950466192847	,P1eKOpZ2D,"我以前还会和粉丝吵架呢，那个粉丝id我现在都记得，但是人家很大度没有跟我计较，脾气特别好。刚刚看了一下这个粉丝主页，对方也过得好辛苦，这个点了才下班，顿时觉得我真的是个罪人。。。。
为什么要伤害喜欢自己的人
 ",,,,,2024-11-21T00:54:22,iPhone 13 Pro Max,93,9,0,,,2024-11-21 00:54:22,True
5102936235707361	,P1enRnWKd,我觉得我确实是年纪越来越大了母爱越泛滥，我现在都见不得那种架一口锅煮些乱七八糟汤水吃的小娃娃，太可怜，肯定是我年纪上去了母爱泛滥，让我不忍心看这种视频。 ,,,,,2024-11-20T23:57:49,iPhone 13 Pro Max,56,6,1,,,2024-11-20 23:57:49,True
