id,bid,正文,头条文章url,原始图片url,视频url,位置,日期,工具,点赞数,评论数,转发数,话题,@用户,完整日期,是否原创,源用户id,源用户昵称,源微博id,源微博bid,源微博正文,源微博头条文章url,源微博原始图片url,源微博视频url,源微博位置,源微博日期,源微博工具,源微博点赞数,源微博评论数,源微博转发数,源微博话题,源微博@用户,源微博完整日期
5105823098863789	,P2ru5BbSl,我最后悔打了菲林普利，打了5支，5w。杭州知名台湾医生打的，今年现在在和🥔合作的那个，由此可见他能是什么好医生。当然杭州那群整圈医托也给我死,,,,,2024-11-28T23:09:10,iPhone 14 Pro,1,6,1,,,2024-11-28 23:09:10,False,7430703464,天天都要吃泡菜,5088504677662787	,OB8ptw9rl,"地瓜书上有人去Abijou打了2cc juvelook蓝瓶+2cc Lilide水光，四个月之后馒化成这样了。
真心建议大家，无论机构怎么宣传，说是水光也好，胶原蛋白也好，童颜也好，凡是碰上含有PLLA成份的针剂，你们都得谨慎上脸，因为太不可控了。我不能否认对凹陷脸来说这是个好东西，但是这玩意利润高得吓人，机构为了升单忽悠不适合打这个材料的客户打个五支十支是常事。后果就是馒化，无尽的打“贴骨针”修复。
还有最近很多博主和机构在推的菲林普利，成分就是羟基磷灰石微球粉末哈，出厂会带一支玻尿酸作为载体。这跟十几年前在台湾流行的微晶瓷实际上是一种东西，之前主要用来隆鼻。几年前换了个名字“珊瑚粉“，医院忽悠整友用它补骨，补完出来在ct上看惨不忍睹。现在又变成了填充“内轮廓”、“收紧”的绝佳材料了。",,"https://wx2.sinaimg.cn/large/0086StpSgy1huj3fc2xllj30u01sz0zs.jpg,https://wx1.sinaimg.cn/large/0086StpSgy1huj3fhabukj30u01szdns.jpg,https://wx3.sinaimg.cn/large/0086StpSgy1huj3f8uj96j30u01sz44x.jpg",,,2024-10-12T04:11:58,iPhone客户端,100,27,71,,,2024-10-12 04:11:58
5105822239295831	,P2rsHD0gL,我去，juvelook水光我打了2次了，也是美工用机器摇匀的,,,,,2024-11-28T23:05:46,iPhone 14 Pro,0,0,1,,,2024-11-28 23:05:46,False,7430703464,天天都要吃泡菜,5105820515437566	,P2rpVmOyG,"地瓜书上的评论区看到的另一起注射juvelook蓝瓶“胶原蛋白水光”后造成的结节 注射前还是用机器摇匀的
我不喜欢再生材料 更多的是不喜欢机构和博主对这些针剂的宣传 juvelook的成份是PDLLA 并不是你所理解的胶原蛋白（双美）更偏向是国内的童颜针吧 也含有一些透明质酸（HA）
当然注射传统水光有可能造成肉芽肿和色沉 但还是希望大家往脸上打东西之前 了解清楚你注射的到底是个啥",,"https://wx2.sinaimg.cn/large/0086StpSgy1hw2c55n0v2j30u01szgr8.jpg,https://wx3.sinaimg.cn/large/0086StpSgy1hw2c56v2g8j30zk0fjdh7.jpg",,,2024-11-28T22:58:55,iPhone客户端,15,12,3,,,2024-11-28 22:58:55
5105481010122977	,P2iAl0vZv,想念以前婚后生活都是甜甜的。现在不知道在搞什么鬼 ,,https://wx3.sinaimg.cn/large/008t3Sb8gy1hw19g0xhwoj30si1madqg.jpg,,,2024-11-28T00:29:51,iPhone 14 Pro,0,8,0,,,2024-11-28 00:29:51,True
5104405466841783	,P1QBAsHRl,美白针//@小樱暹罗:先打绿色字的药混10ml盐水静推，然后打黄色带过的四种药各取一只兑100ml静滴，输完打橙色四种药兑250ml盐水静滴//@u点亮人间的月:我也没看懂,,,,,2024-11-25T01:16:01,iPhone 14 Pro,0,0,0,,"小樱暹罗,u点亮人间的月",2024-11-25 01:16:01,False,6200197802,小樱暹罗,5051334090296620	,OlxqV1fac,"对了宝宝们！差点有件大事忘记和大家说！
我这次去🇰🇷经朋友介绍还认识了个药剂师🧑⚕️
她给了我一个美白很顶的方子
白玉灰➕白雪➕vb混合打法
说了一大堆，经我朋友翻译我也没太听懂
总体大意就是这些药没有重复的
所有美白通路都齐全了！
不过打法有点复杂
我在图片中标注的同颜色的药抽出一瓶兑在一起，按照标注的盐水剂量输入。
再说一遍方法：第一步扎上针，把左上白玉➕10ml盐水静推进去，然后静脉输黄色💊兑100ml，之后输橙色兑250ml盐水，怕疼的宝贝就➕盐水，可以随便加。
还有不明白可以评论区问我！",,"https://wx4.sinaimg.cn/large/006LBoGmly1hr8isy157jj31400u0479.jpg,https://wx2.sinaimg.cn/large/006LBoGmly1hr8isydk6sj31400u0ajp.jpg,https://wx4.sinaimg.cn/large/006LBoGmly1hr8isyrq1lj31400u0wnw.jpg",,,2024-07-01T14:29:19,iPhone客户端,357,73,181,,,2024-07-01 14:29:19
5104404260978791	,P1QzE46CX,羊绒,,,,,2024-11-25T01:11:13,iPhone 14 Pro,1,0,0,,,2024-11-25 01:11:13,False,2655095663,爱吃甜奶糕,5104196392585565	,P1LanaQCF,"羊绒怎么打理❕
1️⃣不要挂着！不要挂着！不要挂着！
羊绒衫被衣架挂着会拉扯变形的，日常就把它叠好平铺就行
2️⃣穿一天放两天，隔着穿，给羊绒纤维一个休息回弹的机会，连着穿特别容易起球
3️⃣不穿的时候可以经常拿出来晒晒太阳松松毛，让羊绒变得更丰盈一些
4️⃣我自己的习惯是不洗羊绒…
 一个冬天洗一次，因为轮岗换着穿加上勤晒太阳，所以几乎没啥异味
另外也是因为我觉得羊绒实在太不好洗了，羊绒在我心里跟牛仔裤一样，只要保养得好不需要常洗，好的羊绒不吸附异味
几个洗的方法：
▪️家里的洗衣机如果是很贵的那种，开羊毛模式，冷水，套洗衣袋，最低转速去洗。洗干净了之后不要用力拧干，用毛巾轻轻的吸干水分，放在阴凉的地方让他晾干。
▪️家里的洗衣机如果不够好的话…去全季酒店开个钟点房，把家里的羽绒服羽绒被羊毛衫拿过去洗哈哈哈哈哈哈哈，全季的洗衣机非常非常好！！我不轻易送干洗，因为我也不太信任外面干洗的手法跟技术
5️⃣ 起球：
羊绒衫穿久了，确实会不可避免的起球，但是不会像化工精纺的衣服那样子起大片的球，买一个毛球修理机轻轻的刮掉就好了。最重要的还是不要天天连着穿哈。
6️⃣羊毛护理刷：
我看很多博主都有在推荐这种的羊毛护理刷
羊绒的衣服包括拉绒的都需要醒醒毛，就是穿之前用这个刷子把衣服梳一梳，绒毛会更漂亮，还能减少静电，我感觉很有仪式感，俺自己也买了一个还没到货呢
7️⃣换季保存
过完了今年冬天，往羊绒衫那块放几个樟木条，这个办法是我从lp学到的，味道比樟脑丸好闻多了，而且又能够防潮防虫",,https://wx4.sinaimg.cn/large/9e418b6fgy1hvx5yudslpj20u013zwjp.jpg,,,2024-11-24T11:25:14,iPhone 14 Pro,482,57,153,,,2024-11-24 11:25:14
5103495835029310	,P1sWrl6lU,眉弓眉心一起//@天天都要吃泡菜:所以我特别推荐大家做眉弓去找sz 他的假体通眉心的 雕刻出来的眉心三角双C线很仿真！,,,,,2024-11-22T13:01:28,iPhone 14 Pro,0,0,0,,天天都要吃泡菜,2024-11-22 13:01:28,False,2826975224,差点要被发现的米肉,5041296856847821	,OhkjPsJqJ,"眉心三角立体度比眉弓立体度重要100倍，大部分国人眉心三角都太平了，这种情况追求立体去do眉弓就很容易变成小龙人
何况眉弓真的对立体度而言没那么重要，很多韩国人都是低眉弓高眉心三角，比如 高允真 ",,"https://wx4.sinaimg.cn/large/a88037f8ly1hqci13zcmsj20wr0zmq92.jpg,https://wx2.sinaimg.cn/large/a88037f8ly1hqci14bd5kj20r612jwiv.jpg,https://wx4.sinaimg.cn/large/a88037f8ly1hqci13lblqj20sz0ji76i.jpg",,,2024-06-03T21:44:56,iPhone客户端,37,8,51,,,2024-06-03 21:44:56
5103493727651259	,P1sT2w6rp,反馈下绿溶，打了2次下来，效果不错。但是里面含曲，会泡，而且打完会因为减容了有点垂，所以打绿溶一定要配合紧致素一起打。//@整运爆棚ll:lvro绿溶怎么样！,,,,,2024-11-22T12:53:05,iPhone 14 Pro,0,1,0,,整运爆棚ll,2024-11-22 12:53:05,False,7758499650,好运的对K,5094109473671648	,ODudtfpa8,"今天来打针：babyface绿溶，丽珠兰红，童颜，肉毒，紧致素。
打针姐说你这次去美国是不是吃胖了
 ",,https://wx4.sinaimg.cn/large/008t3Sb8gy1hv0zfs699kj32c0340qv6.jpg,https://video.weibo.com/media/play?livephoto=https%3A%2F%2Flivephoto.us.sinaimg.cn%2F0014oQBOgx08j7nPuBig0f0f0100dVzd0k01.mov,,2024-10-27T15:23:25,iPhone 14 Pro,0,4,1,,,2024-10-27 15:23:25
5102765734888951	,P19WRkvQ3,转发微博,,,,,2024-11-20T12:40:18,iPhone 14 Pro,0,0,0,,,2024-11-20 12:40:18,False,7786795474,系只居,5100317488710157	,P08g4AxUp,"心理学上有一个概念叫贝勃定律，说的就是一个人，在经历过强烈的刺激后，再遭遇类似的事，就没什么感觉了，也没那么在乎了。
 简单的说就是，当你被一个人，被某件事，伤害的很彻底的时候，你熬过了一段很煎熬的折磨期，并且通过这件事，重塑了自己，成功的走出了这个阴影，那你以后再遇到类似的人或者事的事后，你就会更理性更冷静的角度去看待，还有一种来了上帝视角的感觉",,,,,2024-11-13T18:31:51,,2858,39,552,,,2024-11-13 18:31:51
5102511231603685	,P13kn6JbT,眉毛,,,,,2024-11-19T19:49:00,iPhone 14 Pro,1,0,0,,,2024-11-19 19:49:00,False,7937589312,医托医骗开团卖假光电的变我头像,5102160101247122	,P0Uc25eqS,电又来分享好东西了 这次是眉毛➕睫毛➕美瞳  很适合整容小女孩儿  图一是我相机开闪光灯的绒毛感 我本身做了两次眉弓眉毛已经被割的七零八落了 图二眉粉 按照自己喜欢的选 一定要用图三这种大刷子 整体眉毛扫一遍  让用眉笔画出毛流感 最后加染眉膏 cl02 知道你们笨笨的 给你们找了完整的视频教程。图六 另外我的睫毛很多人问  婴儿弯➕b翘 让美睫师穿插种 重点是要长 我都种到15的 ，然后就是美瞳的部分 我最爱的都图里了 杏仁粽就是那种无辜狗狗眼  冷眼芭比 还有15.0的美瞳 baby baby 我眼睛大的夸张 我戴15.0的美瞳都能漏出整个眼白 所以不是大眼不要买这些美瞳,,"https://wx2.sinaimg.cn/large/008FbjA4gy1hvqnzxujjwj31490u0107.jpg,https://wx2.sinaimg.cn/large/008FbjA4gy1hvqo0esextj30u00uxwin.jpg,https://wx2.sinaimg.cn/large/008FbjA4gy1hvqo048er3j30m80m8q42.jpg,https://wx2.sinaimg.cn/large/008FbjA4gy1hvqo0e6zsjj30u012dq7v.jpg,https://wx2.sinaimg.cn/large/008FbjA4gy1hvqo0xkpjjj30vn0u0gmm.jpg,https://wx4.sinaimg.cn/large/008FbjA4ly1hvqo08bn21j30jy0kyjru.jpg,https://wx1.sinaimg.cn/large/008FbjA4gy1hvqo06ymf2j30u01t1wk8.jpg,https://wx2.sinaimg.cn/large/008FbjA4gy1hvqo093asqj30u01t1afv.jpg,https://wx4.sinaimg.cn/large/008FbjA4gy1hvqo29jqmwj30u03u4h0u.jpg","https://f.video.weibocdn.com/o0/piWRfaYSlx08jGOxdmxa01041200nlov0E010.mp4?label=mp4_720p&template=718x754.24.0&ori=0&ps=1BThihd3VLAY5R&Expires=1732874568&ssig=%2BPjDq0tiKF&KID=unistore,video",,2024-11-18T20:33:44,iPhone 14 Pro Max,635,29,89,,,2024-11-18 20:33:44
