id,bid,正文,头条文章url,原始图片url,视频url,位置,日期,工具,点赞数,评论数,转发数,话题,@用户,完整日期,是否原创,源用户id,源用户昵称,源微博id,源微博bid,源微博正文,源微博头条文章url,源微博原始图片url,源微博视频url,源微博位置,源微博日期,源微博工具,源微博点赞数,源微博评论数,源微博转发数,源微博话题,源微博@用户,源微博完整日期
5105382945198736	,P2g2alOqA,是啊，我也是如此觉得，如果你真这么确信你自己的观点是对的，其实没必要找我说，也不用试图说服我，因为说服我也没有任何意义。//@喔美乃嗞:就是这样的人在“同行”导致的80%的女装退货率呀。当然女装又不是第一天上市就打到80%的退货率。而是这些就业者的这种消耗了消费者的信心和信任，渐渐影响整个行业的恶果。而且这人所谓的“也能卖”，但事实就是他哪怕从业那么久也没有培养出一批忠诚的消费者群，也所以他没有可以让他哔哔的地方和位置，说的话没人听，才要来私信博主。他没有相信他的人，才会害怕有相信博主的人。,,,,,2024-11-27T18:00:10,微博网页版,14,3,1,,喔美乃嗞,2024-11-27 18:00:10,False,1840483562,蹦蹦跳跳的阿龙,5104188282112393	,P1KXi8RwR,"虽然聊的很诚恳，但总觉得这种诚恳中多少又带点离谱，就话里有很多槽点，而且我就想问问，为什么只用逗号啊。而且不能分段么，这特么完全不顾及过的人的感受啊。。。哎
首先我的人生经常遭遇一种困境，就是被人误解，比如我有时候洋洋洒洒些一大段，我自认为讲述的相对全面了，但经常发生的情况是别人只看了一部分，就拿出来说，以至于很多人批评我，其实都美欧批评到点子上，都不如直接说我丑来的准确点。
首先我从来没有过直接，乃至间接的表达过「不符合我要求的都是垃圾」，绝对没有，我真从没这么说过，我表达的意思自始至终都是「你他妈的瞎讲，瞎勾八吹，你搞批发的，还吹的昏天暗地的，所以你才是垃圾。」
不是说你和我不一样，所以你就是垃圾，我何时表达过如此荒谬的观点，这简直比我在DY买东西被人骗都离谱。
很多网红店明明用很粗糙的面料，就是你们这种工厂出来的货，你吹你M的高支高密，高级羊毛面料，细腻有毛感，你们是工厂，也自己说了，直接给各种网红店供货，你们厂里有高级面料吗，不会有的，干工厂的那自己也知道，工价差的多了去了，面料差的多了去了，同一个工厂出来的货也可以查了去了。
但我也没骂过你们这些干工厂的啊，我只是骂的瞎吹的。当然我有一个问题，就是直播间里，那些网红，他们那些瞎吹的话，是谁教他们的，如果是你们，那你们这种工厂就是垃圾，就该倒闭。
而且有些根上的观点我是无法认同的，市面上很多东西就是有问题的，无非是这个市场太乱，真要查都不知道该从哪儿下手，都干搞，今天给网红说这是100S的羊毛做的，他就敢网上说这是100s的，实际上就烂东西，于是什么回料，二手货，不命成分的东西，贴个表就上了。
我就问问，我一年在产品上的检测费，我就得花几十万的，我为什么不可以骂这些人是垃圾，我不懂啊，他们甚至在犯法啊，说难听的就特么法外狂徒啊，你为什么要劝我理解他们呢，我觉得应该让他们向我学习才对啊。
我认为什么是国货，MD不是说你是中国人，我是中国人，我们都做服装，所以咱们做的都是国货了，这逻辑显然有点问题，我和你一个老师教的，你特么第一名，我最后一名，于是我笑嘻嘻的说：大家都一样~~
我认为只有两种品牌配得上「国货」二字，一种是改变了我们在国际上的地位与声望，使得我们获得了美誉，另一种是他真实有效的改变了消费者的「处境」。
第一种，我们通常称之为奢侈品品牌，第二种我们通常称之为国民品牌。
众所周知，我们是社会主义国家，从骨子里就不爱奢侈品那种虚头巴脑的那一套，我们应该走的是第二种路线。
国货也不是你便宜你就是国货，你便宜哪是因为你烂，当然你不吹就没人说你，就像辛巴卖燕窝，你说这是银耳，没人会说你，你片要说你是燕窝，册那，这不是瞎扯卵蛋么，哈切得八。
你在保证自身存货和正常利润的情况下，把东西做好，让消费者尽可能在合适的价位里买到放心的东西，买到尽可能好的东西，让他们不要担惊受怕，这就是改变消费者的处境。请问你说的网红店，那些臭网红，主播，他们做到了吗？
我再次强调，我的言论不针对工厂，我知道工厂很不容易，很多时候也都是迫于无奈（当然，你们以后如果给网红供的东西得给他们说真话，别骗了）
那再说回我自己，很多人都讨厌我，觉得我非常狂妄且偏执，很多时候又极度自负，喜欢吹牛逼。但你可以回头去把握所有微博翻一遍，纵观我的吹牛是。
我吹的牛基本都做到了，我做不到的我都不吹。
就像你反问我的，难道我一上来就是做到这样的吗？当然不是。我前一年吹什么，吹我面料给大家用的都是不错的，我甚至都不太提版型，这个事情我这两年多次和我消费者忏悔，因为我是真的苦了他们了。
那时候大量男女通版，能通版的通，不能通版的强行通版，让一个个女生穿他妈腰围可以从70拉倒98的裤子，让男的穿大码女装，这些事情我都是非常坦然的承认的，我很坦荡。那句话叫啥来着，这不是黑历史，这就是我走过的路。
到后面我们引入大师版型系列，因为我们找了国内顶尖的版型大师，给我们用一年时间彻底迭代了各种产品的版型数据，这个事情我耗时1年完成了，然后我才开始讲版型，讲款式，裤子这种最难做的东西，也是从哪一年开始直线拉伸的。
我刚开始的时候我面料用的不错，但我也没给消费者吹我多专业多牛逼，我也没给消费者说什么面料是我自备纱线提前一年给消费者准备的，我只能说在我能力范围内我去找别人要我能承受的，去年开始，我们开始囤积原材料，然后整个面料就跟着一些最顶尖的大牌做下去，含量比例上会做个位数调整。
我这个人，确实喜欢吹牛逼，我承认的，我吹牛逼有瘾，但我基本都是有八九分把握了我再吹，我问心有愧的可能只有一件事，就是消费者给我提做这个做那个，我都是满口答应，但之后就是「拖」，拖就完事儿了，嘻嘻。（没有说忽悠消费者的意思，因为产品开发确实是需要时间）
我的问题不是我言辞激烈，恰恰相反，很多是偶我都觉得自己言辞还不够激烈，很多想吹的牛逼都没吹，因为大锤时常提醒我：MD我们能不能活过这两年都另说，你先活下来再吹吧，别牛逼吹出去自己破产了，这丢人丢大了。
我想想有道理，所以很多时候我说话真的是克制的。
本来写到这里不想写了，但我还是觉得要在说一下，产品这东西，我从没说便宜的就是不行，但你200块卖的羽绒服，399卖的羊绒衫，你偏要吹说自己是好东西，这就是不要脸。
要我这性格，真出这种货，我肯定会说清楚：
这大衣，毛感就这样，如图所示，有点小糙，很高级货肯定没法比，就街拍时不仔细看还可以，肯定是能出片的，我手机一拍，效果蛮好的，而且最重要的是你考虑到就这价格，咱们还要啥自行车！今天我们就主打一个实惠！你今天买回去就算是买个样子货拍拍照也不亏，而且羊毛的，家人们，你说他保暖效果肯定有，大衣最重要的是什么，家人们，是感觉！今天不要1999，不要999，也不要699，更不要499，直接399！全羊毛大衣，3！2！1！上车！
喜欢的家人们小关小注帮主播点起来！
如果你这样的话术，那就没问题，MD我这个算是说的够清楚了吧？？",,"https://wx3.sinaimg.cn/large/6db38ceagy1hvwp58f9mgj20ge0vn48w.jpg,https://wx4.sinaimg.cn/large/6db38ceagy1hvwp5e8uhrj20gq0uggvj.jpg",,,2024-11-24T10:53:00,微博网页版,82,25,9,,,2024-11-24 10:53:00
5105338711277706	,P2eSP5moa,"#偶得单品推荐# 老板，买双鞋吧，买双精致高档的德训鞋。
napa全粒面头层牛皮，柔软透气；定制鞋楦，符合亚洲人脚型；欧索莱鞋底，确保行走舒适。
买一双吧老板
 
NAPPA头层全粒面牛皮撞色德训鞋拼翻毛皮/撞色外缝线平底板鞋
 ",,"https://wx2.sinaimg.cn/large/6db38ceagy1hw0swsfnogj23ya5xce83.jpg,https://wx2.sinaimg.cn/large/6db38ceagy1hw0sy6rrqqj23ya5xckjn.jpg,https://wx4.sinaimg.cn/large/6db38ceagy1hw0sywl4oyj23ya5xcb2b.jpg,https://wx1.sinaimg.cn/large/6db38ceagy1hw0sw8d33aj23ya5xcb2c.jpg,https://wx3.sinaimg.cn/large/6db38ceagy1hw0szt2cxcj20zu25oe81.jpg,https://wx2.sinaimg.cn/large/6db38ceagy1hw0t0hii34j20zu25ou0x.jpg,https://wx2.sinaimg.cn/large/6db38ceagy1hw0t2odqayj20zu25oe81.jpg,https://wx4.sinaimg.cn/large/6db38ceagy1hw0t47bbgoj20zu25o1ky.jpg,https://wx3.sinaimg.cn/large/6db38ceagy1hw0t56yksfj20zu25oqv5.jpg,https://wx2.sinaimg.cn/large/6db38ceagy1hw0t5wq1ljj20xc0xc0wr.jpg",,,2024-11-27T15:04:23,蹦蹦跳跳的阿龙的小店,41,81,2,偶得单品推荐,,2024-11-27 15:04:23,True
5105327607384422	,P2eAUuZ1A,这批产品的产前头样基本都出了，其中两个产品是出问题了，一个是牛仔裤没有缩好，裆前出现了非正常的内收斜折，影响了整个版型，第二个是银狐绒的卫衣外套，领口下下出现了不该有的冗余，这个样要给归掉。但这种都是小问题，基本已经全部调整完毕，牛仔最快明天晚上开始开始陆陆续续洗完，后天入库。 但第一批我只让水洗厂洗出来200条，再第一批下线后，如果首批货没问题，那后续也就没问题了，一天会按照500件的速度洗。,,"https://wx2.sinaimg.cn/large/6db38ceagy1hw0rsceb3gj20mn0lxter.jpg,https://wx1.sinaimg.cn/large/6db38ceagy1hw0rsyxq6bj20nv0ov7ks.jpg",,,2024-11-27T14:20:16,微博网页版,40,18,0,,,2024-11-27 14:20:16,True
5105324467423273	,P2evQv98d,"偶得·高支双面呢短款大衣优雅小翻领袖口开叉小个子款显腿长
 再一个价位中，我们直接给出最好的选择，这就是免于选择的痛苦，也是真正的质价比。这个小短款真的是一个超级优秀的产品//@我夫荣:又有气质又有钱
 //@cheungkalai:可好看了 真符合我斯文的气质
非常适合通勤 可惜我矮子 不然必入长款大衣
 
评论配图",,,,,2024-11-27T14:07:48,蹦蹦跳跳的阿龙的小店,7,5,0,,"我夫荣,cheungkalai",2024-11-27 14:07:48,False,1840483562,蹦蹦跳跳的阿龙,5105152486802637	,P2a2ssxFX,"我和小吴打了个代驾，回公司，代驾师傅问我们是不是社会上混的，他说看我们穿着，像是社会上混的。
我不知道哪里出了问题。 ",,,,,2024-11-27T02:44:24,摸鱼邻居iPhone客户端,304,71,3,,,2024-11-27 02:44:24
5105152486802637	,P2a2ssxFX,"我和小吴打了个代驾，回公司，代驾师傅问我们是不是社会上混的，他说看我们穿着，像是社会上混的。
我不知道哪里出了问题。 ",,,,,2024-11-27T02:44:24,摸鱼邻居iPhone客户端,304,71,3,,,2024-11-27 02:44:24,True
5105095554895176	,P28yDkxss,"不是，你可以说我劳心劳力，但我也没有奸屁股啊，我挣的是干净钱，你把我说的太脏了。//@DQ汉堡可乐都是英短:
有什么理解不了的，只要抄➕骗，每个月人家干10单就能吃喝不愁，财富自由，压根不用像你这么劳心劳力还要撅屁股",,,,,2024-11-26T22:58:11,摸鱼邻居iPhone客户端,102,23,0,,DQ汉堡可乐都是英短,2024-11-26 22:58:11,False,1840483562,蹦蹦跳跳的阿龙,5105081437655078	,P28bRw7r0,完全不理解这种山寨店……… ,,"https://wx3.sinaimg.cn/large/6db38ceagy1hvzzm0vunrj20zu25o7wh.jpg,https://wx4.sinaimg.cn/large/6db38ceagy1hvzzm2uxe1j20zu25o1kx.jpg",,,2024-11-26T22:02:05,摸鱼邻居iPhone客户端,235,62,1,,,2024-11-26 22:02:05
5105090067436793	,P28pMvcEh,工厂局，大家喝的也差不多了，开始讨论牛仔裤的缩率了，一个厂长说一次下水缩率两次下水缩率，另一个坐版的大哥说不需要。我的看法是，话太多了，不如直接喝，我怕他们打起来。 ,,,,,2024-11-26T22:36:23,摸鱼邻居iPhone客户端,42,5,0,,,2024-11-26 22:36:23,True
5105081437655078	,P28bRw7r0,完全不理解这种山寨店……… ,,"https://wx3.sinaimg.cn/large/6db38ceagy1hvzzm0vunrj20zu25o7wh.jpg,https://wx4.sinaimg.cn/large/6db38ceagy1hvzzm2uxe1j20zu25o1kx.jpg",,,2024-11-26T22:02:05,摸鱼邻居iPhone客户端,235,62,1,,,2024-11-26 22:02:05,True
5105065432190315	,P27M39bNF,"偶得·挺括感立裁阔腿裤 美利奴羊毛 秋冬加长直筒裤 高妹可入
 这条//@三斤饭:这裤子是哪条呀",,,,,2024-11-26T20:58:29,蹦蹦跳跳的阿龙的小店,1,2,0,,三斤饭,2024-11-26 20:58:29,False,1840483562,蹦蹦跳跳的阿龙,5105059839089053	,P27D1C8tD,"#偶得单品推荐# 我们的习惯就是把最顶级的面料配最低调的款式，绝不张扬，我们当时用到这块料子的时候也犹豫了一下，想要不要搞点高调点的款式，然后跑去看了下，发现人家也是干的非常基础的版型。
这种款式就适合那种对品质有极高要求，但又想保持低调的客群。
还要强调下：一个季度干洗一次，千万别扔洗衣机，求求了。 
偶得·立裁全羊绒短款大衣100%阿拉善羊绒双粒扣双面呢高端款",,"https://wx3.sinaimg.cn/large/6db38ceagy1hvzrm19o45j23ya5xcb2b.jpg,https://wx1.sinaimg.cn/large/6db38ceagy1hvzrm45glvj23ya5xcb2c.jpg,https://wx3.sinaimg.cn/large/6db38ceagy1hvzrlyowiyj23ya5xckjo.jpg,https://wx4.sinaimg.cn/large/6db38ceagy1hvzrm6d9wbj23ya5xcqv7.jpg,https://wx4.sinaimg.cn/large/6db38ceagy1hvzrqe2myaj20zr1pdgtk.jpg,https://wx1.sinaimg.cn/large/6db38ceagy1hvzs0p7odnj212w12wgnv.jpg,https://wx4.sinaimg.cn/large/6db38ceagy1hvzx4x9h63j212w12wgnv.jpg",,,2024-11-26T20:36:16,蹦蹦跳跳的阿龙的小店,47,28,1,偶得单品推荐,,2024-11-26 20:36:16
5105059839089053	,P27D1C8tD,"#偶得单品推荐# 我们的习惯就是把最顶级的面料配最低调的款式，绝不张扬，我们当时用到这块料子的时候也犹豫了一下，想要不要搞点高调点的款式，然后跑去看了下，发现人家也是干的非常基础的版型。
这种款式就适合那种对品质有极高要求，但又想保持低调的客群。
还要强调下：一个季度干洗一次，千万别扔洗衣机，求求了。 
偶得·立裁全羊绒短款大衣100%阿拉善羊绒双粒扣双面呢高端款",,"https://wx3.sinaimg.cn/large/6db38ceagy1hvzrm19o45j23ya5xcb2b.jpg,https://wx1.sinaimg.cn/large/6db38ceagy1hvzrm45glvj23ya5xcb2c.jpg,https://wx3.sinaimg.cn/large/6db38ceagy1hvzrlyowiyj23ya5xckjo.jpg,https://wx4.sinaimg.cn/large/6db38ceagy1hvzrm6d9wbj23ya5xcqv7.jpg,https://wx4.sinaimg.cn/large/6db38ceagy1hvzrqe2myaj20zr1pdgtk.jpg,https://wx1.sinaimg.cn/large/6db38ceagy1hvzs0p7odnj212w12wgnv.jpg,https://wx4.sinaimg.cn/large/6db38ceagy1hvzx4x9h63j212w12wgnv.jpg",,,2024-11-26T20:36:16,蹦蹦跳跳的阿龙的小店,47,28,1,偶得单品推荐,,2024-11-26 20:36:16,True
5105043812652344	,P27dbb7ZK,你要看那是看不了的，除非你单独送实验室检测，所以约等于没任何一点办法//@笑笑艾1111:请问，那怎么看衣服含不含 联苯胺,,,,,2024-11-26T19:32:35,摸鱼邻居iPhone客户端,8,2,2,,笑笑艾1111,2024-11-26 19:32:35,False,1840483562,蹦蹦跳跳的阿龙,5104971922015994	,P25le8ss2,"刚摸鱼给我看了条小红薯帖子，说什么衣服甲醛超标，我搜了下还挺多的，小红薯上真的是一堆半吊子水还特么搞科普，反买一些不太在点上的焦虑，这问题我再说一遍。
甲醛确实是强致癌物，我也提到过这东西，但一般来讲，它是很难超标，虽然有些衣服是真的用到，但到最后甲醛真的超标概率很低，我不是说绝对100%不会，但99%都不会有问题，这个指标伤害性看起来是比较大，但风险性是比较低的。
因为甲醛这东西是溶于水的，很多衣服出厂前都要水洗，所以基本是不太可能出现。
那衣服其他一些东西也是可能致癌的，而且是强致癌，比如联苯胺这种东西，这种东西都是强制爱物，最关键的是这些东西他可以直接透过皮肤进入你身体，吸收效率非常高。
很多人看衣服看他掉色不掉色，觉得有掉色了那一定是有问题的，这也是不对的，有些材质，深色，一定掉色，你得过五六七八次，这不掉表什么，而反之那些不掉色的，你也不能说她就一定合格，一定没问题。
所以这种东西你很难知道。这也是我为什么反反复复和你们讲少买网红店的原因，我们是属于定期测，品牌也是（小品牌可能不这么搞，但大品牌据我所知，都是要定期测的），网红店是真不测的，他手上那份报告甚至都是别人给他的假报告。
你也别看什么执行标准，我再给你们说一遍，这东西自己随便写，随便印，是一点用都没有，这东西纯看专业度和和职业道德。
而这里还要给大家科普下联苯胺着东西有多狠，这个其实比甲醛强特么多了，从数据上来看，这个玩意儿在某些癌的概率上，可以拉高几十倍，就假设你原本是2%概率得这玩意儿，这东西你经常吸，可能干到百分之几十，关键他还残留，对血液系统的伤害也是长期的。
所以虽然甲醛也是强致癌物，但这玩意儿其实是纸老虎，洗一遍就没了，反而没必要关注。
一些所谓的尾货库存，虽都是大代工厂的，我手上有很多这种货源，但这种东西我都不太想碰，当然，我未来碰，我肯定也是收进来，找其他渠道出给别人，我肯定不坑你们。之所以这样干一方面是有这种原因，另一方面就是面料好不好，他的原因是复杂的，是多方面的，所谓的致癌物只是一方面。
很多人都不知道一般这种货储存环境真的都很糟糕，很多你觉得网上捡便宜，捡大漏的产品，再到你手上之前，就是各种角落当垃圾一样堆在一起，受潮，发霉，没人管的，其实这种对身体的危害耶是比较普遍的。
我给你做一个很形象的比喻，你把一床被子，仍在某个桥洞下1年，1年后我把被子给你，我就问你睡不睡，别说睡了，你光想想一下就觉得浑身发扬，其实道理是一样的，哪怕我把被子洗一下再给你，你还是不会放心。",,,,,2024-11-26T14:46:54,微博网页版,162,39,17,,,2024-11-26 14:46:54
5105006888092243	,P26fCxXa3,"#1件羽绒服成本约200到800元#这种对于消费者参考意义也不大，市面上有大量100块钱成本的羽绒服，数量远超你们想想，贵的上1000也很常见。
很多一部分成本是在工价上。比如200块一件羽绒服，这200就相当于我们大衣的工费罢了。其实你一起去讲这种讲不清楚的，实在点，别特么瞎起哄。半年前吹什么清仓羽绒服的时候怎么没人去查一下的。
真一帮人诈骗消费者的时候没人管，现在假货早就留入时常了，开始一条条热搜，各种新闻来了，有这闲工夫不如整顿整顿行业。",,,,,2024-11-26T17:05:51,摸鱼邻居iPhone客户端,75,15,4,1件羽绒服成本约200到800元,,2024-11-26 17:05:51,True
5104971922015994	,P25le8ss2,"刚摸鱼给我看了条小红薯帖子，说什么衣服甲醛超标，我搜了下还挺多的，小红薯上真的是一堆半吊子水还特么搞科普，反买一些不太在点上的焦虑，这问题我再说一遍。
甲醛确实是强致癌物，我也提到过这东西，但一般来讲，它是很难超标，虽然有些衣服是真的用到，但到最后甲醛真的超标概率很低，我不是说绝对100%不会，但99%都不会有问题，这个指标伤害性看起来是比较大，但风险性是比较低的。
因为甲醛这东西是溶于水的，很多衣服出厂前都要水洗，所以基本是不太可能出现。
那衣服其他一些东西也是可能致癌的，而且是强致癌，比如联苯胺这种东西，这种东西都是强制爱物，最关键的是这些东西他可以直接透过皮肤进入你身体，吸收效率非常高。
很多人看衣服看他掉色不掉色，觉得有掉色了那一定是有问题的，这也是不对的，有些材质，深色，一定掉色，你得过五六七八次，这不掉表什么，而反之那些不掉色的，你也不能说她就一定合格，一定没问题。
所以这种东西你很难知道。这也是我为什么反反复复和你们讲少买网红店的原因，我们是属于定期测，品牌也是（小品牌可能不这么搞，但大品牌据我所知，都是要定期测的），网红店是真不测的，他手上那份报告甚至都是别人给他的假报告。
你也别看什么执行标准，我再给你们说一遍，这东西自己随便写，随便印，是一点用都没有，这东西纯看专业度和和职业道德。
而这里还要给大家科普下联苯胺着东西有多狠，这个其实比甲醛强特么多了，从数据上来看，这个玩意儿在某些癌的概率上，可以拉高几十倍，就假设你原本是2%概率得这玩意儿，这东西你经常吸，可能干到百分之几十，关键他还残留，对血液系统的伤害也是长期的。
所以虽然甲醛也是强致癌物，但这玩意儿其实是纸老虎，洗一遍就没了，反而没必要关注。
一些所谓的尾货库存，虽都是大代工厂的，我手上有很多这种货源，但这种东西我都不太想碰，当然，我未来碰，我肯定也是收进来，找其他渠道出给别人，我肯定不坑你们。之所以这样干一方面是有这种原因，另一方面就是面料好不好，他的原因是复杂的，是多方面的，所谓的致癌物只是一方面。
很多人都不知道一般这种货储存环境真的都很糟糕，很多你觉得网上捡便宜，捡大漏的产品，再到你手上之前，就是各种角落当垃圾一样堆在一起，受潮，发霉，没人管的，其实这种对身体的危害耶是比较普遍的。
我给你做一个很形象的比喻，你把一床被子，仍在某个桥洞下1年，1年后我把被子给你，我就问你睡不睡，别说睡了，你光想想一下就觉得浑身发扬，其实道理是一样的，哪怕我把被子洗一下再给你，你还是不会放心。",,,,,2024-11-26T14:46:54,微博网页版,162,39,17,,,2024-11-26 14:46:54,True
5104959606227459	,P251mq82T,"这款产品的面料比例调整说明，面料成分新增少量羊毛。
面料商当时上报的面料成分里确实有羊毛和桑蚕丝，反正我们不听面料商说什么，直接送实验室检测，最终一检时候实验室的数据说没有羊毛，桑蚕丝倒是有，因为我们其实是按照测出来的成分去标的，以我们自测为准。
但因为本身羊毛比例非常少，就算他有，我也不可能因为有点羊毛就涨价了，其实我们是无所谓的，因为面料因为批次不同，有时候投料是会有差，太少就可能检测不出来。
但MD面料商就坚持说有，硬说这个面料配方里是投了羊毛的。
我心说我对面料这种东西还挺敏感的，我觉得这个面料成分非常复杂，好多种纤维，舒服确实很舒服，但我是真的我感受不到羊毛，但确实有一定的可能是因为比例不高所以我确实无法感受出来。
但本着不放过一个坏人，不错杀一个好人的原则，我们继续做复检。反正我们也是检测机构包年用户，直接再测。
现在复检的得道回复说，人家确实有。笑死，还真冤枉他们了。
偶得&amp;middot;磨毛双面布收腰打底衫软糯亲肤撞色假两件四针六线工艺",,,,,2024-11-26T13:57:58,蹦蹦跳跳的阿龙的小店,29,7,0,,,2024-11-26 13:57:58,True
