id,bid,正文,头条文章url,原始图片url,视频url,位置,日期,工具,点赞数,评论数,转发数,话题,@用户,完整日期,是否原创,源用户id,源用户昵称,源微博id,源微博bid,源微博正文,源微博头条文章url,源微博原始图片url,源微博视频url,源微博位置,源微博日期,源微博工具,源微博点赞数,源微博评论数,源微博转发数,源微博话题,源微博@用户,源微博完整日期
5103530320598158	,P1tQ42vBI,这个实在是好笑。反正今年你卖羽绒服，便宜的你都不用看的，都假的，什么五六百的羽绒服，一千五的鹅绒被，基本算是光明正大的在犯罪了。等一下铁子们看看我们的真·羽绒服平替产品哈！,,,,,2024-11-22T15:18:30,微博网页版,29,38,3,,,2024-11-22 15:18:30,False,3203137375,四川观察,5103513836720480	,P1tptsciQ,"【绒含量基本为0！#警察查获假羽绒服超7万件#】近日，浙江湖州织里公安捣毁一生产、销售伪劣羽绒服窝点，#羽绒服吊牌标70%绒实际含量为0#涉案羽绒服吊牌上标着70%绒，检测后却显示绒含量基本为0。目前该企业3名主管人员已被采取刑事强制措施，案件正在进一步侦办中。 
四川观察的微博视频
 ",,,"https://f.video.weibocdn.com/o0/7js9jBgYlx08jMLvsALC010412004ZMI0E010.mp4?label=mp4_720p&template=720x1280.24.0&ori=0&ps=1CwnkDw1GXwCQx&Expires=1732878896&ssig=JRtMJWYIgP&KID=unistore,video",,2024-11-22T14:13:00,微博视频号,3115,341,187,"警察查获假羽绒服超7万件,羽绒服吊牌标70%绒实际含量为0",,2024-11-22 14:13:00
5103511792518286	,P1tmbaz7w,"很多人对这个世界的理解比较粗暴，或者说比较幼稚，属于鸡汤成功学那一挂的。他们相信只要有能力，就会有资源，有资源你就肯定会有钱，你自信自强自爱，你就什么问题都能解决！一切都能盘活！
确实有一类人对世界的思考极度扁平，他们甚至都不敢想象，世界上大多数人的成功，其实首要因素是——足够幸运~
我们同样做一件事，就拿创业来说，假设我们其他条件相同，但我比你有能力一些，我比你聪明一些，实际上你的成功率是1%，而我的成功率大概也就是10%。
我是90%失败率，你是99%的失败率。
我再说个具象点的，哪怕我们做同样的生意，赛道一样，资源，钱都一样，今天我们都面临了一个问题，就是急切的需要供应链，时间非常紧迫，这种事里，或许识人的经验可以对你有些帮助，但也很悠闲。此时此刻，所谓的个人能力就会被缩小。
你说差别有吧，那确实有，但不大，只能说我比你更容易被老天眷顾一些，仅此而已。
或许你可以说幸运的比重他不一定是最大的，但至少可以说运气这玩意儿，他在关键的时刻就是必须的，这就属于有了这东西，你不一定行，但如果你没有，你一定不行。
你可以能力差一点，你可以钱少一点，你资源甚至前期都可以么有，但在关键时间上，你就是得要运气。
所以很多人认为，有个人能力就能发财，就能成事儿，这种人其实是值得让人羡慕的，因为能这么想的人，足以说明他这辈子虽然没见过什么大场面，真要说做生意，层次也不会很高，这代表什么？代表着他百分百没吃过什么苦，日子过的安逸且顺滑，舒服的很。
你要说有没有什么人就是特别适合创业，当然有，一个人的性格，脾气，领导力，心性，有些人这些方面就是适合创业，适合自己做生意，但问题在于这些东西里面至少有50%也是先天决定的。
就比如这个人的性格，智商和遗传是强相关的，而一个人的脾气，领导力又是和其生长环境，成长经历相关的，在你20岁之前，这些东西你往往难以控制，或许有不少主观选择的成分在，但请问这不是运气又是什么？我说50%，不过分把。
你可以说个人能力强，别运气太差，能让自己有好工作，生活向上移动，过上自己要的生活，哪是没问题的，但你要发财，成大事，个人能力的比重就会被缩小，除非你是那种天纵奇才。
至于创业是不是为了钱，这个事情我倒是认为是这番话里为数不多的一句还算正确的话。
我认为创业的目的肯定不是钱，我认为是改变行业或者是某一个群体的生活处境，即改变世界。创业一定要赚钱，因为你做很多事情确实需要钱，而且同样用钱，一个是别人给你钱，一个是你自己的钱，还是有区别的，但不能单纯的只为了钱，你这些钱到底是为了什么？
但总体来讲，我觉得说图里这话的人还是太幼稚了，就有种精神小伙谈论世界格局的味道。",,"https://wx2.sinaimg.cn/large/6db38ceagy1hvuyeo4a78j20s00tdk5w.jpg,https://wx3.sinaimg.cn/large/6db38ceagy1hvuyergz88j20bm0betai.jpg",,,2024-11-22T14:04:52,微博网页版,79,25,13,,,2024-11-22 14:04:52,True
5103494829179036	,P1sUOCvSY,"【斗篷大衣】：每个人或许这辈子只会买一件斗篷大衣，那就得选择「正」的。
很多人对斗篷大衣是有误会的，他们会认为长款，宽松的大衣的就是斗篷大衣，于是你打开各大购物平台，搜出一堆似是而非的斗篷大衣，不是的，严格俩说，这些绝大多数都算不上斗篷大衣，只能说是斗篷款，或者是类似斗篷的大衣。
如果你去追溯服装历史的话你就会发现，斗篷或者类斗篷的服装很早就出现了。
从最早古希腊贵族们，到古代征战沙场的将军们，都有斗篷这种服装的身影，而斗篷也出现在女性服饰上，在近代也是比较常见的事情，在一些社交场合，它出现的频率比较高。
而所谓的斗篷大衣，实际上是采用了类似斗篷的披肩结构，但最终上身后能呈现出类似的大衣效果，那斗篷最明显的一个特征是什么？
就是无袖，或者虚袖（即假袖子），也正式因为如此，你会发现很多影视作品里，包括游戏里的那些斗篷都很帅，你想象下他如果有袖子的画面，那绝壁是不帅的。
所以一件斗篷大衣它追求的就是一种「无用的纯净」，或者说是一种「无用的好看」。在当今，一件高贵的斗篷大衣，他的核心就是要纯净，什么有袖子的，正面贴两个口袋了，再装几个纽扣了，那都不行，因为在这个品类上，颜值即正义。
她靠的是干净柔顺的面料，流畅利落的剪裁，帅就完事儿了。
这是一个注定小众的产品，如果你希望他能给你发挥多大的适用性，那他一定不能提供，但如果你就想要一件美的，那你可以考虑一下。
【色织毛呢感阔腿裤，半松紧】：梨形，苹果型身材狂喜。
如果你需要的是一条毛呢感与宽容度兼备的裤子，那你就该看这条。（内涵5CM隐藏裤长）
如果你觉得我们的那条加绒牛仔裤还不够松弛，不够神裤，你或许可以选择这条。全库使用了400克重的磨毛面料，自带毛呢效果，但可以完全放心，他100%是不会扎腿的，阔腿裤造型，给内部留出宽敞的活动空间。
而更重要的是，这条裤子前腰光洁平枕，腰后侧自带松紧弹力，宽容度大大提高，腰，臀，大腿，都给到了足量的空间。裤身前片的左右两侧，你们可以仔细去看，是压了褶的，这种做法你从视觉上来说他可以讲叫有层次感，可以吹线条的直感！显腿长！
但实际最大的作用是这种压着其实是一种空间折叠，尤其是对臀腿尺码稍大的，在走动，弯腰，下蹲时，这种压褶同样可以外扩，即在你各种角度，各种运动姿态里，把空间「让」出来，而在你不用的时候，他又会回到「褶」的状态，给你提供视觉上的一些效果。
这条裤子你去配一些外套，夹克，都是没问题的，主要是它这种格纹花型，有一种秋冬受欢迎的复古感，同时它的搭配性又非常强。
哦对了，最重要的一点，好打理，可机洗。 
偶得·色织花呢感格纹",,"https://wx4.sinaimg.cn/large/6db38ceagy1hvuxbim2dlj23ya5xcu0z.jpg,https://wx4.sinaimg.cn/large/6db38ceagy1hvuxbqvvlbj23ya5xcnpe.jpg,https://wx3.sinaimg.cn/large/6db38ceagy1hvuxb6m8fqj23ya5xc4qr.jpg,https://wx2.sinaimg.cn/large/6db38ceagy1hvuxe9fqwbj23ya5xc4qs.jpg,https://wx2.sinaimg.cn/large/6db38ceagy1hvuxd0yzy7j22qf2bchdu.jpg,https://wx3.sinaimg.cn/large/6db38ceagy1hvuxdztwpjj23ya5xckjn.jpg,https://wx4.sinaimg.cn/large/6db38ceagy1hvuxea6d9qj212w12wwgj.jpg,https://wx4.sinaimg.cn/large/6db38ceagy1hvuxeanvh3j212w12wabq.jpg",,,2024-11-22T12:57:27,蹦蹦跳跳的阿龙的小店,38,68,0,,,2024-11-22 12:57:27,True
5103487090691528	,P1sIl2TTG,我吃个饭，就开始上款。 ,,,,,2024-11-22T12:26:43,微博网页版,41,57,0,,,2024-11-22 12:26:43,True
5103331201254274	,P1oEU5gie,一个过肩摔！晚安！ ,,https://wx4.sinaimg.cn/large/6db38ceagy1hvuellbp1nj20np0vldia.jpg,,,2024-11-22T02:07:16,摸鱼邻居iPhone客户端,44,9,1,,,2024-11-22 02:07:16,True
5103306460627926	,P1o102DlQ,"我说下，那就所有产品明天我就上线了（我相信阿亮！），你们给我1天的预热时间，这1天准备期，因为我面料在产线上可能还要调整下尺码比例，你们给我留出1天的时间去调整这个事情。我23号晚上8点就开售。
其实我这种行为对平台来说是不做好的，说难听点就是TB村叛忍，相当于在说我们自己一群人拉个山头自己玩儿了，不听你大哥的了。我们店铺GMV在活动里就不会太好看。
但到时候活动参加我肯定也会参加，双12那时候的活动我不可能说完全不参加，这就太难看，毕竟我2个月他们问我参加不参加。。我也答应说参加的册那。。。
但为什么我突然脑子一热，我说我要提前点搞，因为你们今天牛仔裤的加购数给我搞的有点怕了，我出门吃了个饭阿蔡和我说这后台数据怎么回事，我一看直接就是奔着炸单去的。我想如果我12月跟着官方上线，真不够了，我再去产线上加单，你们收到都特么年底了，鼻涕都要刮成冰棍了。
现在整体到货我是12.1号开始入库开发，我每天可以亲自去盯，但有个别产品的颜色我可能要晚几天，但是也就是3天。
因为我知道12月全国气温要开始整体下降了，我肯定是保证在官方双12开始前，我就把衣服送到你们手上，就这么定了行吧。反正都自由选择，想早点穿上的，就后天来，我第一批就发到你们手上，想等的就等双12.
为什么我会提出上调微博1和2的那两个方案，原因在于这两年越来越多用户和我说她不想等了，也不想去和人哄抢，只要价格能保证也是大促给到的价格就行。",,,,,2024-11-22T00:28:58,微博网页版,55,41,0,,,2024-11-22 00:28:58,True
5103294930487333	,P1nIp22Md,"就我问你们一个问题啊，你们给我一个你们做为消费者立场最诚实的回答，阿亮说明天链接他们部门能全部干出来，晚上8点可以全部上架，那我现在有如下3种选择：
①我明天产品就上架了，然后我就把预热器缩短到1天，直接后天我就开售，要先买的人可以先买，我能做到的是我可以给你们把整体价格拉平，就是和双12基本是一样的，开上的优惠也都会给你们。活动价基础上+满300减50+多件折扣。；
这么做的好处是12月可能要大降温了，你们不用等，可以提早穿上（大概提早15天），哪怕有些我生产周期长的，你在平台双12之前其实也肯定能拿到了，但坏处是你没有办法凑单了，因为我不跟平台走了，当然我也不知道平台小er会不会找我谈话，这事儿就先不管了，找我我就再说。
②12.1，其实这个和上面差距不大，到货时间也差不多的。
③就是还是你们想参加平台活动，力度也还是活动价基础上+满300减50+多件折扣这种，但好处是你们可以各种凑（但最好别凑我的。。。）缺点是你们拿到货可能要12.15号左右了，晚半个月。
你们给我的意见行不行，我想听听大家的意思，商量着来。",,,,,2024-11-21T23:43:09,微博网页版,172,125,0,,,2024-11-21 23:43:09,True
5103292707245959	,P1nEOup0j,MD刚我问阿亮，我说你这链接到底什么时候才能好，他突然和我说：如果真的要赶，我明天8点前，可以全部完成，完成上架。MD怎么和我下午问他判若两人。。。。 ,,,,,2024-11-21T23:34:18,微博网页版,51,12,0,,,2024-11-21 23:34:18,True
5103288028761476	,P1nxgALg8,MD明天又该讲哪些产品呢。。。我这一天天过的，真的是度日如年，我靠一个牛仔裤成功拖延了3天，后面他们一个链接都没出，阿亮问我想要先出哪个。。。。MD问我先出哪个。。。我咋知道先出哪个。。。 ,,,,,2024-11-21T23:15:43,微博网页版,27,24,0,,,2024-11-21 23:15:43,True
5103279232519463	,P1nj5azqv,感谢老板对我们各种裤子的穿着反馈，但我要特地提一下法棍裤这个裤子，他有厚款和薄款的，厚款冬天是属于你头铁可以硬着头皮传一下，薄款是无论如何都穿不了的，两条腿会梆硬的，太冷了。,,,,,2024-11-21T22:40:46,微博网页版,16,13,3,,,2024-11-21 22:40:46,False,3706238797,无竹有肉君,5103267992570620	,P1n0XaMJC,"讲讲偶得几款适合冬天穿的牛仔裤：
1、最喜欢的是白色马蹄裤，讲真冬天穿白裤子太百搭提亮了，何况这条裤子这么修腿直显瘦，厚度也够，就是上一条被小猫抓毛了很可惜。
2、新入手的白色立体结构牛仔裤，本苹果表示腰腹完全不勒，还显腿直，最近爱的搭配是高领白色马甲和棕色麻花腰带，腰带一定要配！颜色同上一条冬天非常好搭配。
3、渐变色牛仔裤，夏秋很喜欢配浅色上衣穿，很有设计感，也适合配棕色麻花腰带（这条腰带震真的绝美）。不过因为腰腹比较紧，现在的气温不怎么穿了。
4、高腰刺绣喇叭牛仔裤：型很好看很显瘦显直，适合搭配短外套，但是比马蹄裤要紧且薄，现在的气温不怎么能穿了。
5、法棍裤：怎么说呢，空气一般的存在，没得穿了就揪出来穿穿，没啥好说的…
6、其他：太薄
此处@蹦蹦跳跳的阿龙 @鱼里麻里 @偶得一物",,"https://wx3.sinaimg.cn/large/dce8b74dly1hvu711m8x1j20zo2564qp.jpg,https://wx3.sinaimg.cn/large/dce8b74dly1hvu718vta0j20zo256qtr.jpg,https://wx2.sinaimg.cn/large/dce8b74dly1hvu714tvbjj20zo2561kx.jpg,https://wx3.sinaimg.cn/large/dce8b74dly1hvu713i4tyj20zo2567vz.jpg",,,2024-11-21T21:56:06,iPhone客户端,14,4,4,,"蹦蹦跳跳的阿龙,鱼里麻里,偶得一物",2024-11-21 21:56:06
5103271266229091	,P1n6eq8td,"MD卖公寓骗子骗到我这里来了，中国的这个行业是比较特殊的，全世界很多行业公寓确实是被当做为一种理财或者养老产品的，但在我们这里不行，这里面事情非常复杂，和整体税收，和土地性质有着直接关系，于是很多国内卖公寓的相处了一招，骗！
之前出过一个说法，说你买公寓，当你要二次交易的时候虽然税很高，但他好在拆迁赔偿款非常高，有3倍之多。
这个消息最早的来源是哪里呢，是一个中介拿着一个很奇怪的纸，上面写的一条规定，不懂的还以为是哪里下发的新规，但实际上这特么是假的，这就是造谣。后来一堆卖方中介就拿着这个不明来源的消息，到处说，拆1陪三。
然后人家一听，太赚了啊，你想公寓实际的卖家大概是同样居住房的50%，乃至40%，然后你拆掉居然还能陪3倍？这个属于完全0风险啊。
就你想想看，MD如果有这好事，那有钱人都不需要去做各种投资和生意，我所有自己全部抄底国内公寓就完事儿了，我也不用干海外投资了，累得要死，听起来还没有这个事情保本呢~
现在公寓的真实情况是什么呢，价格依然在下行区间中，而且很多商改住的公寓房物业费企事业不高，甚至很多都已经是民水民电了，还有通燃气了，包括以前人们担心的年限到了土地续租问题也都已经有真实落地的续租案例了，所以如果你挑选到合适的，你自助，其实是蛮好的。以前公寓是一个很暧昧不清的产品，现在这个东西的居住性确实在法律层面上得到了保护，没问题。
但目前为止，如果你被拆了，会有一定的补偿措施，但依然没有任何官方性的条例直接告诉你MD这玩意儿拆一赔三，没出过这种官方性文件啊。
你要记住，公寓这东西，你可能跑到国外看发现这玩意儿是个投资品，但在我们国家，性质是比较特殊的，他其实更像是一个消费品，很多东西你得结合国情来看，不能靠想象。不要听那些中介给你吹牛逼，说话完全不负责。",,"https://wx4.sinaimg.cn/large/6db38ceagy1hvu79r4ydej20h20atgo5.jpg,https://wx1.sinaimg.cn/large/6db38ceagy1hvu7amkqiuj20en06ddhk.jpg",,,2024-11-21T22:09:07,微博网页版,54,12,1,,,2024-11-21 22:09:07,True
5103260992276988	,P1mPF9ylC,"今年咱都还没过，年都没过完，你朋友这也太贪心了已经想着明年了。
//@冷蔷强不强:我160斤快生了的朋友买了你家正肩大衣无敌显瘦，说明年还买，明年大衣是不是还能升级",,,,,2024-11-21T21:28:17,微博网页版,7,6,0,,冷蔷强不强,2024-11-21 21:28:17,False,1840483562,蹦蹦跳跳的阿龙,5103158919431995	,P1kb1DzGX,"#偶得单品推荐# 【已开放加购】：您的神裤已经上线，请查收。
我用四个字概括这条牛仔裤，就是——骗术大师。
如果你穿一条很气派的大衣，或者是那种大件外套，但你的裤子是臃肿的，就会掉档次，你如果在早秋，你倒是还能大衣+一条比较oversize的裤子，但冬天就不太行，很怪，而且气温扛不住。
其实裤子这东西他就是这样的，他的美观度和厚度，整体来说是反比，垂坠，顺溜，干净，轻薄的裤型相对来说也会在视觉上更好看。
但冬天的牛仔裤要把裤子做厚，起到保暖效果，如果只是单纯的做厚牛仔面料，那裤身的线条就会变得僵硬，缺乏柔软感，但如果里附的绒量没把握好，又会显得臃肿。
，同时让整个裤身出现一些「不合理」的褶皱。
但最终我们还是选择了加绒的方式，因为后者在版型上会比前者相对更好处理一些，我们在多次调整后，我们的这条加绒牛仔裤诞生了。
我们虽然没法在客观的物理厚度上做到完全消除，让他真的和夏天牛仔裤一样，因为这个这个确实是不可能做到的，你毕竟里面附了绒，但在版型上，可以让他视觉上看起来非常的轻盈。
需要注意的是：我说的是视觉上的，不是物理上的，你买回家肯定不能去上称比重量，发现这套肯定要重一些，然后说我虚假宣传。
但他基本已经做到和下装牛仔裤看起来差不多了。
而即便如此，他里面依然是有空间的，因为里面也不是那种很长的绒或者那种爆炸的泰迪绒，其实是是高密度短绒，所以在实际的内部空间感上也是有保证的，如果你觉得还是冷，你里面穿一条的绒裤，实际上也OK。
这款产品一共三色，蓝，做旧复古蓝，黑色。
但我先提前提醒你们一下，其实他的黑色版本他不太像牛仔裤，因为他的手感和前面两个有点区别，他非常软，在视觉上他的风格其实是更偏向于一条西裤的。
这条裤子我必须吹，她绝对是冬季神裤。
而这款裤子我和小个子以及梨形身材的朋友要特地说一下，冬季长款牛仔裤你们可以去优先去选这款牛仔裤，也就是我们下期要上的新款牛仔裤。
这款裤子你猛一看是比较显腿长的，其实本身对于腿比较长的人来说肯定没问题，毕竟你可以看模特图，我们给模特的裤子是不会为她单独调整的，差别就是裤腰搂高两公分低两公分的问题，它和我们原本的标准直筒裤，数据上没区别。
但为什么我说小个子和梨形苹果型身材尤其要注意这个款式。
从白底图你们看这个裤型，他其实是腰臀给到了宽容度，但腰臀到裤脚这里，是有做了一个微小的内收弧线，属于微茧型窄阔腿裤的版型。
这种做法的好处是保留了直筒裤显腿直显腿长的特点外，对于个子偏低的女生比较友好，它可以让多出来的裤长比较可控的堆在鞋跟脚踝处，而不会像一般大摆裤一样因为阔，我就直接变成拖地裤。
所以哪怕裤长对你来说长了几公分，你只要别去穿拖鞋，它依然可以达到效果。
另外就是模特图上不明显，实际上我们这个款式的臀围空间，是大了一个码的，即它看上去好像臀围和我们原本的款没区别，但实际上它的内部真是空间是要更大一些的，实际内部得房率肥肠高～
所以我总结下这条裤子就是：臀围、大腿围无包裹感，舒适修饰臀腿，同时裤脚收窄，裤脚自然垂叠在鞋面，冬季穿着不拖地，实用性强。这条裤子绝对是冬季神裤！
偶得&amp;middot;水洗精梳棉加绒牛仔裤柔韧垂顺微茧型窄阔腿收胯显瘦",,"https://wx3.sinaimg.cn/large/6db38ceagy1hvu207q6l9j20u019077w.jpg,https://wx1.sinaimg.cn/large/6db38ceagy1hvu207du3wj20zf0u0afj.jpg,https://wx1.sinaimg.cn/large/6db38ceagy1hvu209rcjmj20u0190q9d.jpg,https://wx4.sinaimg.cn/large/6db38ceagy1hvtutgqn1zj20u018zwia.jpg,https://wx3.sinaimg.cn/large/6db38ceagy1hvu230y7v4j20u019077o.jpg,https://wx3.sinaimg.cn/large/6db38ceagy1hvtutgdww5j218z0u07e0.jpg,https://wx4.sinaimg.cn/large/6db38ceagy1hvu20a0uroj20u019077w.jpg,https://wx1.sinaimg.cn/large/6db38ceagy1hvu20add1bj20u0190n09.jpg,https://wx1.sinaimg.cn/large/6db38ceagy1hvu23d1dvpj20u0190dir.jpg",,,2024-11-21T14:42:41,蹦蹦跳跳的阿龙的小店,216,227,17,偶得单品推荐,,2024-11-21 14:42:41
