id,bid,正文,头条文章url,原始图片url,视频url,位置,日期,工具,点赞数,评论数,转发数,话题,@用户,完整日期,是否原创,源用户id,源用户昵称,源微博id,源微博bid,源微博正文,源微博头条文章url,源微博原始图片url,源微博视频url,源微博位置,源微博日期,源微博工具,源微博点赞数,源微博评论数,源微博转发数,源微博话题,源微博@用户,源微博完整日期
5103897173824623	,P1DnLg2Xt,摸不到，但你们直接肉眼看，能不能看出哪个好。他们的设备，工艺，都是一样的，没有任何差别，区别就是纱线。 ,,https://wx3.sinaimg.cn/large/6db38ceagy1hvw7kiyfbnj20u0140gyc.jpg,,,2024-11-23T15:36:15,摸鱼邻居iPhone客户端,66,62,2,,,2024-11-23 15:36:15,True
5103890500423405	,P1Dd01M97,这个我真没办法，你们北方有暖气啊，我们这帮可怜的南方人，我办公室空调开到26度我都感觉关节不舒服。md我真觉得南方除了广东，也应该通暖气！//@莫斯特就挺无语:我说句心里话，买到你们家第一批版型的德绒，冬天暖气房里快把我热死了。,,,,,2024-11-23T15:09:44,摸鱼邻居iPhone客户端,29,22,0,,莫斯特就挺无语,2024-11-23 15:09:44,False,1840483562,蹦蹦跳跳的阿龙,5103580623406642	,P1v9ceidQ,"【最后四款】，我上完了。
①【立裁双面呢短款夹克】女/受男
高支羊毛混纺面料，我们说的高支是真告知，我们大衣的档次各位是知道的，就是一样的大衣面料来做短款夹克的，120S，还是那句话，你如果衣柜里有同类产品，拿到手上，欢迎比对。
800g的面料克重，在毛感细腻的同时也保证里你衣型听过，两侧都是隐形口袋，正面看上去非常干净整洁，整个领口也做的非常服帖，又是拉链款的，适用性也更强。
如果你非常喜欢告急大衣的那种面料肤感，但同时又比较注重实穿，那你就选这个，没问题的。
②【斜纹立领飞行夹克】男女通穿
斜纹肌理，复古感很强，这款是男女通穿，你早春可以可以穿在T恤外面，冬天你也可以穿在卫衣外面，这款主打的就是适用性。而且这款面料的表面，是自带毛感的，你莫阿是哪个去就有点那种小动物的绒感，很温柔，会给人提供一种冬天的舒适感，是一种情绪价值。
之所谓我会推荐放在卫衣外面，实际上不光是卫衣，哪怕是羊绒衫这种，从材质上确实保暖，但外面一层他必须是这种比较抗风的夹克，否则你里面再保暖，你都是不可能留的住热量的。
热量这东西，很多东西风一吹就散了，像爱情。这件你会发现从风格上确实不如①这么精致，但主打实惠，耐造。
③「磨毛双面布收腰假两件打底衫」这是一个非常有意思的东西。
这个打底衫首先他比较怪，他虽然是假两件打底衫，但面料上就有很细节，他是双面布，外层和里层都是不一样的。
为了保暖，所以他又粘纤，为了舒适，不闷，它又有粘纤，同时它还为了袖子开口处让你们手掌触摸的时候感觉比较柔软，拼接面料用还用了莱赛尔。
这些我都理解，但他里布还加了点桑蚕丝进去，这个说实话是挺迷的。。。然后你再算上氨纶。
就这件打底用了粘纤，腈纶，莱赛尔，桑蚕丝，再算上氨纶，5种纤维混纺，透气，保暖，柔软，弹性，它全要。
就如果但看，这面料其实更适合去当春的做一件中高端的保暖内衣，但我们想去解决另一个问题，就是保暖打底衫没法拖出来的问题。
你如果纯粹穿德绒，他确实是最保暖的，但你单独拖出来非常快，这就是纯秋衣，你肯定无法在办公室单穿这一间，甚至都不想它漏出来吧。
但这件衣服可以，做成假两件，其实你猛一看，看不出这是一件保暖打底衫，你会感觉他是个正经内搭，你自己不说，别人也不知道。
适用性拉满。
但我得先提前说，如果只纯粹论保暖性，那天可能没有我们的德绒强，因为我们德绒内衣的保暖性实在太强了，本身就是保暖内衣赛道里的王中王了，所以你不可以这么去比，他比德绒更美观，那必然是牺牲点保暖性的。
但能作为一件正经的内搭，这又何尝不是一种实用呢！
④「围巾」
这个就不用我多介绍了吧，反正我们做这个主要原因是觉得市场上很多围巾哟点low，不太配得上我们的衣服，所以我们就做一条。
好了，我已经全部上齐货了！ 
偶得&amp;middot;立裁",,"https://wx2.sinaimg.cn/large/6db38ceagy1hvv6cxlf6fj20u0190q98.jpg,https://wx2.sinaimg.cn/large/6db38ceagy1hvv6cy15r4j20zf0u0tdg.jpg,https://wx1.sinaimg.cn/large/6db38ceagy1hvv6cyhl05j20u0190q62.jpg,https://wx4.sinaimg.cn/large/6db38ceagy1hvv6cyth80j20u01900y7.jpg,https://wx3.sinaimg.cn/large/6db38ceagy1hvv6cz5i2uj20u0190adh.jpg,https://wx2.sinaimg.cn/large/6db38ceagy1hvv6d0gxqkj20u0190tc8.jpg,https://wx3.sinaimg.cn/large/6db38ceagy1hvv6cx7dd9j20u0190tcq.jpg,https://wx2.sinaimg.cn/large/6db38ceagy1hvv6d1gae4j20u01907at.jpg,https://wx2.sinaimg.cn/large/6db38ceagy1hvv6d1rxowj20u019077o.jpg,https://wx3.sinaimg.cn/large/6db38ceagy1hvv78mzesqj20u00u040m.jpg,https://wx3.sinaimg.cn/large/6db38ceagy1hvv78nbic0j20u00u040n.jpg,https://wx4.sinaimg.cn/large/6db38ceagy1hvv78mnvadj20u00u0mzc.jpg,https://wx3.sinaimg.cn/large/6db38ceagy1hvv790w9qxj20u00u041p.jpg",,,2024-11-22T18:38:23,蹦蹦跳跳的阿龙的小店,69,64,3,,,2024-11-22 18:38:23
5103886849542618	,P1D76E2tc,"这件打底衫是具备了德绒保暖性。又具备了内搭功能。但要申明，他如果单论保暖性，要比我们纯徳绒的差一些//@EileenHappyEveryDay:打底衫好看
我要买",,,,,2024-11-23T14:55:13,摸鱼邻居iPhone客户端,3,2,1,,EileenHappyEveryDay,2024-11-23 14:55:13,False,1840483562,蹦蹦跳跳的阿龙,5103580623406642	,P1v9ceidQ,"【最后四款】，我上完了。
①【立裁双面呢短款夹克】女/受男
高支羊毛混纺面料，我们说的高支是真告知，我们大衣的档次各位是知道的，就是一样的大衣面料来做短款夹克的，120S，还是那句话，你如果衣柜里有同类产品，拿到手上，欢迎比对。
800g的面料克重，在毛感细腻的同时也保证里你衣型听过，两侧都是隐形口袋，正面看上去非常干净整洁，整个领口也做的非常服帖，又是拉链款的，适用性也更强。
如果你非常喜欢告急大衣的那种面料肤感，但同时又比较注重实穿，那你就选这个，没问题的。
②【斜纹立领飞行夹克】男女通穿
斜纹肌理，复古感很强，这款是男女通穿，你早春可以可以穿在T恤外面，冬天你也可以穿在卫衣外面，这款主打的就是适用性。而且这款面料的表面，是自带毛感的，你莫阿是哪个去就有点那种小动物的绒感，很温柔，会给人提供一种冬天的舒适感，是一种情绪价值。
之所谓我会推荐放在卫衣外面，实际上不光是卫衣，哪怕是羊绒衫这种，从材质上确实保暖，但外面一层他必须是这种比较抗风的夹克，否则你里面再保暖，你都是不可能留的住热量的。
热量这东西，很多东西风一吹就散了，像爱情。这件你会发现从风格上确实不如①这么精致，但主打实惠，耐造。
③「磨毛双面布收腰假两件打底衫」这是一个非常有意思的东西。
这个打底衫首先他比较怪，他虽然是假两件打底衫，但面料上就有很细节，他是双面布，外层和里层都是不一样的。
为了保暖，所以他又粘纤，为了舒适，不闷，它又有粘纤，同时它还为了袖子开口处让你们手掌触摸的时候感觉比较柔软，拼接面料用还用了莱赛尔。
这些我都理解，但他里布还加了点桑蚕丝进去，这个说实话是挺迷的。。。然后你再算上氨纶。
就这件打底用了粘纤，腈纶，莱赛尔，桑蚕丝，再算上氨纶，5种纤维混纺，透气，保暖，柔软，弹性，它全要。
就如果但看，这面料其实更适合去当春的做一件中高端的保暖内衣，但我们想去解决另一个问题，就是保暖打底衫没法拖出来的问题。
你如果纯粹穿德绒，他确实是最保暖的，但你单独拖出来非常快，这就是纯秋衣，你肯定无法在办公室单穿这一间，甚至都不想它漏出来吧。
但这件衣服可以，做成假两件，其实你猛一看，看不出这是一件保暖打底衫，你会感觉他是个正经内搭，你自己不说，别人也不知道。
适用性拉满。
但我得先提前说，如果只纯粹论保暖性，那天可能没有我们的德绒强，因为我们德绒内衣的保暖性实在太强了，本身就是保暖内衣赛道里的王中王了，所以你不可以这么去比，他比德绒更美观，那必然是牺牲点保暖性的。
但能作为一件正经的内搭，这又何尝不是一种实用呢！
④「围巾」
这个就不用我多介绍了吧，反正我们做这个主要原因是觉得市场上很多围巾哟点low，不太配得上我们的衣服，所以我们就做一条。
好了，我已经全部上齐货了！ 
偶得&amp;middot;立裁",,"https://wx2.sinaimg.cn/large/6db38ceagy1hvv6cxlf6fj20u0190q98.jpg,https://wx2.sinaimg.cn/large/6db38ceagy1hvv6cy15r4j20zf0u0tdg.jpg,https://wx1.sinaimg.cn/large/6db38ceagy1hvv6cyhl05j20u0190q62.jpg,https://wx4.sinaimg.cn/large/6db38ceagy1hvv6cyth80j20u01900y7.jpg,https://wx3.sinaimg.cn/large/6db38ceagy1hvv6cz5i2uj20u0190adh.jpg,https://wx2.sinaimg.cn/large/6db38ceagy1hvv6d0gxqkj20u0190tc8.jpg,https://wx3.sinaimg.cn/large/6db38ceagy1hvv6cx7dd9j20u0190tcq.jpg,https://wx2.sinaimg.cn/large/6db38ceagy1hvv6d1gae4j20u01907at.jpg,https://wx2.sinaimg.cn/large/6db38ceagy1hvv6d1rxowj20u019077o.jpg,https://wx3.sinaimg.cn/large/6db38ceagy1hvv78mzesqj20u00u040m.jpg,https://wx3.sinaimg.cn/large/6db38ceagy1hvv78nbic0j20u00u040n.jpg,https://wx4.sinaimg.cn/large/6db38ceagy1hvv78mnvadj20u00u0mzc.jpg,https://wx3.sinaimg.cn/large/6db38ceagy1hvv790w9qxj20u00u041p.jpg",,,2024-11-22T18:38:23,蹦蹦跳跳的阿龙的小店,69,64,3,,,2024-11-22 18:38:23
5103881355005396	,P1CYfl08c,"【双12上新】所有产品已上新，今晚8点开售。满300减50+多件折扣。
首批12/2号开始发货。
 
偶得·立领精梳棉夹克
 ",,"https://wx2.sinaimg.cn/large/6db38ceagy1hvw5k7rb68j20u019077o.jpg,https://wx1.sinaimg.cn/large/6db38ceagy1hvw5k8451mj20u0190n0r.jpg,https://wx2.sinaimg.cn/large/6db38ceagy1hvw5k8gatoj20u0190tc8.jpg,https://wx3.sinaimg.cn/large/6db38ceagy1hvw5k8tehhj20u0190q62.jpg,https://wx3.sinaimg.cn/large/6db38ceagy1hvw5le382kj20u01907at.jpg,https://wx4.sinaimg.cn/large/6db38ceagy1hvw5k96m40j20u01900y7.jpg,https://wx4.sinaimg.cn/large/6db38ceagy1hvw5k7faemj20u0190wif.jpg,https://wx4.sinaimg.cn/large/6db38ceagy1hvw5k9kb7bj20u0190tcd.jpg,https://wx2.sinaimg.cn/large/6db38ceagy1hvw5k9vd8hj20u0190adq.jpg,https://wx4.sinaimg.cn/large/6db38ceagy1hvw5micq27j20u00u0n0h.jpg,https://wx3.sinaimg.cn/large/6db38ceagy1hvw5mi1l7uj20u00u040m.jpg,https://wx3.sinaimg.cn/large/6db38ceagy1hvw5miv1j7j20u00u0n03.jpg",,,2024-11-23T14:33:23,蹦蹦跳跳的阿龙的小店,50,76,4,,,2024-11-23 14:33:23,True
5103868125907872	,P1CCUoMUg,"每次上男装，总是有人说让我做模特，以后别再说这种傻话了，笑死。
但凡我能穿好看的衣服，对绝大多数男的就是灾难。我身高169，体重90kg，胸围108，腰围等同，臂围43，我的体格，对90%的男性毫无参考性，我有个朋友185，体重85KG，我和他其实是相同的衣服尺码。
只有一种和我类似，就是他也是易胖体质，同时还坚持固定力量训练，最终也变成我这种非常厚实的脂包肌。
但一般来讲，就我们这种石墩子体格又不需要什么参考，因为穿上去啥样我们自己都能想象。我这种，如果喜欢宽松，那我就胸围买大一些的，舒服，那如果想要骚一点的，我就会故意穿一些胸围偏小点，但他有担心的那种，这样就会胸大肌很明显，感觉人很精神，缺点就是我会激凸，看着会很明显。",,,,,2024-11-23T13:40:49,微博网页版,104,32,1,,,2024-11-23 13:40:49,True
5103862421652176	,P1CtI6VO0,"有些呆瓜真的是，我特么好心是真的被你们当驴肝肺，最后我还要倒打一把，说我煽动你们。我是真好心告诉你们业内情况，然后你们还要背后蛐蛐我册那。
这是我昨天出的绒，昨天我出掉200KG，下星期还预定了300KG，我出货价格是1150G（不含损耗）。几天前我第一批是1200，然后蔡去把这500KG出了，回点钱，我这价格立刻人家就要了，友情价。
现在出，是1350G现货，1G约等于1.3元。
我们按照200g的羽绒服来算，成本为260元，算上5%损耗，差不多在280元左右。
然后还需要什么呢，这个羽绒服还需要，胆布，里布，面料，拉链纽扣等配件，我算你150，行不，430。这些东西你肯定要做把，总不能你自己做把？
把如果是我们那种做的比较好的，150~200，当然工费便宜的25一件都有。昨天我直播还说过，我朋友是干80块钱羽绒服的，但我这种干不了，我只能按照我们的标准来干（也包含充绒费），差不多600左右吧。
所以600，就是这件羽绒服的裸出厂价，我都不用去做任何解释，这位朋友呢您说的399是能坐下来的，请问怎么坐下来呢，我说这东西一定是假的，你觉得我危言耸听，是在煽动消费者。就连优衣库这种质量，都说性价比高的，鸭绒长款都要1000了。
而且我还要告诉你的是，前面这些我其实还是少算了。因为实际上好一些的羽绒服，这个价格还是做不下来，因为用的面料我现在全部是按照偏低价来算的，好的会贵一大截。
但到这里还没有结束，你的包装，运输，水电，场地，税，工资，以及售后，售后就先不算吧。光前期这些东西，至少25%。你前期货约好，后期配套产生的成本也一定越高，这是肯定。此时此刻都已经接近千元了。还有退换货率。
那如果你说就干鸭绒，这位朋友说成本200，这哥他是说的对的，没问题，因为一般你用鸭绒来做了，你其他面辅料，工艺各方面都会降品质，因为没必要做的很高级。
但你要正规干，MD卖你五六百都是良心价了，因为上述成本还是少不了，都会相应降低，但因为服装这东西售后量太大，退换货率高。实际上你综合成本这件衣服也得300，卖399，200g，行，你要相信做慈善，那就是真的做慈善，还做的是产品当季的慈善。
但如果你选择这种鸭绒，你都别买动物绒了，至于为什么，昨天我也说过了，因为特么没必要，保暖性不会比目前人工纤维好多少，还更不好打理。
当然如果你让我极限价，以降低成本为目的我去给你搞，我确实也有办法坐下来，别说200了，那是真客气了，我150都能给你干下来。
服装这东西，你只要敢说成本，都能想办法搞出来。10块钱成本的T也不照样干。
所以有时候我就会觉得很莫名其妙，我给你好说歹说，我是掏心掏肺在给你讲，你他妈愿意相信给你卖399开团购的，但不愿意相信把绒公开在线上出货的我，到底是谁信息更透明，谁更不会撒谎，谁对你们更愿意说实话？
还「我觉得不一定~~，我相信xxxx，我认识xxxx。」
就像我上个月有个人评论里和我说她不认为300块买不到高档大衣，她给我讲了个谁，我不认识，说含羊绒的，她还之前也一千多就买到过羊绒大衣，我给她讲，给她算成本，最后还来一句：我觉得你有时候说话还是太武断了。
这你让我怎么说，这个我就没法说了。其实我从做生意的角度，说的再直白点，有些人压根就不是我们品牌的目标群体的，就像你相信一千块买羊绒大衣，你也说做得下来，但我告诉你这衣服的价格都不够我衣服的1米面料，压根就谈不拢。我确实知道，如果你让我干，我也有办法做出一千块的羊绒大衣，但这里面套路太多了，我没时间给你讲台深的东西，而且我也不太可能把你转化成我的用户，我费老大劲骗你我图啥呢。",,"https://wx4.sinaimg.cn/large/6db38ceagy1hvw2duchq9j20if09gq5p.jpg,https://wx2.sinaimg.cn/large/6db38ceagy1hvw36s7zhnj20v30ufwks.jpg",,,2024-11-23T13:18:09,微博网页版,80,45,1,,,2024-11-23 13:18:09,True
5103602336796143	,P1vIdsvZd,"注：加绒牛仔裤男生不可以穿，但这条裤子烧男也可穿。 
偶得·色织花呢感格纹阔腿裤磨毛绒感单褶垂顺舒适半松紧长裤
 ",,"https://wx1.sinaimg.cn/large/6db38ceagy1hvv9qb4qfrj23ya5xckjn.jpg,https://wx3.sinaimg.cn/large/6db38ceagy1hvv9q6de5nj23ya5xc4qs.jpg,https://wx2.sinaimg.cn/large/6db38ceagy1hvv9qi4khaj212w12wwgj.jpg",,,2024-11-22T20:04:40,蹦蹦跳跳的阿龙的小店,17,21,0,,,2024-11-22 20:04:40,True
5103589628578469	,P1vnIzZEp,所谓的冬日保暖性价比服装，肯定随便洗啊。这波产品就是有品质，实用，好打理//@风起梦随:尤，真诚发问，盼回：这个棉服和马甲可以扔洗衣机N次随便蹂躏吗,,,,,2024-11-22T19:14:10,摸鱼邻居iPhone客户端,7,15,0,,风起梦随,2024-11-22 19:14:10,False,1840483562,蹦蹦跳跳的阿龙,5103539850577507	,P1u5r2qeD,"我没有划水，我没有偷懒，我再上三款！三款性价比产品！尤其是后两款，请耐心阅读。
①【重磅加绒卫衣】：在冬天，到底什么才是重磅卫衣。
说到卫衣这个品类，很多人都会说用到一个词「重磅面料」，实际上冬天的重磅和其他季节的重磅是不一样的。
在春夏秋这种，三百多克确实算是重磅面料了，但你在冬天，你要说自己这是重磅面料，就是有点勉强了。对于一件冬季外套来讲，要厚实，要有骨感，那可能至少得选用接近400克重的面料。
我们这款卫衣使用了55%精梳棉混纺面料，高支高密，手感非常细密柔软，绝不是那种很糙的玩意儿，关键面料520克重，而且内附一层保暖银狐绒，宛如一个移动暖炉。
前领附带两颗四合扣可以，你在室内可以直接解开，很放松，你到了室外如果风大，你也可以扣上，给你提供更多防风保护。
而且这这三个颜色都很好看。
所以你也别问我买哪个颜色，我真的不知道，不是懒，不想推荐，如果你非得问，我只能说点套话了，我觉得耐脏选灰色，精致肯定优先浅米，浅柚黄又比较年轻~你们具体怎么选还是得看具体。
如果你确实没有上羊绒衫的预算，没关系，那我们实惠点，给自己至少来一件，甚至两件，高品质且保暖的卫衣。
衣服不一定要穿的昂贵，但要穿的体面与舒适。
②【三防棉服/马夹】
众所周知，今年羽绒服是真的变成了奢侈品，因为这两年绒的价格一直在持续走高，已经到了离谱的程度，那冬天保暖，除了羽绒服，还有什么平替呢？
很多人的答案是鸭绒。我可以很负责的说，鸭绒绝不是羽绒服的平替，我们只在第一年做过鸭绒，后面就再也没有做过了，因为我们发现鸭绒的一些问题。
如果你要蓬松度很牛逼的鸭绒，那你基本就不如买鹅绒了，便宜的鸭绒四五百，但如果你要很好的那种也得干到一千了，我不如加几百，干个鹅绒。我以后真要选鸭绒，我肯定也是干那种很高端的鸭绒了，但特么那种也贵，会比鹅绒便宜一些，但不会太多。
那你可能会问为什么我便宜的鸭绒不行呢，鸭绒似乎是一种很好的解决方案，比如价格便宜一大截，但保暖性只是差一些而已。这个确实，很多人都会说鹅绒要比鸭绒保暖很多，其实没有很多，可能也就10%~20%左右了，而且很多鹅绒服充绒薄的要死，还虚标克数，贼黑。
但有一点是没有办法的，就是绒的清洁度问题。比如我们使用的新国标白鹅绒，清洁度都是1000的，肥肠纯净，他最大的好处是没有异味，后续也不容易产生异味，但鸭绒大多数都是达不到的，他就有可能产生异味的风险。
那既然这样，我认为羽绒服的平替，并不是把鹅绒换成鸭绒，虽然你便宜点，但你缺点多，与其如此，不如实际点，那就选羽丝绒。
关于这个问题我其实之前也科普过，保暖是有很多方案的，顶配是奢侈品方案，那自然是白鹅绒，但最优秀的评价方案，是聚酯纤维，只不过是新型聚酯纤维罢了。
他模仿了绒的形态，不是你们平时理解力的那种面料，而是一种新形态的纤维，你可以理解为给他做拉丝起球处理，然后让他形成绒的形态，从而达到保暖效果。同时配合三防面料，防污防风放水，使其适用性更强。
关键是绝对不会有任何异味，清洁度高，纯净，而且好打理，你套袋机洗就好。
所以我从我专业角度来说，或许这才是真正的平替。 
偶得&amp;middot;520G",,"https://wx3.sinaimg.cn/large/6db38ceagy1hvv0vbeoedj23ya5xcb2b.jpg,https://wx3.sinaimg.cn/large/6db38ceagy1hvv0wcq9bcj23ya5xchdx.jpg,https://wx3.sinaimg.cn/large/6db38ceagy1hvv0xqmfoej23ya5xc4qr.jpg,https://wx1.sinaimg.cn/large/6db38ceagy1hvv0usvmluj23ya5xcqv6.jpg,https://wx4.sinaimg.cn/large/6db38ceagy1hvv0vz17n1j23ya5xcnph.jpg,https://wx1.sinaimg.cn/large/6db38ceagy1hvv0v2mvmrj23ya5xckjn.jpg,https://wx1.sinaimg.cn/large/6db38ceagy1hvv0y6w3jbj23ya5xc1l0.jpg,https://wx4.sinaimg.cn/large/6db38ceagy1hvv0xch4g2j23ya5xc7wj.jpg,https://wx4.sinaimg.cn/large/6db38ceagy1hvv0wqpcrvj23ya5xc4qs.jpg,https://wx2.sinaimg.cn/large/6db38ceagy1hvv2kfehhfj2104104dit.jpg,https://wx3.sinaimg.cn/large/6db38ceagy1hvv2kg2og9j212w12wq51.jpg,https://wx2.sinaimg.cn/large/6db38ceagy1hvv2kepg3aj212w12w0uu.jpg",,,2024-11-22T15:56:22,蹦蹦跳跳的阿龙的小店,69,67,7,,,2024-11-22 15:56:22
