id,bid,正文,头条文章url,原始图片url,视频url,位置,日期,工具,点赞数,评论数,转发数,话题,@用户,完整日期,是否原创,源用户id,源用户昵称,源微博id,源微博bid,源微博正文,源微博头条文章url,源微博原始图片url,源微博视频url,源微博位置,源微博日期,源微博工具,源微博点赞数,源微博评论数,源微博转发数,源微博话题,源微博@用户,源微博完整日期
5106142994760560	,P2zO3jYre,汤唯老公的气质看起来像那种你期末考试后给他写个邮件求情就能默默让你不挂科的内向教授。 ,,,,,2024-11-29T20:20:20,iPhone 13,183,14,1,,,2024-11-29 20:20:20,True
5106113099862050	,P2z1PFnzk,打底衣可以看看,,,,,2024-11-29T18:21:33,iPhone 13,5,8,0,,,2024-11-29 18:21:33,False,6292040160,果冻出走,5102515601279207	,P13rq5mMn,"淘宝那些模特穿冬装为什么这么好看，因为很多都是里面很少的打底直接套的外套。
很多衣服一旦里面感觉有厚度了就显胖，臃肿，不好看。所以打底衣除了舒服，关键是要薄跟贴，套衣服才好看。
这个牌子S家的打底衣就符合，很贴，穿衣服好看。 
相比其他牌子厚度更薄，他家这个叫“面膜衣”，意思也是贴在身上的意思。确实也是贴在身上，你穿上不会有任何鼓包或者凸起，是有包裹感但是不紧绷的感觉。我试过在这件外面再套那种稍微紧身的毛衣，完全看不出来，你穿上这个也不会觉得毛衣很扎。
天气干燥的话这种衣物很容易有静电，这款有添加保湿因子，不会有静电的困扰。
设计是大圆领，不会露出来，弹力也大，可以随便撑。而且比较神奇的是这件虽然薄但是密度挺好，所以上身聚气，不会冷。
好配衣服，不冷，舒服，这几个条件能混一起就已经挺好了。我个人觉得这款适合南方过冬，适合配在“温度需要打底但是造型不太能接受打底”的穿搭情况下，冬天也想穿衣服有淘宝那种清爽效果的都可以试试。价格也不贵。",,"https://wx3.sinaimg.cn/large/006ROL4Igy1hvrswt5tytj30sg0p0q7k.jpg,https://wx1.sinaimg.cn/large/006ROL4Igy1hvrswypvroj31ib20fnpd.jpg,https://wx2.sinaimg.cn/large/006ROL4Igy1hvrswx7yjzj31o0280npd.jpg,https://wx2.sinaimg.cn/large/006ROL4Igy1hvrswuxr7ej31o0280kjl.jpg,https://wx3.sinaimg.cn/large/006ROL4Igy1hvrswz8qt1j30zj1ben4z.jpg,https://wx1.sinaimg.cn/large/006ROL4Igy1hvrsx18lb7j31o0280hdt.jpg",,,2024-11-19T20:06:22,iPhone 13,121,49,6,,,2024-11-19 20:06:22
5106102110783372	,P2yK73hN2,"肿泡眼也可以很可爱
//@大吉大利抽油烟机:宝宝
//@Tiger公子:太可爱了！//@黄濑濑濑濑:赏味期的奶比
//@欲摘飞星归故里:转发微博",,,,,2024-11-29T17:37:52,iPhone 13,224,1,206,,"大吉大利抽油烟机,Tiger公子,黄濑濑濑濑,欲摘飞星归故里",2024-11-29 17:37:52,False,6011622055,SeanJohn-,5105611997973723	,P2lZBxskr,"原来动画片都是真的：
 ",,"https://wx1.sinaimg.cn/large/006yQ9w3gy1hw1ojldt0ij316o1kwwv2.jpg,https://wx3.sinaimg.cn/large/006yQ9w3gy1hw1ojlu8rxj30yi0xsju3.jpg",,,2024-11-28T09:10:21,iPhone 13,3395,84,730,,,2024-11-28 09:10:21
5106054952912321	,P2xw3cdCV,第一眼看到图四我以为真在说追星，在思考我女儿以后会不会学我辱追……,,,,,2024-11-29T14:30:29,iPhone 13,259,33,3,,,2024-11-29 14:30:29,False,7335979459,黄腿肠,5106052630580906	,P2xsj2r7s,"#这都是我从妈妈身上学到的# 
还是那句话，铁梅能不能当我妈？
我对自己的妈妈印象不深刻（没有共同生活过这里不展开叙述）但铁梅这个角色真是我这么多年来看剧看电影最喜欢的妈妈了！
我喜欢她在柜子外面鼓励小孩勇敢的走或不走出来，我喜欢她会在乎小孩的感受让小孩得到爱的滋养，我喜欢她坚持调查记者的初心哪怕改行后也在坚持写自己想写的东西，我喜欢她正直勇敢有阅读量，我喜欢她对小叶的指引和帮助，我喜欢她是一个很酷很潇洒很会偷情的妈！（虽然铁梅不是偷情哈哈哈哈她已经离婚了！）
邵艺辉导演说：“任何一代人都是如此，先去模仿生活，再去生活。如果是创作者的话，你最好可以创造新的生活供别人模仿。”
那我想模仿铁梅的生活，铁梅的态度。我喜欢这样的女性角色，喜欢她建立的游戏规则。铁梅会成为很多人的精神妈妈，我们需要这样的“妈妈”。",,"https://wx2.sinaimg.cn/large/0080t1nlly1hw3c2pq9rfj30wr0otq7d.jpg,https://wx3.sinaimg.cn/large/0080t1nlly1hw3c2pdn8kj30wr0twafk.jpg,https://wx4.sinaimg.cn/large/0080t1nlly1hw3c2o843hj30wr1fsakl.jpg,https://wx2.sinaimg.cn/large/0080t1nlly1hw3c2n0uycj30wr0rmn2p.jpg,https://wx4.sinaimg.cn/large/0080t1nlly1hw3c2nlxxwj30wr179dnq.jpg,https://wx3.sinaimg.cn/large/0080t1nlly1hw3c2otryfj30wr16ntg4.jpg",,,2024-11-29T14:21:16,iPhone客户端,264,16,37,这都是我从妈妈身上学到的,,2024-11-29 14:21:16
5106031095186098	,P2wTzlL8K,看起来最浪的亚比跟rapper是最喜欢结婚的，不结婚的都是打扮板正自以为很帅的各年龄段雨盛大爷们。//@瞬間粘合劑:他看着像一辈子不会结婚的人,,,,,2024-11-29T12:55:41,iPhone 13,542,25,64,,瞬間粘合劑,2024-11-29 12:55:41,False,6727966240,一支小暗暗,5106020640625193	,P2wCI2CDL,"【新闻】乐队Hyukoh队长吴赫将于下个月结婚
据29日采访，吴赫决定下个月在首尔某处举行婚礼，目前正在筹备中。经纪公司相关人士说: “结婚是真的，计划只邀请家人和熟人一起进行。”#吴赫结婚# #吴赫宣布结婚# ",,https://wx3.sinaimg.cn/large/007ljRmwly1hw2zh0yralj30u016t18c.jpg,,,2024-11-29T12:14:09,,290,27,245,"吴赫结婚,吴赫宣布结婚",,2024-11-29 12:14:09
5105839952630204	,P2rVhb2eE,#这就是职场# ,,https://wx4.sinaimg.cn/large/006ROL4Igy1hw2eq4pcb5j30wi0qrwl0.jpg,,,2024-11-29T00:16:09,iPhone 13,951,27,29,这就是职场,,2024-11-29 00:16:09,True
5105789520577652	,P2qBW2qgY,改成Newest Jeans，气死原公司。,,,,,2024-11-28T20:55:44,iPhone 13,1731,96,47,,,2024-11-28 20:55:44,False,1939307525,草莓牛奶味的Haru,5105771029202830	,P2q86CC4K,"#Newjeans宣布解约#短时间可能无法使用NewJeans的名字，但是不会放弃努力拿回NewJeans的商标权。既定的行程会完成，可能的话想跟闵熙珍一起继续工作。因为是ADOR和HYBE违反了合约才导致了合约的解除，成员认为日后的活动不会因此受到阻碍。 
草莓牛奶味的Haru的微博视频
 ",,,"https://f.video.weibocdn.com/o0/ZY7ezasllx08jWIEhkkM010412009iJz0E010.mp4?label=mp4_720p&template=1276x720.25.0&ori=0&ps=1Cx9YB1mmR49jS&Expires=1732887862&ssig=cUjNs7W1lF&KID=unistore,video",,2024-11-28T19:42:16,微博视频号,29042,1097,2385,Newjeans宣布解约,,2024-11-28 19:42:16
5105752442407016	,P2pE8a6aQ,"在我眼里世上最有原则的人——我朋友：
看中了一个款式，就算再好看，只要没有了她喜欢的色/适合的码，她一定不会妥协买同款的其他颜色跟码数。 ",,,,,2024-11-28T18:28:25,iPhone 13,970,55,65,,,2024-11-28 18:28:25,True
5105727442257547	,P2oZO9ti3,"恭喜@hiu_uuo 1名用户等额平分【100元现金】。微博官方唯一抽奖工具@微博抽奖平台 对本次抽奖进行监督，结果公正有效。公示链接：
网页链接",,,,,2024-11-28T16:49:05,微博抽奖平台,0,2,0,,"hiu_uuo,微博抽奖平台",2024-11-28 16:49:05,False,6292040160,果冻出走,5093462592461367	,ODdo7akjt,"这个牌子我说两件事。
之前头皮发痒，疯狂掉头皮屑。就是这个牌子。域发的白柳皮跟款冬两个给我搞好的，当时买的还比现在网上贵很多。
如果现在还有人有很严重的头屑问题跟头皮问题，我还是推荐这个。款冬是止痒去屑的，白柳皮是控油的。
不过今天说的不是前面这俩，是他们家的这个防脱滋养跟防脱固发系列。一个洗发水一个精华液，对脱发跟那种那种小碎发跟毛囊的生发作用蛮好的。
如果用米诺怕狂脱期跟长痘的可以换这两个搭配试试。这个没有那么刺激，对毛囊刺激很少，有点养护毛囊+头皮抗老+生发激活促进循环的这种配套。头发边的那种碎毛，发缝还有那种平常掉的断发碎发，都有再生刺激作用。
域发防脱洗发水+防脱固发精华液可以做一个搭配使用，洗发水你就日常使用，长期的帮助减弱掉发问题，再搭配防脱精华液，它是自带按摩头的，用起来非常的方便，温和生发还没不怕狂脱。
两个产品搭配起来用一段时间，掉发减少很明显，鬓角和发际线也有小碎毛出来。
洗感这个牌子都是好的，香味也不错，这种风评都不用多说主要是效果，像这种有医学背景研究出来的牌子，医院医生又开，还有专门的防脱特证，风评搜搜用过都知道。#域发植优研防脱洗发水 #域发防脱洗发水+#防脱#脱发#防脱洗发水#生发精华 
抽奖详情",,"https://wx1.sinaimg.cn/large/006ROL4Igy1huyx6a38iij31b31qsauy.jpg,https://wx3.sinaimg.cn/large/006ROL4Igy1huyx68wpaoj31gi1y0nlh.jpg,https://wx4.sinaimg.cn/large/006ROL4Igy1huyx6au4j1j31bo1nqavm.jpg,https://wx2.sinaimg.cn/large/006ROL4Igy1huyx6bs1shj31lk24qh9v.jpg,https://wx3.sinaimg.cn/large/006ROL4Igy1huyx6db5oyj310h0qfwlb.jpg,https://wx4.sinaimg.cn/large/006ROL4Igy1huyx6dv0hpj31bm1bmarx.jpg",,,2024-10-25T20:32:57,iPhone 13,39,97,3,"防脱,防脱洗发水",,2024-10-25 20:32:57
5105720921690643	,P2oPi75Or,"恭喜@loseonion 1名用户等额平分【100元现金】。微博官方唯一抽奖工具@微博抽奖平台 对本次抽奖进行监督，结果公正有效。公示链接：
网页链接",,,,,2024-11-28T16:23:10,微博抽奖平台,0,0,0,,"loseonion,微博抽奖平台",2024-11-28 16:23:10,False,6292040160,果冻出走,5093099477141983	,OD3WrtXXh,"今年开始流行的“气血感”，比如图一这种状态，是只靠化妆跟Y美无法单纯达到的。这种必须要内补。
而补气血最重要的就是“补铁”。
日常饮食如果要真的足量补铁是很难的，更别说女生一个月还要来一次姨妈，稍微不注意饮食加上节食控制体重就很容易贫血；另外爱喝咖啡也容易铁流失。如果要吃够足量的铁可能要搞几斤红枣枸杞，两三斤牛肉猪肉或者是疯狂弄猪肝鸭血吃，杂七杂八搭配也不够。
很多人发现自己面色蜡黄，整天提不起劲没力气，容易头晕目眩的，还真可能不是其他原因，单纯打光电或者是抹美白产品没用的，还不如内调补铁。
于是后来我就开始每天认真补铁，从半年前开始，补上铁之后感觉真的太好了！感觉被修复了人体的精气神，气血一上来整个人都暖暖的，专注力变强，干事儿不累，说话底气足，手脚冰凉大大改善，姨妈也规律了很多！感觉整个人都有力量了。
我在吃的是SiderAL的两款补铁产品，意大利销量top。市面上都是2价铁，他这个是3价铁。它采用了Sucrosomial®铁技术，这种技术可以提高铁的吸收率，达到其他产品的12倍，见效快。
胶囊款普通人吃就够，经典，每粒含铁30mg，普通人吃足够了。这种胶囊个不大，一下子就吞下去了，没铁锈味，对肠胃温和不刺激，也不会有其他太多反应。平时放家里，放包包带去办公室都很方便。
还有一款更升级点，是叶酸补铁粉剂，里面除了30毫克铁还有Quatrefolic®活性叶酸（第四代活性叶酸）吸收率是其他主流叶酸的10倍；加上四种复合维生素—VC+D3+B6+B12，都是可以更好地促进铁的吸收，补铁快。是孕妈妈都可以吃的哦。
一些平常毛病比较多的，姨妈量少的，贫血严重加上维生素跟其他补充不足的吃这个更安心，备孕的姐妹也可以吃这个，里面有叶酸。不过叶酸也不单是为了怀孕啥的，平常本身也保护心脑，对女生有好处。这个入口即化是酸甜橙子味的，没什么难咽的感觉。我自己更喜欢吃粉剂多一些。
补铁需要保持3-6月周期，才能看到脸色的变化效果。平常家里人有贫血严重，面色蜡黄的也可以试着吃吃看，很有效果。特别是爱喝咖啡、奶茶的小姐姐们，更容易铁流失，要定期注意补铁哦。
有需要的朋友可以看看平论区哦~",,"https://wx2.sinaimg.cn/large/008zIg5Dly8huxh4qvvtpj30mv0sf772.jpg,https://wx3.sinaimg.cn/large/008zIg5Dly8huxgyi0z1zj32ak1pxhdu.jpg,https://wx1.sinaimg.cn/large/008zIg5Dly8huxgygpdi2j31c01s04q8.jpg,https://wx2.sinaimg.cn/large/008zIg5Dly8huxgyhzqmhj31id1zphdt.jpg,https://wx2.sinaimg.cn/large/008zIg5Dly8huxgyhhyulj32y93xpe82.jpg,https://wx2.sinaimg.cn/large/008zIg5Dly8huxgygh71rj30zt0qngrh.jpg,https://wx4.sinaimg.cn/large/008zIg5Dly8huxgyhum31j31o0280npd.jpg",,,2024-10-24T20:30:03,微博  weibo.com,45,37,7,,,2024-10-24 20:30:03
5105720683659918	,P2oOUfm6W,"恭喜@厚乳泡芙 1名用户等额平分【100元现金】。微博官方唯一抽奖工具@微博抽奖平台 对本次抽奖进行监督，结果公正有效。公示链接：
网页链接",,,,,2024-11-28T16:22:13,微博抽奖平台,0,2,0,,"厚乳泡芙,微博抽奖平台",2024-11-28 16:22:13,False,6292040160,果冻出走,5099657427163165	,OFOxMu3sV,"捞一下图二这个内衣，冬天穿紧身毛衣里面穿这个好看，露肩也可以。
网页链接
顺便bm这件Colette Striped Sweater是好看的，但是没收腰。穿了感觉有点漏风。  
抽奖详情
 ",,"https://wx1.sinaimg.cn/large/006ROL4Igy1hviok2w27jj31jk1g9ngm.jpg,https://wx1.sinaimg.cn/large/006ROL4Igy1hviomigj1gj31qi334u0y.jpg",,,2024-11-11T22:49:00,iPhone 13,129,28,4,,,2024-11-11 22:49:00
5105703735789162	,P2onzoi1A,已经工作快10年了，还是会被同业对接的人气到来厕所哭。 ,,https://wx2.sinaimg.cn/large/006ROL4Igy1hw1z34geoog30qo0fkkjn.gif,,,2024-11-28T15:14:52,iPhone 13,863,88,9,,,2024-11-28 15:14:52,True
5105653116833293	,P2n3VsFEp,"哈哈哈哈哈哈哈哈哈好//@做报告的实录君:还是个二次元
 
评论配图",,,,,2024-11-28T11:53:44,iPhone 13,219,11,112,,做报告的实录君,2024-11-28 11:53:44,False,6563826743,名场面All,5105350740544102	,P2fce2hxQ,这喷不了 这真是专业团队 ,,"https://wx4.sinaimg.cn/large/007ad9bhly1hw0ujhpvvpj30wr1bl14u.jpg,https://wx4.sinaimg.cn/large/007ad9bhly1hw0ujid0ycj30wr1he7kh.jpg,https://wx1.sinaimg.cn/large/007ad9bhly1hw0ujj4cv8j30wr1eldvj.jpg,https://wx1.sinaimg.cn/large/007ad9bhly1hw0ujjq3k5j30wr1cstkc.jpg,https://wx4.sinaimg.cn/large/007ad9bhly1hw0ujkpd5kj30wr1eo7o0.jpg,https://wx1.sinaimg.cn/large/007ad9bhly1hw0ujltzutj30wr1eowve.jpg,https://wx4.sinaimg.cn/large/007ad9bhly1hw0ujgxq0sj30wr1katmx.jpg,https://wx1.sinaimg.cn/large/007ad9bhly1hw0ujn5stdj30wr1du492.jpg,https://wx1.sinaimg.cn/large/007ad9bhly1hw0ujnp7nuj30s90v6q77.jpg",,,2024-11-27T15:52:12,,36886,643,5407,,,2024-11-27 15:52:12
5105650684395666	,P2n00irvQ,"像话吗 
查看图片",,,,,2024-11-28T11:44:03,iPhone 13,203,66,1,,,2024-11-28 11:44:03,False,6292040160,果冻出走,5105649094493456	,P2mXriQX6,"想买勃肯鞋，寻思跟太高容易崴，头太方脚趾太空。
最后挑了一双平跟软头的毛拖，收到货之后：我外婆的棉拖孩。 ",,,,,2024-11-28T11:37:45,iPhone 13,65,31,2,,,2024-11-28 11:37:45
5105649094493456	,P2mXriQX6,"想买勃肯鞋，寻思跟太高容易崴，头太方脚趾太空。
最后挑了一双平跟软头的毛拖，收到货之后：我外婆的棉拖孩。 ",,,,,2024-11-28T11:37:45,iPhone 13,65,31,2,,,2024-11-28 11:37:45,True
5105462971996506	,P2i7f8nnI,"艾特印象笔记这两个人这辈子也就这样了 
查看图片",,,,,2024-11-27T23:18:10,iPhone 13,77,7,1,,,2024-11-27 23:18:10,False,1688961534,Yibei__,5105457506814363	,P2hYqsAJ5,石康老师的微博有点像养胃猛吃药被毒死前产生的幻想 ,,,,,2024-11-27T22:56:27,iPhone客户端,34,8,2,,,2024-11-27 22:56:27
5105437177547819	,P2hrDvFx1,店主，韩女看到连夜坐飞机都要赶到广州来骂你。 ,,https://wx3.sinaimg.cn/large/006ROL4Igy1hw14g6hi6yj30wi1axamz.jpg,,,2024-11-27T21:35:40,iPhone 13,1706,39,11,,,2024-11-27 21:35:40,True
5105409720847370	,P2gJm3yrg,"我爸妈昨天破天荒说要给我打视频，扯了一个多小时最后才进入正题。
是上次我给他们淘宝买的零食吃完了，想让我再给买点。 ",,,,,2024-11-27T19:46:34,iPhone 13,372,49,0,,,2024-11-27 19:46:34,True
5105406355703131	,P2gDVnVDZ,这就是说话的诡异之处了。经常请不一样的保洁说明就是叫那种最普通的钟点工，50块钱一个小时一次2小时可能一个月就请个一两次，还领券换平台搞特价那种。这说明他家没什么长期能打扫卫生的人，保姆这事自然存疑。,,,,,2024-11-27T19:33:11,iPhone 13,1287,53,11,,,2024-11-27 19:33:11,False,6606804649,番茄不是西红柿首富,5105316331262473	,P2eiJ5iqt,"#李行亮说家里卫生请保洁# 
破案了！麦琳真的不怎么做家务！李行亮无意说出了他们在家的真实情况：他们经常请保洁，经常换不同的保洁！难怪麦琳想立「贤妻」的人设，却连个行李箱都不太怎么收拾😅#再见爱人#  #再见爱人4微博观察团#﻿ 
番茄不是西红柿首富的微博视频
 ",,,"https://f.video.weibocdn.com/o0/8tHppHnHlx08jV4FViZy01041200rbEp0E010.mp4?label=mp4_720p&template=1280x720.25.0&ori=0&ps=1CwnkDw1GXwCQx&Expires=1732887889&ssig=2SfAU2jEQI&KID=unistore,video",,2024-11-27T13:35:28,微博视频号,29163,2094,354,"李行亮说家里卫生请保洁,再见爱人,再见爱人4微博观察团",,2024-11-27 13:35:28
5105299248387154	,P2dRazbSG,有多少男的在偷偷装作喜欢《好东西》啊，跟着说好电影的前夫现在有千千万。 ,,,,,2024-11-27T12:27:35,iPhone 13,2812,51,31,,,2024-11-27 12:27:35,True
5105296078803260	,P2dM3AW84,其他的没啥我只提一点，下一季再让我看到再见爱人节目请黄执中这个小斗鸡眼啤酒肚给他通告费让他在网络上随便阴女嘉宾，我彻底对节目粉转黑。@再见爱人官微,,,,,2024-11-27T12:15:00,iPhone 13,2269,95,248,,再见爱人官微,2024-11-27 12:15:00,False,1822398137,八酱日常,5105098739681681	,P28DLECE9,再见爱人专组热议：业内人士对《再见爱人》节目伦理的讨论#麦琳穿搭##对麦琳的声讨不应是再见爱人的看点# ,,"https://wx1.sinaimg.cn/large/001ZkB0lly1hw01hb5lspj60le2g0nkq02.jpg,https://wx3.sinaimg.cn/large/001ZkB0lly1hw01hbgtxdj60u01ebqfp02.jpg,https://wx1.sinaimg.cn/large/001ZkB0lly1hw01hbt3ogj60u01eqwu202.jpg,https://wx1.sinaimg.cn/large/001ZkB0lly1hw01hc2ylxj60zo0s3n1002.jpg,https://wx2.sinaimg.cn/large/001ZkB0lly1hw01halqzhj60zo1ie15b02.jpg,https://wx1.sinaimg.cn/large/001ZkB0lly1hw01hcasxfj60zn0hen0702.jpg,https://wx2.sinaimg.cn/large/001ZkB0lly1hw01hckp8xj60zn1ldk7u02.jpg,https://wx3.sinaimg.cn/large/001ZkB0lly1hw01hcumlaj60zo0zgwl202.jpg,https://wx1.sinaimg.cn/large/001ZkB0lly1hw01kzhec0j60zn0xodok02.jpg",,,2024-11-26T23:10:50,,2968,107,510,"麦琳穿搭,对麦琳的声讨不应是再见爱人的看点",,2024-11-26 23:10:50
5105266070915056	,P2cZF3Q2Y,原来最熟悉的陌生人是美颜相机里的自己，现在最熟悉的陌生人是线上早会前置摄像头里素颜油头黑眼圈的自己。 ,,,,,2024-11-27T10:15:45,iPhone 13,321,13,8,,,2024-11-27 10:15:45,True
5105083819765541	,P28fHEYsJ,这种电视剧别让黄子韬跟黄晓明多看。,,,,,2024-11-26T22:11:33,iPhone 13,874,71,18,,,2024-11-26 22:11:33,False,6705411161,仙女日常ing,5104148668484959	,P1JVozBkb,"好爱这种反差！表面冷酷的男主库库给老婆做了一顿早饭！现在拨打的电话
仙女日常ing的微博视频
 ",,,"https://f.video.weibocdn.com/o0/M6epauBSlx08jP9GqgPu01041200p0tt0E010.mp4?label=mp4_720p&template=960x720.25.0&ori=0&ps=1CwnkDw1GXwCQx&Expires=1732887899&ssig=%2BB7iXwzjfH&KID=unistore,video",,2024-11-24T08:15:36,微博视频号,1446,91,78,,,2024-11-24 08:15:36
5105029952832948	,P26QPbSYI,可以下饺子的时候吃吗。,,,,,2024-11-26T18:37:29,iPhone 13,95,29,16,,,2024-11-26 18:37:29,False,2963701462,Pangballer,5105027687123832	,P26NatTew,"推荐老干妈这款辣酱，推荐理由如下：
1️⃣好吃！酸辣口，番茄味很足，但也不会过酸，辣度对我来说刚好，总体很清爽，最适合拿来做汤底，好够味哦。
2️⃣配料干净，只有番茄辣椒大蒜味精盐糖。
3️⃣热量超低，一整瓶也才150卡。
4️⃣便宜，一瓶只要7块钱。 ",,https://wx3.sinaimg.cn/large/b0a67ed6gy1hvztflbfidj22c0340npe.jpg,https://video.weibo.com/media/play?livephoto=https%3A%2F%2Flivephoto.us.sinaimg.cn%2F0036RmT0gx08jTrg7VXh0f0f0100kVEA0k01.mov,,2024-11-26T18:28:30,iPhone 12 Pro Max,86,20,31,,,2024-11-26 18:28:30
5105016165371626	,P26uAmxp8,"你先试试看这篇
新世界大门系列 | 如果为了一劳永逸的完美笑容做牙贴面，那你就大错特错了
 //@珍珍喜鹊:看着有点心动，做贴面能先模拟下效果么",,,,,2024-11-26T17:42:43,iPhone 13,22,16,5,,珍珍喜鹊,2024-11-26 17:42:43,False,6292040160,果冻出走,5104966798149893	,P25cXyc9T,"#爱豆医美# 乐言旧照跟现在微妙的区别感除了额头发型妆造，其实最大的改变就是口周。
图一到图三的左边都略微有点瘪嘴形态，鼻子跟下巴的落差显得她的嘴没什么存在感且唇薄。
做完贴面之后口周立马饱满，图二这个上下唇的恰好感就出来了。
但是这种只适合原来真的瘪嘴且人中短的人士，比如图四也是。反面教材太多，一不留神就做完凸嘴嘴位下降。",,"https://wx4.sinaimg.cn/large/006ROL4Igy1hvzm9smlvpj329w1pf7l9.jpg,https://wx4.sinaimg.cn/large/006ROL4Igy1hvzm9t73zgj329w1pf4du.jpg,https://wx1.sinaimg.cn/large/006ROL4Igy1hvzm9tpap9j329w1pfapd.jpg,https://wx1.sinaimg.cn/large/006ROL4Igy1hvzmfv8eyxj329w1pf7mz.jpg",,,2024-11-26T14:26:33,iPhone 13,500,61,18,爱豆医美,,2024-11-26 14:26:33
5104975891661501	,P25rD6Yep,这种评论都能有1700多赞啊，吓人。//@海边有小仙女:八个月还胎停不是自己作的吗还能是什么呢？胎儿能活八个月说明本身是健康的，都快出生了//@SZY微博:抽烟的是谁啊,,,,,2024-11-26T15:02:40,iPhone 13,2336,73,28,,"海边有小仙女,SZY微博",2024-11-26 15:02:40,False,2653906910,娱乐榜姐,5104897793982557	,P23pFgI2N,#疑似再见爱人离职剪辑师爆料#疑似《再见爱人》离职剪辑师爆料了一些内容，#再见爱人#节目组回应争议：有人冒称节目组前员工，捏造虚假内容以博眼球，给嘉宾和节目带来严重影响。对此，我们将保留进一步追究法律责任的权利。 ,,"https://wx3.sinaimg.cn/large/9e2f67degy1hvzlm4hcsnj20hp0czjwt.jpg,https://wx1.sinaimg.cn/large/9e2f67degy1hvzeguc2dwj20j60yjdhp.jpg,https://wx4.sinaimg.cn/large/9e2f67degy1hvzeguc4kej20j60jaabm.jpg,https://wx1.sinaimg.cn/large/9e2f67degy1hvzegucvg3j20j60fc75a.jpg,https://wx2.sinaimg.cn/large/9e2f67degy1hvzegubxwrj20go0gogme.jpg",,,2024-11-26T09:52:20,微博网页版,37459,2065,273,"疑似再见爱人离职剪辑师爆料,再见爱人",,2024-11-26 09:52:20
5104972108923966	,P25lwBrwW,回复@曼祈:你换个思路，看看假体鼻基底。鼻基底能让人中变长但是某些情况下还能改善凸嘴。（或者鼻+鼻基底）//@曼祈:我是人中短嘴凸，本来打算去贴面，看姐分析，打算放弃了,,,,,2024-11-26T14:47:38,iPhone 13,15,17,6,,"曼祈,曼祈",2024-11-26 14:47:38,False,6292040160,果冻出走,5104966798149893	,P25cXyc9T,"#爱豆医美# 乐言旧照跟现在微妙的区别感除了额头发型妆造，其实最大的改变就是口周。
图一到图三的左边都略微有点瘪嘴形态，鼻子跟下巴的落差显得她的嘴没什么存在感且唇薄。
做完贴面之后口周立马饱满，图二这个上下唇的恰好感就出来了。
但是这种只适合原来真的瘪嘴且人中短的人士，比如图四也是。反面教材太多，一不留神就做完凸嘴嘴位下降。",,"https://wx4.sinaimg.cn/large/006ROL4Igy1hvzm9smlvpj329w1pf7l9.jpg,https://wx4.sinaimg.cn/large/006ROL4Igy1hvzm9t73zgj329w1pf4du.jpg,https://wx1.sinaimg.cn/large/006ROL4Igy1hvzm9tpap9j329w1pfapd.jpg,https://wx1.sinaimg.cn/large/006ROL4Igy1hvzmfv8eyxj329w1pf7mz.jpg",,,2024-11-26T14:26:33,iPhone 13,500,61,18,爱豆医美,,2024-11-26 14:26:33
5104966798149893	,P25cXyc9T,"#爱豆医美# 乐言旧照跟现在微妙的区别感除了额头发型妆造，其实最大的改变就是口周。
图一到图三的左边都略微有点瘪嘴形态，鼻子跟下巴的落差显得她的嘴没什么存在感且唇薄。
做完贴面之后口周立马饱满，图二这个上下唇的恰好感就出来了。
但是这种只适合原来真的瘪嘴且人中短的人士，比如图四也是。反面教材太多，一不留神就做完凸嘴嘴位下降。",,"https://wx4.sinaimg.cn/large/006ROL4Igy1hvzm9smlvpj329w1pf7l9.jpg,https://wx4.sinaimg.cn/large/006ROL4Igy1hvzm9t73zgj329w1pf4du.jpg,https://wx1.sinaimg.cn/large/006ROL4Igy1hvzm9tpap9j329w1pfapd.jpg,https://wx1.sinaimg.cn/large/006ROL4Igy1hvzmfv8eyxj329w1pf7mz.jpg",,,2024-11-26T14:26:33,iPhone 13,500,61,18,爱豆医美,,2024-11-26 14:26:33,True
5104700863023620	,P1Yi2cGA4,属于我的专属定制墨菲定律：每次下雨永远只会穿不带帽子的外套。 ,,,,,2024-11-25T20:49:49,iPhone 13,124,23,2,,,2024-11-25 20:49:49,True
5104640574357794	,P1WINihF0,人的颜值气质被业务能力影响最大的例子是不是章雨？他是全娱乐圈最接近那张河童流传图的男明星，但是很意外大家都对他的丑不太张口。 ,,,,,2024-11-25T16:50:14,iPhone 13,3778,219,128,,,2024-11-25 16:50:14,True
