id,bid,正文,头条文章url,原始图片url,视频url,位置,日期,工具,点赞数,评论数,转发数,话题,@用户,完整日期,是否原创,源用户id,源用户昵称,源微博id,源微博bid,源微博正文,源微博头条文章url,源微博原始图片url,源微博视频url,源微博位置,源微博日期,源微博工具,源微博点赞数,源微博评论数,源微博转发数,源微博话题,源微博@用户,源微博完整日期
5104577032752325	,P1V4jby0l,去曲曲大女人1v1把老头弄穷。,,,,,2024-11-25T12:37:46,iPhone 13,740,43,22,,,2024-11-25 12:37:46,False,2962520661,搜狐韩娱,5104557833323518	,P1UzldWB8,"#郑雨盛有交往对象# 【郑雨盛有正在交往的素人女友 女友称不知道私生子与文佳庇的存在】25日，据报道，承认私生子存在的演员郑雨盛（51岁）正在热恋中。郑雨盛与模特文佳庇（35岁）就结婚及养育等问题产生矛盾，而郑雨盛现在有正在交往的恋人。该素人女友是除了最近爆出恋爱绯闻的演员申贤彬等人之外的第三位和郑雨盛曝出恋情的人。#郑雨盛有女友#25日，据tenasia的采访，郑雨盛有一位交往了很长时间的恋人。据身边人透露，该女子作为素人，与年龄较大的郑雨盛交往并不轻松。据悉，郑雨盛和恋人与被称为""清潭夫妇""的李政宰林世玲情侣已经公开进行过四人约会。
据说，该恋人不知道郑雨盛有私生子的事实和文佳庇的存在，受到了很大的冲击。
另外，对于郑雨盛是否与目前正在恋人交往的当时文佳庇有关系，也有一些说法。 因为与恋人交往时间超过1年，文佳庇的怀孕时间则是去年6月。 就算是与文佳庇断绝关系后见面，郑宇成也无法避免明知私生子存在，却开始与恋人交往的道义上的批评。
郑雨盛24日承认了文佳庇和私生子的存在。 据《亚洲新闻》报道，郑雨盛是今年3月出生的文佳庇儿子的亲生父亲。 郑雨盛和文佳庇过去不是恋人关系，但文佳庇怀上了郑雨盛的孩子。 据多名亲信透露，文佳庇希望与郑雨盛结婚，但郑雨盛除了经济上的支援外，并不希望分担结婚及养育问题。
某媒体报道说，郑雨盛为孩子起胎名，和文佳庇一起了解医院和产后调理院等，为孩子的诞生感到高兴，但与本报采访的内容在细节内容和语调上存在不小的差异。
据多名知情人士透露，郑雨盛和文佳庇直到最近还见面讨论了结婚和养育等问题，但未能达成圆满的协议。文佳庇去年6月与郑雨盛见过几次面，并于10月公开了怀孕消息。 文佳庇希望结婚，但郑雨盛斩钉截铁地表示不能结婚，并询问了她想要什么。 文佳庇没有回复就中断了联系，到了分娩的时候再次联系，但是郑雨盛不结婚的态度没有改变。 事实上，他的立场是只用钱来负责。 文佳庇最近表示""鼓起勇气""，通过SNS公开绝密生育和儿子的存在也是出于这个原因。
这是郑雨盛的表里不一的行为。 有人指出，高喊难民救助的他，只向自己的血脉和向孩子母亲承诺经济援助，而不是负全部责任，这太虚伪了。 很多人呼吁""在高喊保护难民之前，先对血脉负责"" 期间，他不仅积极解决难民问题，还积极发出政治声音，树立了""清醒的市民""的对外形象。 但是，他本人却表现出缺乏道德性的行为，因此难免会受到伪善者的批评。
对于与不是恋人关系的文佳庇发生无法负责的关系，新生命诞生一事，部分人背后议论说，不干净的私生活和女性经历暴露无遗。 演艺界认为""该爆发的爆发了""。 再加上在有恋人的情况下发生了这样的事情，预计很难恢复形象。 以善良、耿直的形象示人的文佳庇的伪善已经大白于天下。",,https://wx1.sinaimg.cn/large/b0947a55ly1hvybgfjo65j20jl0p37dv.jpg,,,2024-11-25T11:21:28,微博网页版,760,86,81,"郑雨盛有交往对象,郑雨盛有女友",,2024-11-25 11:21:28
5104555690035953	,P1UvT09lT,"有个前几年买的帆布包，这俩是模特图，包型还可以。
看电影的时候瞅到宋佳那个白色粉字的帆布袋我对象说：好像你今天背的这个。
我：感觉她的帆布袋重点是在文字，不是造型。 ",,"https://wx2.sinaimg.cn/large/006ROL4Igy1hvyb3qrfm0j30k80m8wi1.jpg,https://wx3.sinaimg.cn/large/006ROL4Igy1hvyb8e15uhj30l30l4wi8.jpg",,,2024-11-25T11:12:57,iPhone 13,287,27,0,,,2024-11-25 11:12:57,True
5104360864879210	,P1PrEktiW,我22年真没想到她真接了好东西。 ,,https://wx3.sinaimg.cn/large/006ROL4Igy1hvxoulepmuj30wi1yce81.jpg,,,2024-11-24T22:18:47,iPhone 13,5229,197,100,,,2024-11-24 22:18:47,True
5104322917958072	,P1Osrxog0,一米六穿bm的裤子每次都觉得这裤子比我仇人的命还长。 ,,,,,2024-11-24T19:47:59,iPhone 13,535,38,5,,,2024-11-24 19:47:59,True
5104312521328531	,P1ObG5zBV,真理：人肿了眼睛一定会变小。 ,,https://wx4.sinaimg.cn/large/006ROL4Igy1hvxi3gan9yj329w1pfwse.jpg,,,2024-11-24T19:06:41,iPhone 13,621,44,11,,,2024-11-24 19:06:41,True
5104259424847707	,P1MO2kl6P,对世界失望//@我讨厌鸡和坏蛋:回复@果冻出走:都打药的 俺家卖水果的//@我讨厌鸡和坏蛋:姐 少吃草莓 都是打药的,,,,,2024-11-24T15:35:42,iPhone 13,677,90,57,,"我讨厌鸡和坏蛋,果冻出走,我讨厌鸡和坏蛋",2024-11-24 15:35:42,False,6292040160,果冻出走,5104226927380667	,P1LXCuY31,最近重点只干一件事：等草莓跟车厘子降价。 ,,,,,2024-11-24T13:26:34,iPhone 13,999,106,114,,,2024-11-24 13:26:34
5104226927380667	,P1LXCuY31,最近重点只干一件事：等草莓跟车厘子降价。 ,,,,,2024-11-24T13:26:34,iPhone 13,999,106,114,,,2024-11-24 13:26:34,True
5103929264441138	,P1EdwiDlg,讨论别人的相亲对象，我学会测字。 ,,https://wx2.sinaimg.cn/large/006ROL4Igy1hvwbaah3fbj30s30uewj3.jpg,,,2024-11-23T17:43:46,iPhone 13,7108,236,234,,,2024-11-23 17:43:46,True
5103839086642575	,P1BS4rS2j,画半个多小时的妆，眉毛鼻影高光美瞳口红全化了，一照镜子就这样： ,,https://wx4.sinaimg.cn/large/006ROL4Igy1hvttzdrcorj30kz0g1wgg.jpg,,,2024-11-23T11:45:25,iPhone 13,1643,104,195,,,2024-11-23 11:45:25,True
5103638458145453	,P1wEtyb0h,感觉是因为这首歌热闹，太适合演唱会。（也不知道这首歌是啥）,,,,,2024-11-22T22:28:12,iPhone 13,258,46,21,,,2024-11-22 22:28:12,False,6739152721,补课老师今正疯,5103598122043136	,P1vBq8zvO,"#MAMA颁奖礼# 宝石盒每次现场都真的好像一群上蹿下跳的疯猴子，有一种很原始的感觉。虽然人不太认得清但是不妨碍我每次刷到都点开尝尝。 
补课老师今正疯的微博视频
 ",,,"https://f.video.weibocdn.com/u0/pfm5uMPtgx08jN992oyQ01041202T2XL0E020.mp4?label=mp4_720p&template=1224x684.25.0&ori=0&ps=1CwnkDw1GXwCQx&Expires=1732887901&ssig=mDEBGyfNwj&KID=unistore,video",,2024-11-22T19:47:55,微博视频号,1339,64,190,MAMA颁奖礼,,2024-11-22 19:47:55
5103612951003915	,P1vZl4dab,看小图我以为是存，然后发现了存化的精髓其实不仅是五官，而是清爽的马尾跟简单的白T跟清纯配色运动外套。 ,,https://wx2.sinaimg.cn/large/006ROL4Igy1hvvaxlguk0j30ku0mwtc0.jpg,,,2024-11-22T20:46:51,iPhone 13,1074,81,14,,,2024-11-22 20:46:51,True
5103601627956992	,P1vH4xnYA,能发十一万条骂人不觉得奇怪，别人删了骂人的评论反而觉得值得奇怪。,,,,,2024-11-22T20:01:51,iPhone 13,7435,123,423,,,2024-11-22 20:01:51,False,2766575417,听月娱乐,5103529784772176	,P1tPck1sA,"麦琳通宵删评论
11万条评论，花了十几分钟就删了1万多条！最后删到9000多条......剩下的9000多条反省一下为什么没有被删
 ",,"https://wx4.sinaimg.cn/large/a4e69739gy1hvuzp7zezdj20wg1uvgy9.jpg,https://wx1.sinaimg.cn/large/a4e69739gy1hvuzp8lr97j20wh1uzajb.jpg,https://wx2.sinaimg.cn/large/a4e69739gy1hvuzp9n3syj20u11q8wlz.jpg,https://wx3.sinaimg.cn/large/a4e69739gy1hvuzpa9hurj20wh14kjyj.jpg",,,2024-11-22T15:16:22,iPhone客户端,79175,3226,3274,,,2024-11-22 15:16:22
5103538841586404	,P1u3O6EHa,很多人： ,,https://wx3.sinaimg.cn/large/006ROL4Igy1hvv2g7bg09j30wi078dgs.jpg,,,2024-11-22T15:52:22,iPhone 13,528,11,14,,,2024-11-22 15:52:22,True
5103254172074908	,P1mEF8HMg,填完一个表发现因为错删一行公式全乱了。 ,,https://wx3.sinaimg.cn/large/006ROL4Igy1hvu5qw6qi5j30wi0vr7ab.jpg,,,2024-11-21T21:01:11,iPhone 13,415,42,3,,,2024-11-21 21:01:11,True
5103240188264782	,P1mi6yG2W,转到晓彤两口子的家庭群。,,,,,2024-11-21T20:05:36,iPhone 13,1005,71,55,,,2024-11-21 20:05:36,False,7576467750,康熙万事屋,5103192436115286	,P1l35pERE,小S 最近和酒精分手之后 状态太好了吧🥹 请大家喝咖啡吃蛋糕🍰 #小S戒酒后状态# ,,"https://wx4.sinaimg.cn/large/008gK5mKgy1hvtymoru91j30zu14xdm6.jpg,https://wx3.sinaimg.cn/large/008gK5mKgy1hvtylcbjpnj31j021ctta.jpg,https://wx1.sinaimg.cn/large/008gK5mKgy1hvtylb1r8rj31yy2ml4qp.jpg,https://wx4.sinaimg.cn/large/008gK5mKgy1hvtylpeq15j30u01hcwou.jpg",https://video.weibo.com/media/play?livephoto=https%3A%2F%2Flivephoto.us.sinaimg.cn%2F002S5q47gx08jLmrAwmQ0f0f0101D0Nw0k02.mov,,2024-11-21T16:55:52,B2给我的iPhone 15 Pro,8092,472,753,小S戒酒后状态,,2024-11-21 16:55:52
5103175157943575	,P1kBdxkub,"太困了趴在桌上偷着睡着了10分钟，醒来之后眼睛完全看不清，感觉近视一千度。
盯着屏幕的邮件发愣，怎么看guys都是gays，Dear all都是 Dead all。
好像来到了真实的世界。 ",,,,,2024-11-21T15:47:13,iPhone 13,496,26,10,,,2024-11-21 15:47:13,True
5103153725051855	,P1k2Elcdx,"针对下颌线，inmode n次 +溶脂超声多管齐下都不如打个下巴或者像图二一样伸脖子凹下造型。
其实她好适合健身瘦身，应该会再上一个台阶。 ",,"https://wx2.sinaimg.cn/large/006ROL4Igy1hvtu32e4anj30sg0sgn2q.jpg,https://wx3.sinaimg.cn/large/006ROL4Igy1hvtu391t2wj30lb0uc42n.jpg",,,2024-11-21T14:22:03,iPhone 13,1339,110,29,,,2024-11-21 14:22:03,True
5103090862654126	,P1ipgb8su,第一季说的全是感情，这一季说的全是牵制关系，一个极端到另一个极端。感觉也是适应这几年的社会变化，大家现在看到谈情说爱会觉得你在干嘛，婚姻队友化。//@Treella:最好的一年 无人在意 最差的一年 全民狂欢,,,,,2024-11-21T10:12:15,iPhone 13,897,36,47,,Treella,2024-11-21 10:12:15,False,1936946913,Treella,4694542513340867	,KDFtVe16X,"再见爱人，今年最好的综艺，导演组牛逼
爱情太美了！！！珍惜那个有爱的人 ",,,,,2021-10-21T01:06:58,iPhone客户端,41,7,55,,,2021-10-21 01:06:58
5102899246403356	,P1dqcqRNW,"长靴我喜欢日系这种，去年买了图二，今年又想买图三。
但是很多人觉得这种过时了，不好搭配哈哈哈哈。 ",,"https://wx3.sinaimg.cn/large/006ROL4Igy1hvt0z2pn7nj30wi07v3zg.jpg,https://wx2.sinaimg.cn/large/006ROL4Igy1hvt0z4d5nfj30wi1yc7wh.jpg,https://wx1.sinaimg.cn/large/006ROL4Igy1hvt0z2342bj30wi1ngdod.jpg",,,2024-11-20T21:30:50,iPhone 13,227,102,7,,,2024-11-20 21:30:50,True
5102883198471899	,P1d0jzxVx,今天我的女领导好心跟我说，我曾经因为没有交待而被“有心人”告过我入职cheating。（关注久的应该都知道我上一段工作小领导让我陪酒跟讨好领导的经历）,,,,,2024-11-20T20:27:04,iPhone 13,585,46,0,,,2024-11-20 20:27:04,False,6292040160,果冻出走,5102882162739714	,P1cYEbuIW,"提问：如果在上一家公司因为领导让你暗示你讨好色胚大领导而闹掰离职。
当你去下一家面试的话，你会一五一十地把这个理由给下一家公司说吗？
（前提，色胚大领导还在同行圈内当大买方） ",,,,,2024-11-20T20:22:57,iPhone 13,621,47,9,,,2024-11-20 20:22:57
5102882162739714	,P1cYEbuIW,"提问：如果在上一家公司因为领导让你暗示你讨好色胚大领导而闹掰离职。
当你去下一家面试的话，你会一五一十地把这个理由给下一家公司说吗？
（前提，色胚大领导还在同行圈内当大买方） ",,,,,2024-11-20T20:22:57,iPhone 13,621,47,9,,,2024-11-20 20:22:57,True
5102782312349732	,P1anB9RgU,总是被网红店看着像模像样外套但是售价才199的链接吸引点进去然后发现这价格只是这套里的一个薄款小裤衩。 ,,,,,2024-11-20T13:46:10,iPhone 13,916,44,17,,,2024-11-20 13:46:10,True
5102780201046671	,P1akc4ohN,"跟我大米先生拼桌这俩人应该是团队小领导。
女生说：你觉得Jerome跟Zack怎么样，我觉得他俩特别务虚。比如Jerome，我跟他说的事就过于上心，其他人给他点活他就各种找理由推，写周报编的内容一看就能看出来。
原来领导这些都看在眼里。
叫Jerome跟Zack做广告的男的小心了，你们领导说马上要边缘化你们然后把你俩裁了。",,,,,2024-11-20T13:37:48,iPhone 13,620,19,2,,,2024-11-20 13:37:48,True
5102750776166661	,P19yJpSeh,"看到有人在农村流水席的小红书记录下面冷眼评论不干净的就来气。
我们农村流水席本来就是这样的！这么挑想吃高级村宴有本事让乔心跟她的潮汕老公下个月回村摆酒请你。 ",,,,,2024-11-20T11:40:52,iPhone 13,818,82,2,,,2024-11-20 11:40:52,True
5102562556773656	,P14F9sq8w,学到了新知识，和服手提包的大小跟我侄女的笔袋差不多大。帮我外公藏个山寨二手手机都够呛。 ,,"https://wx2.sinaimg.cn/large/006ROL4Igy1hvry7b01rzj31gc1dlkgj.jpg,https://wx2.sinaimg.cn/large/006ROL4Igy1hvry7bgygrj30wi0esdj0.jpg",,,2024-11-19T23:12:57,iPhone 13,173,30,3,,,2024-11-19 23:12:57,True
5102515601279207	,P13rq5mMn,"淘宝那些模特穿冬装为什么这么好看，因为很多都是里面很少的打底直接套的外套。
很多衣服一旦里面感觉有厚度了就显胖，臃肿，不好看。所以打底衣除了舒服，关键是要薄跟贴，套衣服才好看。
这个牌子S家的打底衣就符合，很贴，穿衣服好看。 
相比其他牌子厚度更薄，他家这个叫“面膜衣”，意思也是贴在身上的意思。确实也是贴在身上，你穿上不会有任何鼓包或者凸起，是有包裹感但是不紧绷的感觉。我试过在这件外面再套那种稍微紧身的毛衣，完全看不出来，你穿上这个也不会觉得毛衣很扎。
天气干燥的话这种衣物很容易有静电，这款有添加保湿因子，不会有静电的困扰。
设计是大圆领，不会露出来，弹力也大，可以随便撑。而且比较神奇的是这件虽然薄但是密度挺好，所以上身聚气，不会冷。
好配衣服，不冷，舒服，这几个条件能混一起就已经挺好了。我个人觉得这款适合南方过冬，适合配在“温度需要打底但是造型不太能接受打底”的穿搭情况下，冬天也想穿衣服有淘宝那种清爽效果的都可以试试。价格也不贵。",,"https://wx3.sinaimg.cn/large/006ROL4Igy1hvrswt5tytj30sg0p0q7k.jpg,https://wx1.sinaimg.cn/large/006ROL4Igy1hvrswypvroj31ib20fnpd.jpg,https://wx2.sinaimg.cn/large/006ROL4Igy1hvrswx7yjzj31o0280npd.jpg,https://wx2.sinaimg.cn/large/006ROL4Igy1hvrswuxr7ej31o0280kjl.jpg,https://wx3.sinaimg.cn/large/006ROL4Igy1hvrswz8qt1j30zj1ben4z.jpg,https://wx1.sinaimg.cn/large/006ROL4Igy1hvrsx18lb7j31o0280hdt.jpg",,,2024-11-19T20:06:22,iPhone 13,121,49,6,,,2024-11-19 20:06:22,True
5102511685896465	,P13l6oJWh,还有一点，可以有凸眼美女，但是不可能有凸眼帅哥，男的没有眉弓等于没有灵魂。,,,,,2024-11-19T19:50:48,iPhone 13,513,46,27,,,2024-11-19 19:50:48,False,6973280807,在也门钓鲑鱼,5102508764038177	,P13gogWvT,感觉眼睛圆圆的男的比较容易可爱，性魅力略微缺乏，例如bk，但眼睛长长的男的就比较性感，例如赵寅成。 ,,,,,2024-11-19T19:39:12,,1741,221,66,,,2024-11-19 19:39:12
5102423116616006	,P112frL7M,感觉我再不去看《好东西》就会成为我朋友嘴里不懂欣赏电影的无聊坏东西。 ,,,,,2024-11-19T13:58:52,iPhone 13,1291,112,11,,,2024-11-19 13:58:52,True
5102376865764064	,P0ZPEobuM,"之前看到麦琳那个耻骨分离是没概念的，直到最近我自己四个多月了开始有耻骨疼跟坐骨神经疼。
这两种疼会让你躺着的时候只要想挪一下就像抽筋，只要姿势不对就一直像阳的时候那种肌肉疼，整夜整夜持续。简单来说我昨天晚上疼到两点半了还没睡着，今天早上七八点又上班了。
而她这个估计比我的还严重千百倍。
没切身理解过生育的难受还是挺难设身处地的，当然有些人可能体质比较好，没相似感受，那也都少说几句，都有不容易的时候。",,,,,2024-11-19T10:55:05,iPhone 13,3357,676,34,,,2024-11-19 10:55:05,True
5102364797174201	,P0Zwbu6kV,我觉得麦琳就是性格差点，但是这世上性格不好的人多了去了，光是你办公室加隔壁办公室可能加起来就有一小组，人人都要骂的话你晚饭都没时间吃。 ,,,,,2024-11-19T10:07:07,iPhone 13,4903,162,58,,,2024-11-19 10:07:07,True
5102353302424993	,P0ZdEaaQN,"冈田将生真的算状态老化较快的日本男星之一了。
十五年前我在本科学校的FTP看他跟井上真央演的《属于你的我的初恋》的时候他还是长图一这个样子。
才89年生的人，感觉已经颧骨发腮都来了两轮发育，唇储量完全告急，笑弧也可怕。法令纹倒是天生就有的骨骼问题引起的，但是感觉是没上心，越来越严重。 ",,"https://wx3.sinaimg.cn/large/006ROL4Igy1hvra9hhui0j30go0ksdid.jpg,https://wx3.sinaimg.cn/large/006ROL4Igy1hvra9gyc3ej30bw0humya.jpg",,,2024-11-19T09:21:27,iPhone 13,427,68,11,,,2024-11-19 09:21:27,True
5102346048898074	,P0Z1WBkNk,也还成了，比嫁给已经开始长老年斑的中年相声演员更好。//@文武大大卷儿:@果冻出走 坂口out,,,,,2024-11-19T08:52:38,iPhone 13,356,27,32,,"文武大大卷儿,果冻出走",2024-11-19 08:52:38,False,1808146940,唇样,5102265117180290	,P0WVpu7V8,男演员#冈田将生#(35)与女演员#高畑充希#(32)官宣结婚，近日正式发表！两人在今年6月播出的双主演电视剧《1122好夫妇》中首次合作饰演夫妇，拍摄是在去年进行的，剧集结束后今年开始了交往，现在正在调整结婚日期。两人向父母、亲属、好友传达了结婚的消息，也向电视剧、电影等各自的工作点报告了喜讯，据说高畑委托了高级品牌制作婚纱照用的礼服。恭喜🎉#冈田将生高畑充希结婚#,,"https://wx2.sinaimg.cn/large/6bc621fcgy1hvqzzx43doj20mu0nux5d.jpg,https://wx4.sinaimg.cn/large/6bc621fcgy1hvqzzvuxuzj20yi14zail.jpg,https://wx1.sinaimg.cn/large/6bc621fcgy1hvr05eryl1j21hc0u04d9.jpg,https://wx3.sinaimg.cn/large/6bc621fcgy1hvr05e8ajyj20xc0m8taf.jpg,https://wx2.sinaimg.cn/large/6bc621fcgy1hvr05hebquj20ku0vb0u1.jpg,https://wx3.sinaimg.cn/large/6bc621fcgy1hvr05i8arrj20qt0rsgnz.jpg,https://wx1.sinaimg.cn/large/6bc621fcgy1hvr05gz1zuj20kk0xfwo4.jpg,https://wx2.sinaimg.cn/large/6bc621fcgy1hvr05dsl3ij20zk1j0qv5.jpg,https://wx1.sinaimg.cn/large/6bc621fcgy1hvr05hv068j20ku0v9jt9.jpg,https://wx3.sinaimg.cn/large/6bc621fcgy1hvr05fqemmj216n1hctj0.jpg,https://wx4.sinaimg.cn/large/6bc621fcgy1hvr05gav1dj216n1hcal1.jpg,https://wx2.sinaimg.cn/large/6bc621fcgy1hvr05f9q32j216n1hc7fu.jpg",,,2024-11-19T03:31:02,,3195,322,1899,"冈田将生,高畑充希,冈田将生高畑充希结婚",,2024-11-19 03:31:02
