id,bid,正文,头条文章url,原始图片url,视频url,位置,日期,工具,点赞数,评论数,转发数,话题,@用户,完整日期,是否原创,源用户id,源用户昵称,源微博id,源微博bid,源微博正文,源微博头条文章url,源微博原始图片url,源微博视频url,源微博位置,源微博日期,源微博工具,源微博点赞数,源微博评论数,源微博转发数,源微博话题,源微博@用户,源微博完整日期
5105359319207891	,P2fq3CDon,"wow！
必须要跟大家分享一下在水换皮大改造案例！！",,,,,2024-11-27T16:26:17,微博网页版,0,1,0,,,2024-11-27 16:26:17,False,5363846124,嘻嘻小小youyou,5102812055474120	,P1b9zmY4g,最后一篇，献给对比治疗前后的我，也希望正在或者已经为皮肤焦虑的小宝们，只要走正确的道理寻找到正确的医生以及正确的治疗方式，没有不能解决的问题。我是非常懂焦虑心理的，这六个月看着皮肤慢慢变好，人的状态也越来越好，减肥成功的时候，一切都会过去，只要给自己一些时间静待花开！也祝愿#在水周年庆# @在水医疗美容SKINWATER 不忘初心，与美共和的理念，希望在水长虹，我要做在水一辈子的顾客！！！！,,"https://wx4.sinaimg.cn/large/005R09pagy1hvsqulqc0mj30zo2567b8.jpg,https://wx3.sinaimg.cn/large/005R09pagy1hvsquqj5oaj30zo256tf8.jpg,https://wx2.sinaimg.cn/large/005R09pagy1hvsqv5nlw2j31sc2dshdu.jpg,https://wx3.sinaimg.cn/large/005R09pagy1hvsqvdji8cj31sc2dskjm.jpg",,,2024-11-20T15:44:22,iPhone客户端,1,2,2,在水周年庆,在水医疗美容SKINWATER,2024-11-20 15:44:22
5105357628638864	,P2fnkAfmw,"追求长期主义&综合性改善一定要盯紧【好皮疗程卡】！皮肤治疗和抗衰光电都给你包圆了！！
【11.27~11.28在水周年庆】—好皮疗程卡",,,,,2024-11-27T16:19:34,微博网页版,1,0,0,,,2024-11-27 16:19:34,False,5568513464,小韩今天又熬夜了吗,5102425411686630	,P115X74LI,"尾声痘肌治疗反馈来了！
还是要一万次感谢能被选中案例打版！！@在水医疗美容SKINWATER @大概是武陵人吧 
拿出5月份和11月对比来看，这皮肤状态稳定了不是一点两点！为期近半年的项目中基本以水光为主，因为可以从5月的检测图中看到，底层炎症是比较严重的，皮肤首先需要维稳，所以暂不以大光电为主
维稳采用了1次瑞蓝唯缇和3次氐殊，真的很值得！！姐妹们一定要试一下！明显感觉泛红爆痘这些问题大幅度下降！自此皮肤再也没有大面积爆痘过了，而且从以前洗脸就泛红转变为现在洗脸后毫无反应！主任手打也特别细致，去区分哪些部位比较严重来着重治疗！
其次出油严重是我皮肤一直存在的问题，出油会导致皮肤伴随皮肤暗沉，冒痘等问题，所以在痘肌治疗过程中，采取了刷酸➕肉毒微滴来平衡出油状况，这也很值得夸夸！！！出油情况大大减少，可以理解为今年夏天的出油量差不多为去年秋冬的出油量！以前睡一觉起来脸上油光满面，现在起床真的很干燥，清水过脸即可！这个真的不夸张，以前起床就大油田真的困扰我很久，一天下来总觉得脸上很脏！大油田了姐妹一定很能感同身受！！！
再次再次，如果防晒不到位会让皮肤色素沉积，出油也得不到改善，所以主任在前两次的水光中还复配了防晒和亮白素水光，这个真的很细心，很少能想到防晒是医美治疗过程中极其重要的一步辅助！！关键是在水还有这种功效的水光哈哈哈
后续俺就可以以简单基础的项目做日常维稳了，偶尔来点补水水光，毛孔痘坑就来点黄金微针，现在的皮肤状态我真的超级满意！长期见不到我的朋友都会夸夸我哈哈
（顺便说句，化妆都变得超级服帖了Hiahia）
最后的最后祝#在水一周年# 快乐！希望在水可以做大做强，发展得越来越好！全国开各个分店！客户的反馈和回购量也一定会告诉在水，在水是很值得的一个机构！",,"https://wx1.sinaimg.cn/large/0064QUJigy1hvrihr1833j30wi1yctwe.jpg,https://wx2.sinaimg.cn/large/0064QUJigy1hvrihs9gyfj30wi1yc4qp.jpg,https://wx4.sinaimg.cn/large/0064QUJigy1hvrihnv1ovj30wi1ycauz.jpg,https://wx2.sinaimg.cn/large/0064QUJigy1hvrikfrinhj32c01yne81.jpg,https://wx1.sinaimg.cn/large/0064QUJigy1hvrikgist9j31yn2akqv5.jpg,https://wx2.sinaimg.cn/large/0064QUJigy1hvrikhcravj32c01u5e81.jpg",,,2024-11-19T14:07:59,iPhone客户端,2,0,1,在水一周年,"在水医疗美容SKINWATER,大概是武陵人吧",2024-11-19 14:07:59
5105353744190146	,P2fh4hA30,"欢迎大家来俺们在水尽情感受什么叫严谨、细致且享受的治疗~
【11.27~11.28在水周年庆】—好皮疗程卡",,,,,2024-11-27T16:04:08,微博网页版,0,0,0,,,2024-11-27 16:04:08,False,5615875912,孩子长大不随娘,5101367700228349	,P0zzY0Xp3,"#在水周年庆#我的皮肤一直不怎么好，毛孔粗大，有痘，容易泛红，出油多，暗沉，之前只做过刷酸的项目，诉求就是希望能稳定平整光滑白一点。今年夏天通过@是醒醒吖 知道了在水，翻了下微博发现老板是鱼@大概是武陵人吧 ，位置对于我也比较方便，就决定来看一下。
看了之后就走不了了，环境啊工作人员啊医生啊都非常好。鑫鑫又高又美，皮肤超级好，Una非常专业，会帮我出最适合我的方案，她们简直就是在水的活招牌。黄医生经验丰富也很权威，他本人皮肤就特别好，给我很多信心。第一次做水光的时候很害怕，黄医生就给我上了冷风机，第二次是换了麻膏，总体就都是很痛，但是我能忍，勉强算在可以承受的范围（忽略我不由自主发抖的身体和飚出的眼泪
可见我是真的非常怕痛了
不过每次项目前有很温柔的小姐姐做舒敏，每个治疗室也有小玩偶可以抱可以捏，救了我大命了！治疗结束后会根据当日做的项目送护理包，鑫鑫也会手机上再发注意事项，定期问皮肤状态，预约下次治疗时间。
后来看鱼的微博说她不敷麻就打水光，我简直难以相信，当看到在水也有德玛莎针头的时候，就赶紧找鑫鑫报名。那一天到来的时候我又期待又忐忑，跑了几趟厕所，鑫鑫还来治疗室握住我的手安抚我，黄医生也备了冷风机在旁边，但是结果证明，这个针头真的不痛！这就是事实！！都给我把这个针头用起来！！！在水一周年了，希望今后在水越来越好，希望科技进步，有更多更好的产品和技术！！！#在水周年庆# @在水医疗美容SKINWATER @没想到是条化妆的鱼",,"https://wx1.sinaimg.cn/large/00683DRKgy1hvo50cva0ij30u0140jw8.jpg,https://wx2.sinaimg.cn/large/00683DRKgy1hvo50diufij30u0140wme.jpg,https://wx1.sinaimg.cn/large/00683DRKgy1hvo50cgm61j30u0140dn6.jpg,https://wx3.sinaimg.cn/large/00683DRKgy1hvo50e18iyj30u0140gr4.jpg",,,2024-11-16T16:05:01,iPhone客户端,2,1,1,"在水周年庆,在水周年庆","是醒醒吖,大概是武陵人吧,在水医疗美容SKINWATER,没想到是条化妆的鱼",2024-11-16 16:05:01
