id,bid,正文,头条文章url,原始图片url,视频url,位置,日期,工具,点赞数,评论数,转发数,话题,@用户,完整日期,是否原创,源用户id,源用户昵称,源微博id,源微博bid,源微博正文,源微博头条文章url,源微博原始图片url,源微博视频url,源微博位置,源微博日期,源微博工具,源微博点赞数,源微博评论数,源微博转发数,源微博话题,源微博@用户,源微博完整日期
5102503186400902	,P137oqRam,"相信自己的直觉吧，关键时刻能救你。
上天用你偶尔闪过的念头来救你，做梦的梦境也在告诉你真相，运气需要静下心来去用心感受。 ",,,,,2024-11-19T19:17:02,HUAWEI P40 Pro 5G,525,19,36,,,2024-11-19 19:17:02,True
5102350916126197	,P0Z9NpHHD,"早安，点赞领取好运。
甲辰年，乙亥月，丁亥日。
地支有巳的巳亥冲，在路上。
地支有寅的寅亥合。
地支有申的申亥害，地支有亥的亥亥刑。
甲木伤官坐偏印，保暖为上，在一个阴暗潮湿的环境里，心也会阴冷，烤火晒太阳吧。
乙木食神坐正印日，躺平毫无压力，不疾不徐，认真学习，天天向上，保暖，抗寒。
丙火劫财坐七杀日，七杀旺，根本无法提出反对意见，你发声会招来更大的打压控制。
丁火比肩坐正官是天乙贵人，跟同事领导出行，都是你操心，做好服务者，隐藏不悦。
戊土正印坐偏财日，被团宠，拼命消费，收包裹，被物质围着转，被物质收买人心。
己土偏印坐正财日，总感觉对方算计钱财，买东西都缺斤少两，非要找对方理论退钱。
庚金正官坐食神日，领导说一套，你做另外一套，有些话当没听见过，主打心态很稳。
辛金七杀坐伤官日，内心煎熬，不满很多，想抱怨，想哭泣，恨苍天欺负，容易失恋。
壬水丁壬合，正财坐禄来合我，日子极美，有力量，利求财，利求爱，对方主动示好。
癸水偏财坐劫财日，来一点点偏财，就被劫走了，不利财运，大家抢你手里的馒头。",,https://wx3.sinaimg.cn/large/62c0f10fgy1hvra0r0gegj22dc35s4qs.jpg,,,2024-11-19T09:11:58,HUAWEI Mate 60 Pro,186,27,7,,,2024-11-19 09:11:58,True
